content,Quality,Service,Shipping,Packing
"điện thoại mới nhưng không có củ sạc , dây sạc 2 đầu như nhau chỉ cắm vào đt không có đầu cắm vào củ sạc ? giao sản phẩm chậm so với thông báo",0,0,0,0
"mới dùng nhưng đã chập trờn, lúc vào điện lúc không, rồi không sạc được nữa rồi",1,1,1,1
sản phẩm thì ngon nhưng nhưng shipper đến giao sản phẩm vẫn chưa nhận được mã otp.gọi tổng đài hoài hết tiền điện thoại luôn nhưng không nhận được lời xin lỗi.vừa mất thời gian a shipper và mình,1,1,1,1
"tiki dối khách sản phẩm, mua sản phẩm xong không hoàn astra",1,1,1,1
vừa mua xong cái tiki giảm giá,0,0,0,0
đánh giá không tính điểm giao sản phẩm quá chậm trễ. mình đi mua tặng người thân nhưng mãi mới nhận được sản phẩm. mua 20.5tr nhưng máy rất nhanh xuống pin. face id cũng kém hơn các dòng đời thấp hơn,1,1,1,1
đánh giá không tính điểm mua điện thoại nhưng nhìn cái hộp chán thế này. chả hiểu tiki làm ăn kiểu gì. thậm chí hộp bên trong nhưng không lót đệm,1,1,1,1
"đánh giá không tính điểm sau nhiều lần gọi đến tổng đài yêu cầu giao sản phẩm, cuối cùng cũng điều người giao sản phẩm trong đêm, chất lượng tốt nhưng giao sản phẩm tệ.",0,0,0,0
mua được 10 tháng ạ. em gọi hỗ trợ theo hl nhưng không được. vẫn nhưng bảo sản phẩm ạ,0,0,0,0
"tiki giao sản phẩm trước dự kiến, tuy nhiên đóng gói chất lượng kém đối với sản phẩm giá cao tiền. chỉ có 2 miếng giấy lót trên dưới rất ẩu, nhưng không có xốp cố định sản phẩm để tránh va đập. nilon bọc ngoài điện thoại cũng không phải là loại nilon hạn chế va đập, bọc vô cùng sơ sài. nói chung khá thất vọng về cách đóng gói sản phẩm có giá trị như vậy của tiki.",0,0,0,0
"sản phẩm mua bị lỗi reset counter và panic full sau 3 ngày dùng. gọi lên tiki để đổi trả thì bị bên ghn không chấp nhận thu hồi sản phẩm, tiki làm việc lại với bên ghn 7 ngày thì cũng chả được rồi phải làm khách sản phẩm đợi thêm 7 ngày nữa để làm việc lại với bên vận chuyển khác. tới lúc thu hồi được sản phẩm thì báo đổi mới nhưng do hết sản phẩm nên muốn hoàn tiền cho mình nhưng mình không chịu, nhưng trong khi mình lên tiki xem thì thấy vẫn nhưng sản phẩm? rồi phải gọi lần nữa thì mới chịu đổi cho cái mới. chung quy lại hậu mãi tiki quá thất vọng, chỉ vì lỗ hổng bộ phận nhưng làm ảnh hưởng khách sản phẩm quá nhiều và cũng chẳng có hướng xử lý nào cụ thể cả. như kiểu không muốn đổi cho không vậy. quá thất vọng!",1,1,1,1
"sản phẩm không nhưng nguyên seal bộc ni lông. là như thế nào vậy, giải thích hộ vì không chat cho tikitrading được. vô cùng khó chịu với cách giao sản phẩm, đối tác best express nguyên 1 đống sản phẩm dễ vỡ ngỗn ngang trong thùng và nhân viên đi giao nhưng không biết mình được đi giao sản phẩm giá trị lớn và bối rối khi biết có ip13 trong thùng sản phẩm. giao sản phẩm trễ 2 ngày. thất vọng về tiki, từ đợt 11.11 thì giao sản phẩm trễ 1 tháng. tạm ổn tốt biệt tiki",1,1,1,1
"mới mở hộp màu hồng check cổng sạc thấy bị trầy như vầy, hơi thất vọng không bằng iphone 11 mình mua năm trước không bị trầy gì hết",0,0,0,0
"săn sale black friday nên mua được giá hợp lý, tiki now nên giao sản phẩm rất nhanh, tầm 1 giờ hơn là nhận được sản phẩm…vì mua sản phẩm online có giá trị tiền cao nên cũng hơi lo nhưng tiki bảo mật trong khâu vận chuyển khá tốt. nhưng sản phẩm đang dùng nên chưa có đánh giá được, nói chung hiện tại dùng tốt…sản phẩm chính hãng.",0,0,0,0
shipper giao sản phẩm không gọi trực tiếp cho người nhận - tự ý giao cho người nhà. quá đáng chê trách.,1,1,1,1
"máy đang dùng tốt. nhưng dịch vụ giao sản phẩm tiki nay không nhưng tốt như trước, làm khách rất không an tâm. sản phẩm xác nhận giao trước 11h. 10h47 shipper gọi báo có đơn sản phẩm tiki giao tại địa chỉ của mình đọc rất rõ ràng địa chỉ rồi kêu mình đọc otp để nhận sản phẩm. mình không đồng ý và yêu cầu sẽ đọc mã sau khi mình xuống nhận và kiểm tra niêm phong sản phẩm đầy đủ, thì shipper báo vậy đến trễ 30p, vô lý quá sức, trường hợp trễ thì ngay từ đầu xin lỗi và báo khach là sẽ đến trễ sao lại yêu cầu đọc mã otp trước. cuối cùng là trễ gần 1 tiếng mới tới giao. mình có gọi phản ánh ngay với chăm sóc khách sản phẩm. viết lên để mọi người cẩn thận với những trường hợp gọi kêu đọc mã otp trước, đọc xong xem như đã nhận sản phẩm, giả sử phát sinh trường hợp xấu thì do khách tiết lộ mã otp.",1,1,1,1
"dịch vụ kém, giao sản phẩm chậm hơn 1 tuần nhưng không được thông báo rõ ràng. sản phẩm mua gần 25tr nhưng giống sản phẩm chợ 25k, nhìn cách đóng gói và vận chuyển ra thùng sản phẩm bung bét thế kia là hiểu cách làm ăn ra sao. sẽ không mua lại lần 2!",1,1,1,1
"mình mua ngày 15/2/2022. lần đầu mình mua iphone trên tiki. đóng gói cẩn thận, phụ kiện đầy đủ, giao sản phẩm nhanh. nhưng màn hình bị ám vàng. mọi người mua nên kiểm tra kỹ. rất mong tiki giúp đỡ.",1,1,1,1
dịch vụ tikinow giao sản phẩm không đúng cam kết. app báo 21h30 giao nhưng phải gọi điện chăm sóc khách sản phẩm dí hoài thì tới 13h ngày hôm sau mới được giao. sản phẩm 5 tikinow 1,0,0,0,0
"dịch vụ hỗ trợ khách sản phẩm của tiki thật sự tệ ạ, do đơn sản phẩm giao đến nhà riêng của mình trễ hơn dự kiến nên mình muốn đổi địa chỉ nhận sang văn phòng làm việc nhưng phải gọi hơn chục cuộc gọi để nhờ nhân viên tiki hỗ trợ, cuối cùng mình tự gọi đến hub của gì t để nhờ nhân viên đổi địa chỉ thì 2 ngày sau là mình nhận được luôn. tổng cộng mất hết cả tuần mình mới nhận được điện thoại",1,1,1,1
"máy nguyên seal, nhưng màu hồng hơi nhạt, nhìn như màu trắng, thêm 30k để giao siêu tốc nhưng shipper cáu kỉnh, cuối giờ thang máy chậm với trẻ con nghịch xuống chậm chút xíu nhưng cáu nhặng lên, nói đi nói lại!",0,0,0,0
màu đỏ rất đẹp. nhưng gỡ seal màn hình ra thì thấy góc trái màn hình bị trầy. đã mua nhiều đồ công nghệ trên tiki nhưng lần này hơi thất vọng.,0,0,0,0
"tôi đang dùng iphone 6s khi đổi qua ip 13 thì thấy bị ám vàng, màu rất xấu và sóng yếu 1-2 vạch - tôi ở ku vực quận 9, khi so màu với vsmart vợ tôi dùng cũng không bằng. tiki liên hệ tôi đổi lại máy khác.",0,0,0,0
"tiki kiểm tra giúp, dây sạc pin khôn nhận điện thoại. khi cắm day sac vào điện thoại ip khác thì nhận, dùng dây khác thì vẫn vào, nhưng giữa dây sạc kèm điện thoại và điện thoại thì không sạc được",1,1,1,1
"giao sản phẩm chậm, micro máy bị lỗi, nhận cuộc gọi nói bên kia không nghe được.",1,1,1,1
sản phẩm mới khui seal nhưng bị trầy ngay lỗ sạc.,1,1,1,1
khung viền màn hình không thật sự sát với màn hình khi đem so với sản phẩm nhưng nguyên seal của cellphones.,0,0,0,0
"do lỗi app nên đặt bị sai màu, không hỗ trợ đổi màu dù liên hệ ngay với tổng đài sau khi đặt. đổ lỗi cho khách sản phẩm chứ không tìm hướng xử lý hỗ trợ khách sản phẩm",1,1,1,1
"hôm nay nghi ngờ mở ra testt áp thì bị mất áp suất => không nhưng khả năng chống nước nữa, không biết có bị mở máy không chưa, có bị thay thế linh kiện gì bên trong ko",1,1,1,1
sản phẩm lỗi của nhà sản xuất nhưng tiki xử lý rất lâu và rườm rà. hơn 1 tuần rồi vẫn chưa xử lí xong. rất rất rất rất rất bực mình và khó chịu!,1,1,1,1
không hai long dân phẩm thiếu chất lương,0,0,0,0
đt mua 5/3/2022. nay là 8/3/2022 đã không gọi được,1,1,1,1
"điện thoại mua bị hư phím, phím số 6 không thể nhấn được, nên không thể gọi cho bất kì nào có số 6 được. bây giờ mình biết liên hệ giải quyết vấn đề ra sao?",0,0,0,0
không thấy xuất hóa đơn vat,1,1,1,1
"nhận sản phẩm nhanh, bao bì tikinow tốt. tuy nhiên, mua 2 sản phẩm thì 1 sản phẩm không có ống nghe nói và bao bì rách nát như hình.",1,1,1,1
"hỏng ngay tuần đầu, bảo hành 2 tháng. hài",1,1,1,1
thật buồn hỏng rồi không dung được nữa khách sản phẩm gọi điện tới không nghe được,1,1,1,1
nhờ cửa sản phẩm xem lại đt giao camera bị lỗi chụp bị đóm hồng,1,1,1,1
đang xài tự nhiên mất nguồn mở không lên khu vực mình ở xa ngoài côn đảo.dien thoại làm ăn nhưng h gửi về thì làm ăn gì nữa,1,1,1,1
"bao da tặng cùng chất lượng được tốt, dễ nứt vỡ.",0,0,0,0
"mua về mấy bữa hư luôn. không gọi được, gọi cũng không chuông hay báo gì hết. chất lượng kém chất lượng quá.",1,1,1,1
"chua nhận được hóa đơn đỏ, vui lòng gửi về email:",0,0,0,0
"âm lượng nhỏ, khó nghe lắm!",0,0,0,0
tôi vẫn chưa nhận được hóa đơn vat mặc dù lúc mua có khai báo,0,0,0,0
"sử dụng bình thường, mới dùng nên chưa có sự cố, giao sản phẩm trễ 1 tuần so với lịch.",0,0,0,0
"cảm giác nó khá chậm lag lag, hay do máy đọc sách nào cũg v nhỉ",0,0,0,0
"đánh giá không tính điểm không hiểu sao những đánh giá bên trên cái nào cũng tốt nhưng sau khi mua sản phẩm thực tế xong tôi thấy thất vọng. nhà bán chỉ gửi 1 tờ hướng dẫn ghi vắn tắt kèm theo đường link để download về tự xử lý. ngày đầu liên hệ không phản hồi. ngày hôm sau thì trả lời chung chung chứ không hỗ trợ cụ thể. nói chung là đối với những ai không rành thì cài rất mất công, không dễ sử dụng như kindle. mình đang sử dụng kindle ppw4 thấy cầm nhẹ hơn libra2 khá nhiều, có thể lúc đầu chưa quen nên thấy vậy. chất lượng màn hình thì tốt hơn do có đèn vàng nhưng chênh lệch khoing nhiều lắm.",1,1,1,1
