content,Quality,Service,Shipping,Packing
"Không biết có phải do quá trình vận chuyển hay do sản phẩm lỗi, trong mùa dịch giao nhận sản phẩm cũng khó khăn nên thôi xài tạm ổn tốt",0,0,1,0
Không biết do vận chuyển hay là do sản phẩm bị lỗi,0,0,1,0
Tiki now giao sản phẩm rất nhanh,0,0,1,0
Tiki giao sản phẩm quá lâu và cũng không có báo gì,0,0,1,0
Cũng không phản hồi gì cho khách sản phẩm,0,1,0,0
Không thấy giao sản phẩm,0,0,1,0
Sản phẩm tặng kèm bình nước,0,1,0,0
Đóng gói cẩn thận rất đẹp,0,0,0,1
Hoàn toàn không phục vụ được mục đích này 1,0,1,0,0
Cửa sản phẩm đóng gói rất cẩn thận,0,0,0,1
Giao sản phẩm rất tệ,0,0,1,0
Thấy đóng gói cẩn thận,0,0,0,1
Liên hệ với nhà bán thì bảo là bình thường,0,1,0,0
Tiki giải quyết sao đây,0,1,0,0
Giao sản phẩm cho 3 tuýp keo khô queo không 1 tuýp nào nặn ra được chứ đừng nói là dán,0,0,1,0
Giao sản phẩm không đúng sản phẩm,0,0,1,0
Cửa sản phẩm bán sản phẩm hình ảnh dày chắc chắn giao sản phẩm mỏng dỏm sản phẩm nhái,0,0,1,0
Kém tý nào giao sản phẩm lâu,0,0,1,0
Giao sản phẩm nhanh,0,0,1,0
Cửa sản phẩm không để chế độ chat,0,1,0,0
Tiki liên hệ lại dùm để đổi trả,0,1,0,0
Giao sản phẩm không đúng,0,0,1,0
"Đến ngày 9/7 lúc 7g tối mình gọi lên tiki nhờ hỗ trợ đổi, tiki không đồng ý đổi trả vì đã quá 48h, mình hi vong tiki nên thay đổi hoặc tăng thêm thời gian đổi trả sản phẩm là 48h sau khi nhận sản phẩm",0,1,0,0
Thgian thu hồi giao lại quá lâu nên đành nhận,0,0,1,0
Tôi không biết liên hệ tiki như thế nào để đổi sửa,0,1,0,0
Tiki giao sản phẩm nhanh,0,0,1,0
Đề nghị cửa sản phẩm phản hồi thông tin,0,1,0,0
Giao sản phẩm nhái,0,0,1,0
Yếu cầu đổi trả,0,1,0,0
Đề nghị tiki giải quyết giúp,0,1,0,0
Không có chỗ nhắn tin với người bán,0,1,0,0
Đóng gói như kiểu cho có,0,0,0,1
Mình cần đổi sản phẩm khác mong cửa sản phẩm hỗ trợ,0,1,0,0
Giao sản phẩm quá chậm,0,0,1,0
Đề nghị cửa sản phẩm hoàn tiền,0,1,0,0
Giao sản phẩm nhanh,0,0,1,0
Mong cửa sản phẩm giải quyết giúp mình,0,1,0,0
Mong tiki giải quyết dùm,0,1,0,0
Mong tiki hỗ trợ đổi sản phẩm,0,1,0,0
Giao sản phẩm 1 túi ghi 500pcs,0,0,1,0
"Đóng gói kém, bị xẹp mất xốp phần gấp khi đóng gói",0,0,0,1
Đánh giá không tính điểm khi mở sản phẩm ra xem để lắp đặt thì cũng như tất cả các phản hồi của anh em khác,0,1,0,0
Sản phẩm giao trễ nhiều lần,0,0,1,0
Không biết do vận chuyển hay chọn cái hỏng thủng gửi không biết,0,0,1,0
Chưa có ai gọi giao sản phẩm,0,0,1,0
Tiki giao sản phẩm chậm,0,0,1,0
Bên ngoài bị trầy xước được cái giao sản phẩm nhanh,0,0,1,0
Chỉ có một điều nhỏ là hộp đóng gói bên ngoài của phin cà phê bị móm méo và rách làm ảnh hưởng một chút tính thẩm mỹ khi người nhận kém vui,0,0,0,1
E xem giao sản phẩm kiểu gì vậy,0,0,1,0
"Đóng gói sơ sài, lại không có bọc chống sốc sản phẩm bên ngoài nhìn không tinh tế như hình",0,0,0,1
1 gối tiki giao sản phẩm cũ,0,0,1,0
Đóng gói chất lượng tốt,0,0,0,1
Giá sản phẩm và sản phẩm chưa hợp lý có thể đó phi giao sản phẩm cộng vào làm nâng tiền của phẩm,0,0,1,0
Đánh giá không tính điểm nhân viên giao sản phẩm tệ,0,0,1,0
Kính mong cửa sản phẩm chú ý hơn trong công đoạn đóng gói,0,0,0,1
Dây áo gối ôm tặng kèm quá nhỏ dễ bị tuột,0,1,0,0
Giao sản phẩm lâu,0,0,1,0
Giao sản phẩm,0,0,1,0
Có nhu cầu đổi trả sản phẩm,0,1,0,0
Giao sản phẩm,0,0,1,0
Cửa sản phẩm giao sản phẩm thiếu,0,0,1,0
"Nay qua tiki mua thử vì thấy phí giao sản phẩm giá giá rẻ hơn, ai ngờ giao sản phẩm cũ kĩ",0,0,1,0
Để nghị phản hồi,0,1,0,0
Tôi muốn đổi sản phẩm thì liên hệ với ai,0,1,0,0
"Đổi trả khó khăn, tôi đã liên lạc cả tháng không thấy tiki phản hồi",0,1,0,0
"Tại sao lại giao sản phẩm lỗi, lúc giao sản phẩm cho bên thứ 3 vận chuyển các anh chị phải check sơ qua chứ nhỉ",0,0,1,0
Người bán sản phẩm trả lời tin nhắn nhanh và tận tình,0,1,0,0
Cần có câu trả lời thích đáng,0,1,0,0
"Đơn vị vận chuyển giao sản phẩm chậm trễ, thêm chính sách mới bên giao sản phẩm không cho xem sản phẩm, dạo này chán quá tiki nên xem lại việc vận chuyển đơn sản phẩm",0,0,1,0
Không đổi trả được,0,1,0,0
Nhận sản phẩm đèn không sáng trả lại anh shiper thấy buồn,0,0,1,0
Đổi trả thì cả tuần tới giờ chưa có nhận lại được,0,1,0,0
"Giao trễ 1 ngày, nói chung tạm ổn tốt xài được vì cộng giá giao sản phẩm vào nên cũng không",0,0,1,0
Phí giao sản phẩm mắc hơn 100k,0,0,1,0
Không có hướng dẫn lắp đặt người bán sản phẩm không nhiệt tình support,0,1,0,0
Đánh giá không tính điểm cửa sản phẩm không cover kỹ mặt bàn để chung chân bàn với mặt bàn khi vận chuyển làm trầy nhiều chỗ,0,0,1,0
Liên hệ lại mấy ngày không được,0,1,0,0
Tiki giao sản phẩm nhanh,0,0,1,0
Sản phẩm giao nhanh,0,0,1,0
Sản phẩm giao đến vỉ bị bể,0,0,1,0
Mong cửa sản phẩm nhanh chóng giải quyết đổi lại sản phẩm không bị lỗi,0,1,0,0
Giao sản phẩm quá chậm,0,0,1,0
Giải quyết cho khách quá tệ,0,1,0,0
Lại giao sản phẩm khác ảnh đăng,0,0,1,0
Nhắn hỏi bảo hành không có người trả lời,0,1,0,0
Đóng gói kém không chuyên nghiệp hộp đèn méo mó,0,0,0,1
Phải nhờ tiki hỗ trợ đổi sản phẩm,0,1,0,0
Giờ mình muốn liên hệ bảo hành thì như nào ah,0,1,0,0
Nhờ tiki hỗ trợ liên hệ nhà cung cấp để được bảo hành,0,1,0,0
Này nói tiki làm ăn giao sản phẩm hơn nửa tháng,0,0,1,0
Nhờ cửa sản phẩm hỗ trợ đổi lại sản phẩm mới,0,1,0,0
"Đóng gói cực kỳ ẩu, đóng gói như thế này là không được",0,0,0,1
Gọi điện thoại đường dây nóng thì không liên lạc được,0,1,0,0
Giao sản phẩm không có bánh xe như hình,0,0,1,0
Lắp ram vẫn nhận nên mình sẽ không đổi trả,0,1,0,0
Trả lại tiền hoặc giao sản phẩm bù cho tao,0,0,1,0
Giao sản phẩm nhanh,0,0,1,0
Cửa sản phẩm bán sản phẩm kiểu lừa đảo,0,1,0,0
Cả tuần nay không phản hồi,0,1,0,0
Giao sản phẩm nhanh,0,0,1,0
"Tiki là trang bán sản phẩm lừa đảo, cùng nhau tẩy chay trang lừa đảo này",0,1,0,0
Đã thanh toán hóa đơn đầy đủ cho shipper rồi,0,0,1,0
Đóng gói cẩn thận,0,0,0,1
Giao sản phẩm chậm,0,0,1,0
Cảm giác giao sản phẩm trưng bày hoặc đã qua sử dụng,0,0,1,0
Vận chuyển về tới nơi đã vỡ,0,0,1,0
Phải đổi trả,0,1,0,0
Đóng gói tốt,0,0,0,1
Giao sản phẩm không kiểm tra trước,0,0,1,0
Giao sản phẩm nhanh hơn 2 ngày,0,0,1,0
Các bạn có thể làm tốt hơn bằng cách đóng gói tốt hơn để tránh những sưt mẻ ở các góc như hình,0,0,0,1
Sản phẩm không bọc kỹ về bị tróc các góc,0,0,0,1
Đang gấp em giao ốc vít nhanh cho chi nhe,0,0,1,0
Giao sản phẩm không đúng như hình quảng cáo,0,0,1,0
Sản phẩm giao sản phẩm không đúng như trong hình ảnh 1 chút nào,0,0,1,0
Giao sản phẩm bị lỗi,0,0,1,0
"Tiki giao sản phẩm sai kết cấu sản phẩm, nhân viên giao sản phẩm không thu",0,0,1,0
Vận chuyển tốt,0,0,1,0
Yêu cầu đổi trả cái khác,0,1,0,0
Bán sản phẩm không có tâm giao sản phẩm không đúng sai mọi người không nên mua,0,0,1,0
Mình chịu tiền giao sản phẩm được không,0,0,1,0
Về vấn đề có mảnh bị bể như hình thì có thể là lỗi do bên vận chuyển,0,0,1,0
Khi giao sản phẩm đến thì khi mở sản phẩm ra thì không có phụ kiện ốc vít để gắn,0,0,1,0
Thái độ phục vụ quá tồi so với chất lượng sản phẩm,0,1,0,0
Khiếu nại 2 ngày rồi chưa có ai liên lạc giải quyết,0,1,0,0
Giao sản phẩm chậm,0,0,1,0
Giao sản phẩm nhanh,0,0,1,0
Cửa sản phẩm phản hồi lại để đổi dùm,0,1,0,0
Có lẽ lỗi ở khâu đóng gói,0,0,0,1
Yc giao lại sớm nhất,0,0,1,0
Việc đổi trả sản phẩm rất phiền nên mình cũng không cần đổi lại,0,1,0,0
Sản phẩm được gói cẩn thận có dán là dễ vỡ để giao sản phẩm không hư hại gì,0,0,1,0
Lừa đảo,0,1,0,0
Cửa sản phẩm xem giùm em có giao sản phẩm nhầm cái đế không ạ,0,0,1,0
Không biết cửa sản phẩm đóng gói kiểu gì,0,0,0,1
Đóng gói sơ sài,0,0,0,1
Đóng gói không cẩn thận,0,0,0,1
"Sản phẩm đóng gói kém, đóng gói kém nên là bóng đó cũng hỏng luôn",0,0,0,1
Giao sản phẩm 1,0,0,1,0
Giao sản phẩm nhỏ hơn so với sản phẩm mình đặt,0,0,1,0
Khi giao sản phẩm lại chỉ có 1m6,0,0,1,0
Giao sản phẩm không đúng màu tôi đã chọn,0,0,1,0
Giao sản phẩm 1m6x1m8,0,0,1,0
Giao nhanh,0,0,1,0
3 sao vì giao sản phẩm nhanh chứ không vui,0,0,1,0
Bình được giao nhanh,0,0,1,0
Do đã lỡ quá hạn gửi yêu cầu đổi trả nên mình đành chịu vậy… không biết cửa sản phẩm có hỗ trợ đổi bên ngoài không chứ vỡ như này dùng cũng không được:”,0,1,0,0
Mình đặt trên tiki bình lock lock 880ml ngày 7/10 sáng sớm chiều tiki giao tới,0,0,1,0
"Không biết do vận chuyển hay là bên kiểm định chất lượng của tiki, về dịch vụ vận chuyển: siêu nhanh",0,0,1,0
"Dịch vụ giao sản phẩm tệ, shipper hẹn thứ hai giao",0,0,1,0
"Bỏ ly nước ở bên hông balo cúi người xuống thì nước tràn đổ vào hêt người lỡ là ly cà phê nóng thì chắc bỏng người luôn qua, nói chung sản phẩm tệ không đúng kì vọng muốn đổi trả sang sản phẩm khác thì làm sao giúp mình với mình cảm ơn nhiều",0,1,0,0
Phần chăm sóc và phản hồi lại cho khách sản phẩm quá : kém,0,1,0,0
Đơn vị giao sản phẩm lại để đơn sản phẩm tình trạng như vậy,0,0,1,0
Sản phẩm bị bể nắp không đóng kín ly được nhờ tiki hỗ trợ đổi sản phẩm,0,1,0,0
Đã liên hệ đổi trả,0,1,0,0
Nếu đúng sản phẩm bị lỗi mong tiki có chính sách hỗ trợ đổi trả,0,1,0,0
Cần gấp nên chọn giao sản phẩm nhanh,0,0,1,0
Chốt cuat nắm bị gãy thế này vẫn bỏ vào trong hộp sản phẩm đóng gói và gửi cho khách thật chẳng ra làm sao hết,0,0,0,1
Giao sản phẩm nhanh,0,0,1,0
Giao sản phẩm cực kỳ lâu,0,0,1,0
Tiki giao sản phẩm nhanh,0,0,1,0
Trải nghiệm mua sản phẩm và giải quyết khiếu nại cực kỳ tệ,0,1,0,0
"Mình đã đt cho bộ phận chăm sóc khách sản phẩm, cứ đổi trả hoài thì rất là phiền cho người bán lẫn người mua",0,1,0,0
Chưa gì bị nứt mẻ như ảnh mong cửa sản phẩm hoặc tiki sẽ hỗ trợ đổi nắp cho mình,0,1,0,0
Tiki trả lời giúp,0,1,0,0
Ra mồ hôi 1sao + giao sản phẩm nhanh,0,0,1,0
"Vừa giao sản phẩm hôm nay, tiki giao nhanh hơn dự kiến",0,0,1,0
Tiki giao sản phẩm đúng hẹn,0,0,1,0
Ngừoi giao sản phẩm không có lịch sử,0,0,1,0
Vận chuyển quá lâu tôi đã đặt sản phẩm 4 hôm rồi,0,0,1,0
Giao sản phẩm sớm hơn dự kiến,0,0,1,0
Thu tục đổi trả như thế nao,0,1,0,0
Gói sản phẩm không cẩn thận,0,0,0,1
Giao sản phẩm khá lâu,0,0,1,0
"Giao nhầm sản phẩm mình chat, cửa sản phẩm không phản hồi",0,1,0,0
Giao sản phẩm nhanh,0,0,1,0
Nhắn tin không trả lời …,0,1,0,0
Cho 2 sao vì giao sản phẩm nhanh,0,0,1,0
Giao sản phẩm nhanh san pham rat tot,0,0,1,0
Thùng rác khi giao tới đã bị gãy phần giữ túi rác,0,0,1,0
Giao quá chậm,0,0,1,0
"Tiki tự động hoàn tiền cho khách trong khi khách cần đồ, đến khi khách chủ động liên hệ mới báo là “ đơn của anh được hoàn tiền “",0,1,0,0
Tổng cả giao sản phẩm là 39k,0,0,1,0
Trên vỏ hộp ghi do 1 công ty ở hong kong sản xuất,0,0,0,1
Bao gói cẩn thận giao sản phẩm tương đối nhanh phải dùng một thời gian mới đánh giá được chất lượng,0,0,1,0
Đề nghị đổi trả sản phẩm,0,1,0,0
"Sản phẩm bị lỗi bỏ đá một đêm tới sáng tan hết nhờ hỗ trợ đổi trả, hộp sản phẩm mất thế là tiki lại không hỗ trợ",0,1,0,0
Giao sản phẩm gãy trục,0,0,1,0
Liên hệ với tiki để đổi sản phẩm,0,1,0,0
Mình không hài lòng có một trao đổi và cần sự phản hồi của tiki,0,1,0,0
Cửa sản phẩm đóng gói cẩn thận,0,0,0,1
"Phản ánh tiki đã cho thu hồi sản phẩm từ ngày 24/2 đến hôm nay 10/3 mình vẫn chưa nhận được hoàn tiền, không thấy bạn chăm sóc khách sản phẩm nào liên hệ",0,1,0,0
Đánh giá cao tốc độ giao sản phẩm của tiki,0,0,1,0
Giao tới nhà lại không có bình đựng nước ạ,0,0,1,0
"Tại sao lại không có quà tặng kèm vậy tiki ơi, phản hồi sớm giúp mình",0,1,0,0
Khi đặt mình được chọn quà tặng là hộp đựng thức ăn,0,1,0,0
Kg có quà tặng kèm theo là bình đựng nước như mô tả vây,0,1,0,0
Sản phẩm có kèm quà tặng,0,1,0,0
Mình không nhận được quà tặng như trong hình,0,1,0,0
Cửa sản phẩm có hỗ trợ đổi sản phẩm không vậy,0,1,0,0
Chỉ lưu ý tiki khi giao sản phẩm cho khách nhớ kiểm tra kỹ sản phẩm có bị lỗi hay không,0,0,1,0
Giao sản phẩm nhanh,0,0,1,0
"Mã free giao sản phẩm lúc áp dụng được lúc không nên khi xác nhận đơn sản phẩm, giao sản phẩm siêu nhanh",0,0,1,0
Mong tiki liên hệ hỗ trợ đổi trả,0,1,0,0
Mở bên trong bị vỡ 1 cốc cửa sản phẩm vẫn giao sản phẩm là sao,0,0,1,0
Mong cửa sản phẩm có lời giải thích và đền bù cho khách sản phẩm,0,1,0,0
Tât cả mọi ngươi không nên mua tai cửa sản phẩm nay nhe mua 1 đằng giao sản phẩm 1 kiểu lưa loc nguoi mua mua loai 4 côc thi giao loai 3 cốc thất vọng đê nghi ngươi mua tảy chay,0,0,1,0
Giao sản phẩm không giống hình,0,0,1,0
Đóng gói chắc chắn sản phẩm dùng tốt,0,0,0,1
Giao sản phẩm rất nhanh,0,0,1,0
"Dịch vụ tikinow giao sản phẩm chậm hơn cam kết, hôm sau giao lại vẫn thu phí giao sản phẩm nhanh, nhân viên không trung thực ghi lí do không giao sản phẩm của hôm trước là khách sản phẩm không nghe máy, trong khi tôi đã nghe và nói giao sản phẩm muộn nên không ở đó để nhận hang",0,0,1,0
Tiki giao sản phẩm bị lỗi khá nhiều,0,0,1,0
Người bán sản phẩm giao đồ cũ cho khách nhé,0,0,1,0
Cửa sản phẩm chăm sóc khách sản phẩm tận tình,0,1,0,0
Giao sản phẩm nhanh,0,0,1,0
Keo khô không sử dụng được phản hồi cửa sản phẩm không phản hồi,0,1,0,0
Đề nghị tiki đổi trả,0,1,0,0
Vì đổi trả rắc rối nên mua cây mới cho rồi,0,1,0,0
Đề nghị tiki hoàn tiền,0,1,0,0
Yêu cầu trả sản phẩm hoàn tiền,0,1,0,0
Giao nhanh,0,0,1,0
Giao đến là loại màu vàng đồng giá thấp hơn,0,0,1,0
Mình muốn mua đèn có tích hợp sạc không dây cho thiết bị điện thoại để phục vụ cv của mình,0,1,0,0
Tiki đóng gói cẩn thận,0,0,0,1
Quảng cáo một kiểu giao sản phẩm một kiểu,0,0,1,0
Vẫn chưa thấy phản hồi gì ở bên tiki,0,1,0,0
Đề nghị tiki và cửa sản phẩm đổi sản phẩm hoặc hoàn tiền cho tôi,0,1,0,0
Giao sản phẩm đúng hẹn,0,0,1,0
Giao sản phẩm nhanh,0,0,1,0
Mình mua loại dây cắm về vẫn đầu usb không thể hiểu nổi rồi giao sản phẩm nhanh,0,0,1,0
Sản phẩm đặt lâu lắc gần 2 tháng mới giao tới nơi,0,0,1,0
Giao sản phẩm rất nhanh,0,0,1,0
Cửa sản phẩm có đổi trả không ạ,0,1,0,0
Đồ lừa đảo mua 3 món giao có 1mon,0,1,0,0
Cân hỏng không dùng được cửa sản phẩm lại bảo mình liên hệ với bên tiki,0,1,0,0
"Mình nhận sản phẩm chiều ngày 31/07 và ngay tối hôm đó 31/07 đả gọi điện phản ánh tổng đai, đến giờ vẩn chưa nhận được 1 lời phản hồi nào của tiki, xin tiki 1 câu trả lời",0,1,0,0
"Tôi gọi điện thông báo với dvkh của công ty tiki thì được báo đợi 2 đến 3 ngày sẽ có người đến nhận lại sản phẩm để kiểm tra nếu có lỗi thì đổi máy mới, sau đó thì tôi thường xuyên gửi mail và điện thoại đến công ty tiki để phản hồi",0,1,0,0
"Không hài lòng về cách giao sản phẩm, mình trả tiền phí dịch vụ giao sản phẩm trong ngày, tiki giao chậm, mặc dù đã thu tiền giao nhanh của khách sản phẩm",0,0,1,0
"Ngay sau đó mình liên hệ với tiki để thực hiện chính sách đổi sản phẩm khác, mình đã liên hệ qua mail, gọi điện hỗ trợ, tiki quảng cáo ""đổi trả dễ dàng"", thật sự mất thời gian và thất vọng vì dịch vụ đổi trả sản phẩm của tiki",0,1,0,0
"Duy chỉ không hài lòng giao sản phẩm chậm trễ của tiki, rút cục tiki làm quả mãi không thấy giao sản phẩm, quá tệ đối với dịch vụ giao sản phẩm tỉnh của tiki",0,0,1,0
Đã sử dụng trước mắt thấy tốt giao sản phẩm nhanh,0,0,1,0
Tiki giao sản phẩm đã qua sử dụng hay sao v,0,0,1,0
"Giao trễ lần 1 có thông báo cho mình và hẹn delay giao sản phẩm, đến ngày giao sản phẩm lần 2 thì mình không nhận được bất kỳ thông báo trễ nào",0,0,1,0
Vỏ hộp cũ kĩ bong tróc rất xấu,0,0,0,1
Đóng gói quá cẩu thả,0,0,0,1
Tiki giao sản phẩm gì vậy,0,0,1,0
Đóng gói kỹ,0,0,0,1
Chất lượng tàm tạm ổn tốt không có gì đặc biệt giao sản phẩm chậm,0,0,1,0
Mình thấy như kiểu hãng giao sản phẩm lỗi cho khách vậy,0,0,1,0
"Chat vs cửa sản phẩm, 2 ngày rồi không trả lời nói thật mình không muốn mua lần 2 ở cửa sản phẩm này nữa, im ghe không trả lời tin, chứ không trả lời kiểu này bàn mua về lỡ xui cái không đổi được hoặc phải liên hệ tiki phiền chết",0,1,0,0
"Mình có phản hồi, bên tiki yêu cầu chụp hình mình đã gửi hình qua chờ sau 48h phản hồi",0,1,0,0
Chắc vì sản phẩm cồng kềnh nên giao chậm,0,0,1,0
Không biết là do bên vận chuyển mạnh tay hay do cửa sản phẩm đóng nhầm,0,0,1,0
Yêu cầu cửa sản phẩm phải kiểm tra kỹ trước khi giao sản phẩm vì thiếu sót và sai các mảnh ghép,0,0,1,0
Đầu tiên là vấn đề giao sản phẩm,0,0,1,0
Một miếng bị bung phần đầu không biết do vận chuyển hay lỗi từ trước,0,0,1,0
"Giao sản phẩm sớm 1 ngày, mua đúng ngày giá giao sản phẩm cao = 1 nửa giá bàn",0,0,1,0
Về giao sản phẩm,0,0,1,0
Mong tiki sớm phản hồi để đổi trả lại sản phẩm,0,1,0,0
Khâu đóng gói chuyển sản phẩm hơi kém,0,0,0,1
Có tặng kèm kệ sách mini treo tường,0,1,0,0
Bàn giao trễ hơn dự kiến mấy hôm,0,0,1,0
Mong cửa sản phẩm liên hệ lại với mình,0,1,0,0
Hẹn giao sản phẩm ngày 30/5 ngày 8/6 sản phẩm mới được chuyển đến,0,0,1,0
Giao sản phẩm thiếu 2 ốc chặn 2,0,0,1,0
Hỏi bên bán thì nhắn không trả lời,0,1,0,0
Sản phẩm rất tốt và giao nhanh,0,0,1,0
Đánh giá không tính điểm đóng gói sản phẩm không kĩ,0,0,0,1
Xong không vừa lòng là nhận sản phẩm đóng gói sơ sài,0,0,0,1
Lỗ tròn này nhét không có vừa cái đuôi đèn xin tiki cho mình trả lại hoàn và hoàn tiền,0,1,0,0
Tiki đã hỗ trợ đổi trả sản phẩm đến lần thứ 2,0,1,0,0
Không hề có xốp bảo vệ dù vận chuyển xa,0,0,1,0
"Nó không báo cho bên giao sản phẩm, bên giao sản phẩm tự hủy 1 đơn sản phẩm của mình",0,0,1,0
Cửa sản phẩm đóng gói rất sơ sài,0,0,0,1
Đóng gói không hề cẩn thận,0,0,0,1
Không biết do cửa sản phẩm hay do vận chuyển,0,0,1,0
"Trầy và cái đế khi giao tới cũ kĩ và trầy khá nhiều, thất vọng ghê : mong cửa sản phẩm cải thiện khâu kiểm tra sản phẩm hoá khi giao tới cho khách",0,0,1,0
Giao sớm,0,0,1,0
Cửa sản phẩm trả lời do sản xuất nó thế thì mình chịu,0,1,0,0
Xin góp ý với cửa sản phẩm 1 tí về chất lượng đóng gói kém,0,0,0,1
Giao sản phẩm đúng hẹn,0,0,1,0
Có liên hệ với cửa sản phẩm mong được đổi trả,0,1,0,0
"Không up được gọi tiki để đổi không ai giải quyết, gọi thì bảo e sẽ giải quyết ngay",0,1,0,0
"Đèn bị hư công tắc không bật lên được đã thay bóng led vào vẫn vậy đã gọi tổng đài tiki hỗ trợ để được đổi sản phẩm, không hỗ trợ được gì",0,1,0,0
Cố tình đóng gói bóng đèn móp méo cho khách,0,0,0,1
Phải bọc đệm cẩn thận để tránh quá trình va đập trong lúc vận chuyển,0,0,1,0
"Sản phẩm đóng gói không cẩn thận nên lúc nhận bị móp như hình, mình góp ý để cửa sản phẩm biết và đóng gói cẩn thận hơn nek",0,0,0,1
Gói sản phẩm không cẩn thận,0,0,0,1
Tiki giao sản phẩm là bóng đèn cũ,0,0,1,0
Sản phẩm dễ vỡ qua tay cty giao sản phẩm thành ra thế này,0,0,1,0
Không trả lời,0,1,0,0
Vận chuyển thì mất đến 4 ngày,0,0,1,0
Đóng gói không có xốp ngăn va đập,0,0,0,1
Giao sản phẩm,0,0,1,0
"Mở ra thì có lời cảm ơn xin đánh giá 5 sao và hướng dẫn khi có vấn đề thì liên hệ trước đánh giá, liên hệ thì im lặng không hồi âm nên đánh giá dịch vụ kém và không có nhu cầu mua lại từ đơn vị này",0,1,0,0
Đóng gói quá tệ,0,0,0,1
Nghĩ mất thời gian lại mất phí giao sản phẩm nên thôi dùng tạm ổn tốt,0,0,1,0
Đóng gói sơ sài làm móp chỗ cái đèn 2 móp,0,0,0,1
Khâu vận chuyển không biết do bên nào,0,0,1,0
Mình nghĩ mua sản phẩm loại này không nên mua online vì vận chuyển không thể bảo vệ sản phẩm được,0,0,1,0
Giao sản phẩm đúng hẹn,0,0,1,0
Chất lượng đóng gói sản phẩm không được kỹ,0,0,0,1
Giao sản phẩm nhanh,0,0,1,0
Trục đèn nhỏ không gắn được vào đế cửa sản phẩm hỗ trợ hoàn sản phẩm giúp mình,0,1,0,0
Giao sản phẩm nhanh đúng hình,0,0,1,0
Tikinow giao sản phẩm rat nhanh,0,0,1,0
Đóng gói tốt,0,0,0,1
Cần 1 câu trả lời,0,1,0,0
Tiki trading muốn nhắn tin hỏi hay gì cũng không được,0,1,0,0
Giao sản phẩm công vênh,0,0,1,0
Mọng người bán trả lời lại,0,1,0,0
Cửa sản phẩm đã không kiểm tra hang kỹ trước khi gửi đi,0,1,0,0
Hy vọng tiki hỗ trợ,0,1,0,0
Mua màu đen giao sản phẩm về màu trắng 1 sao,0,0,1,0
Đề nghị cửa sản phẩm ktra kỹ trước khi giao sản phẩm,0,0,1,0
Đóng gói sơ sài,0,0,0,1
Giao sản phẩm nhanh,0,0,1,0
Giao sản phẩm siêu nhanh,0,0,1,0
Tiki giao sản phẩm nhanh,0,0,1,0
Theo mình đây là lỗi nhà sản xuất chứ cách thức đóng gói như vậy không thể có vết nứt đó được,0,0,0,1
Bị giao sản phẩm lỗi 2 lần,0,0,1,0
Đề nghị tiki đổi trả hộ mình,0,1,0,0
"Giao sản phẩm trước thời hạn, anh giao sản phẩm bên tiki lại tính giá nhầm, do tách đơn nên khi thanh toán không biết anh giao sản phẩm cộng kiểu gì",0,0,1,0
Vui lòng đổi cái khác hoặc hoàn tiền,0,1,0,0
Nhờ tiki hỗ trợ đổi lại sản phẩm khác,0,1,0,0
"Giao sản phẩm không đúng sản phẩm đã đặt, giao đồng hồ kim giá giá rẻ tiền",0,0,1,0
Mình thấy quá tệ mình mua một đằng giao một nẻo vs lại phi giao sản phẩm quá mắc,0,0,1,0
"Shipper không giao, này đã hơn 1 tháng vẫn im ru không chịu giao sản phẩm lun",0,0,1,0
"Giao sản phẩm gì, có giao sản phẩm thì nên làm sao cho nó như mới",0,0,1,0
Đóng gói cẩn thận,0,0,0,1
Giao sản phẩm siêu nhanh,0,0,1,0
Giao sản phẩm bị trầy móp,0,0,1,0
Đóng gói ẩu quá,0,0,0,1
Giao sản phẩm nhanh,0,0,1,0
Vận chuyển không cẩn thận,0,0,1,0
Giao sản phẩm rất nhanh,0,0,1,0
Tiki giao nhanh,0,0,1,0
Giao áo cửa trên,0,0,1,0
Mình gửi báo đổi trả sau 2 ngày,0,1,0,0
Bật không sáng đèn chui cắm sạc lỏng lẻo tiki liên hệ cho mình đổi máy lại ak,0,1,0,0
