content,Quality,Service,Shipping,Packing
"đường chỉ may rất sơ sài, vải dù rất mỏng, dễ rách, chỉ có 1 lớp thôi, mọi người nên cân nhắc lại trước khi mua, rất thất vọng",1,0,0,0
"mua cùng mã sản phẩm, cùng nhà phân phối nhưng chất liệu 2 sản phẩm không giống nhau",1,0,0,0
"tay áo bị lỗi, xoắn bên trong không đưa tay vào đựoc",1,0,0,0
sản phẩm bán không chất lượng. mặt như áo mưa. thua?,1,0,0,0
không giống quảng cáo. sản phẩm quá trẹ,1,0,0,0
chiếc áo quá mỏng,1,0,0,0
đường chỉ may quá tệ.không như mong đợi.không hài lòng,1,0,0,0
trong ảnh có túi nhưng sản phẩm về không có!,1,0,0,0
không như mong đợi. so với giá thì mua về mới tháy nó quá giá cao ?,1,0,0,0
"sản phẩm không giống như giới thiệu, không có túi kèm theo",1,0,0,0
"áo so với giá tiền quá tồi.mới mở đồ xem nhưng đã bị bục chỉ.chỉ thừa tùm lum,nhưng chất liệu vải giặt không biết có phai không",1,0,0,0
"áo dùng khoảng 2-3 ngày, có hiện tượng bung chỉ, chất lượng may vá khá kém. tôi rất bực mình vì điều đó, người ta đã bỏ tiền ra mua mặc dù không cần đẹp cũng không sao, đằng này chất lượng chỉ may rất kém",1,0,0,0
"nhỏ bạn mua bên ngoài 169 không, cửa sản phẩm bán giá giá rẻ hơn nhưng mua thì .áo nhìn bề ngoài thì tốt, nhưng đường may thì quá dở, chỉ bung nhiều gần cánh tay, chỉ thừa nhưng nhiều, may không chắc chắn,nói chung nếu áo được may kĩ thì chất lượng 5 sao",1,0,0,0
"mấy đơn trước mình đặt là tốt , đợt này thì đặt áo này về , thì sản phẩm hơi lỗi , tiki xem lại giúp mình cũng như tránh cho những khách sau mua nhé , đường chỉ ở cổ áo , tay áo , ống áo",1,0,0,0
vải bị đổ lông rất nhiều ạ nhưng màu thì không tươi như hình bên trong nhưng bị dơ nữa ạ mong tiki xem xét,1,0,0,0
"áo mua về đã bị rách, sợi chỉ bị tưa lòi cả ra ngoài, áo có mùi cũ và nhiều vết bẩn trên áo",1,0,0,0
chất liệu không được đẹp cho lắm,1,0,0,0
"áo mình mua size xanh rêu size mình, hoá đơn ghi size mình nhưng áo size l là sao? có đổi sản phẩm khác cho mình không? hơi bị bực nha nha",1,0,0,0
"mua mỗi lần 1 cái. cùng size, cùng màu, cùng loại. nhưng lại hoàn toàn khác nhau. màu lần sau, cam nhưng tái ngắt. cùng size mình nhưng rộng hơn gấp rưỡi cái đầu. buồn vô cùng.",1,0,0,0
"sản phẩm đẹp như hình nhưng size có lớn hơn bình thường, mình mặc quá rộng",1,0,0,0
áo chất lượng tốt nhưng size nhỏ vẫn rộng,1,0,0,0
"áo bình thường, chất liệu bình thường, không đejp lắm",1,0,0,0
mình mua cái này cái thứ 2 rồi. lần trước nhờ người đặt hộ thì mặc vừa. lần này mua về thì lại hơi ngắn hơn. nhưng cũng 1 size l. có đổi được áo không cửa sản phẩm,1,0,0,0
bt cũng được theo giá tiền là tốt,1,0,0,0
vì sao nó to vậy mình đặt chữ l nhưng giống như x vậy,1,0,0,0
rộng quá so với kích thước đã đặt,1,0,0,0
"không như ý lắm, khô kém",1,0,0,0
sản phẩm giá giá giá rẻ thì gia công chắc chắn không kỹ nhưng mùi thuốc nhuộm quá nồng. tuy sản phẩm giá giá giá rẻ nhưng cũng đâu tới mức như vậy,1,0,0,0
cx đẹp ạ nhưng bị xô lông áo rồi nên cửa sản phẩm cập nhật sản phẩm mới nhiều vào nha,1,0,0,0
size áo xl nhưng giống như xxl vậy không mặc được,1,0,0,0
"bung chỉ thiếu nút áo, nói chung là rất không hài lòng",1,0,0,0
sản phẩm đúng vs hình nhưng chất lượng vải kém,1,0,0,0
tình hình là áo bị may lỗi ở tay áo và như hình. buồn quá,1,0,0,0
không gióng như mông muốn,1,0,0,0
không có side dưới 30 mặc vào khá rộng,1,0,0,0
chất lượng kém chỉ rối .,1,0,0,0
không giống màu như hình mình đặt,1,0,0,0
"quần vải quá cứng, giặt ra màu chứ không được như quảng cáo! tôi giặt xong mới phát hiện ra màu, tiki có cho đổi cái mới được không?",1,0,0,0
chất vải đường may quá xấu,1,0,0,0
size quần không đúng như tiêu chuẩn,1,0,0,0
chất lượng chất lượng kém lắm tạm ổn tốt tạm ổn tốt,1,0,0,0
chất vải thô xấu không đúng như hình,1,0,0,0
đặc 2 cái quần 1 màu. nhưng cửa sản phẩm lại giao 2 màu,0,0,1,0
mẩu tạm ổn tốt được nhưng chất liệu vải hơi kém đổ lông,1,0,0,0
"mua 2 cái màu xanh đen , giao 1 cái xanh 1 cái đen là sao",0,0,1,0
chất vải hơi cứng so với quảng cáo co giãn,1,0,0,0
chất liệu vải bị đổ lông và ra màu khi giặt,1,0,0,0
tạm ổn tốt được nhưng mình đặt số hỏi lớn mặc rộng có thể mình mua thêm sản phẩm này,1,0,0,0
"rất tệ và rất xấu,thắt vọng quá",1,0,0,0
"quần mới mặc 1 lần đã đổ long, nhìn rất xấu.tiki bán đồ vậy chắc không dám mua nữa.",1,0,0,0
đang sử dụng không biết có tốt ko,1,0,0,0
chỉnh sửa hình ảnh nhiều wa sản phẩm hơi khác so vs ảnh,1,0,0,0
"kém. vải thô cứng, không bằng sản phẩm siêu thị dù đồng giá !",1,0,0,0
cao 1m75 nặng 70 kg mua quần size 33 rộng ma ngắn không mặc được,1,0,0,0
hơi cùi bép ! chất lượng khá tệ,1,0,0,0
"vừa xấu vải thô ráp, chất lượng vải quá kém!",1,0,0,0
sản phẩm may lỗi quá nhiều,1,0,0,0
"size 31 nhưng rất nhỏ mặc không vừa,",1,0,0,0
chất lượng kém mẫu mã xấu,1,0,0,0
"quần thì bình thường,áo thì một cúc đã bật ra,lẽ ra là cho 5sao nhưng áo bị mất cúc nên chỉ cho đi 3 thôi.",1,0,0,0
không giống với ảnh lắm,1,0,0,0
bình thường bình thường bình thường bình thường bình thường,1,0,0,0
giao lộn mẫu quần nha cửa sản phẩm,0,0,1,0
sie o đúng chuẩn như thông lệ,1,0,0,0
đặt size xl nhưng nhận sản phẩm nhìn như size mình. cửa sản phẩm có hỗ trợ đổi size lớn hơn không,0,1,0,0
"quần rất nhỏ so với size chuẩn…mặc không vừa, không hài lòng sẽ không mua lại lần sau, đồ mua về lại phải đem cho",1,0,0,0
chất lượng xấu.không như mô tả.,1,0,0,0
không được đẹp lắm vải rất xấu thui cho 3,1,0,0,0
áo hơi nhỏ so với size mình đat,1,0,0,0
cửa sản phẩm giao kg dung mau .nt cửa sản phẩm lay 2 cai 2 size ma giao co 1 cai .chan,0,0,1,0
so với trong hình màu không giống,1,0,0,0
sản phẩm không như mong đợi.,1,0,0,0
sản phẩm không giống trong hình,1,0,0,0
full màu trắng nhưng khi lấy về cổ tay ái cổ . phần hông có sọc vàng . sản phẩm không giống như hình ảnh . tệ thật,1,0,0,0
kích thước hơi rộng so với size của áo,1,0,0,0
"bị lỗi đường may, bun chỉ dây kéo ở túi. lần này lỗi nữ là không nhận",1,0,0,0
áo thun 3 lỗ mua 6 cái. phải cho khách 2 màu trắng. xin cảm ơn,1,0,0,0
chất liệu không đẹp như mình nghĩ,1,0,0,0
"áo tạm ổn tốt được,mõng chỉ thừa nhiều",1,0,0,0
vải kém tý nào cả nhưng bắt đánh giá cáu gì,1,0,0,0
"nói chung cũng tàm tạm ổn tốt, nhưng vải hơi mỏng",1,0,0,0
vải hơi nóng mặt không mát,1,0,0,0
nói chung cũng được chất vải hơi mỏng,1,0,0,0
"đơn sản phẩm này giao sản phẩm nhắn giao bảo vệ toà nhà, nhưng mình xuống bv bảo không có",0,0,1,0
"không hài lòng về sản phẩm cho lắm, hình trên cửa sản phẩm thì đẹp nhưng về không được đẹp như trên hình và phải mất công cắt 1 đống chỉ dư và cái khuy áo chưa được cắt nữa",1,0,0,0
xuất xứ trên áo ghi khác với thông tin trên tiki,1,0,0,0
sản phẩm không giống với hình ảnh.,1,0,0,0
bán sản phẩm không chuẩn. mẫu không như quảng cáo.,1,0,0,0
mua rồi nhưng không mặc được vì quá chật. qc thì nói mặc được. quá thất vọng,1,0,0,0
"áo cỡ xl nhưng quá nhỏ, người cao khoảng 1,55m nặng 50kg mới có thể mặc được. không hiểu tại sao người ta lại may áo cỡ nhỏ như vậy",1,0,0,0
size l quá chật so với các mặt sản phẩm khác cùng chủng loại. các hãng khác mặc size l rất thỏa mái. cửa sản phẩm này chắc tiết kiệm da,1,0,0,0
"không dúng sản phẩm, không giống hình",1,0,0,0
màu thì tốt nhưng size bị sai. vai tôi đo là 47 nên tôi chọn size xl theo đúng bảng hiển thị gợi ý cho size. thế nhưng khi mua về thì tôi lại bị rộng quá cỡ.,1,0,0,0
"áo form nữ đừng ép nam mặc chứ cửa sản phẩm. rồi cũng không có túi mấy, chán quá đã hết tiền thì chớ.",1,0,0,0
"xấu, không thích ?",1,0,0,0
"rất tệ, rất không hài lòng",1,0,0,0
màu khác trong ảnh màu áo này quá đậm nhìn ngoài nhìn xấu quá nói chung không ưng điểm nào chỉ giao sản phẩm nhanh,1,0,0,0
"đặt màu trắng ma gia màu hồng, size cũng không đúng, nổ có mác luôn, giống kiểu cửa sản phẩm trả trừ vì mình ấp mã giảm giá 20k",1,0,0,0
như đồ cũ trẻ em không hài lòng,1,0,0,0
"sản phẩm chất lượng kém không như ảnh quảng cáo, mỏng và dỏm",1,0,0,0
mua size l 60-65 kg nhưng nhỏ quá. phải cho người 50kg ở nhà bận mới vừa.,1,0,0,0
"giao sản phẩm đúng màu, chất liệu. mở ra thì sản phẩm gấp nhàu, đường may kém",1,0,0,0
hơi khác kiểu so với hình,1,0,0,0
chất lượng sản phẩm không như hình ảnh vải nóng khó chịu,1,0,0,0
