content,Quality,Service,Shipping,Packing
"phần nhựa nhưng nhiều bavia, lưới mỏng, khả năng bị biến dạng cao cho cảm giác giá giá rẻ tiền và dễ rách. phần tăng chỉnh độ ngả lưng không mượt, cứng khó thao tác. đặc biệt phần chân tì mở rộng giá giá rẻ tiền từ bộ khung đến phần đệm, chi tiết hãm bằng 1 con vít bắt lệch lạc; các lỗ ốc thiếu chính xác, chi tiết ốp cũng vậy. cảm giác khi sử dụng nhìn chung không thật sự thoải mái, vừa dùng vừa sợ gẫy, rách. sản phẩm nhận được bị bám bẩn và sứt vài chỗ.",1,0,0,0
"sản phẩm rất tệ, ghế ngồi không hề thoải mái, các chi tiết lắp ráp rất lỏng lẻo và rất dễ long ốc ra, mua cái này ngồi chỉ thêm đau lưng đau hông thôi chứ không có tác dụng gì cả, khuyên các bạn nên mua ghế nguyên khối và ra những siêu thị nội thất sử dụng thử rồi hãy mua chứ mấy cái này rất dỏm",1,0,0,0
"độ hoàn thiện kém, không thẳng sản phẩm nên lệch lạc. nhà sản xuất cẩu thả. lưới chất lượng bình thường so với ghế hoa phat một như 9 với 1",1,0,0,0
"sản phẩm ọp ẹp, không chắc chắn. thỉnh thoảng ốc rơi ra phải vít lại.",1,0,0,0
"ghế không chắc như mình nghĩ , yếu quá biết vậy mua con giá cở 700k cho đõ tiếc tiền mấy bạn chú ý",1,0,0,0
3 sao vì ghế bị bể phần chân và chỗ miếng dán thì bị gãy,1,0,0,0
"miếng nhựa bị vỡ sau 1 thời gian ngắn sử dụng, ghế lúc la lúc lắc :",1,0,0,0
"rất bất tiện với đế gát chân, không thể khóa chết nên cứ trượt ra vào khi ngồi.",1,0,0,0
ghế ngồi không thực sự thoải mái như các ghế văn phòng phổ thông.,1,0,0,0
"sản phẩm mua được 3 tháng thì ben hơi đã bị lỗi, không như mong đợi",1,0,0,0
"chân ghế bị mốc cọ không sạch, ghế không chắc chắn lắm.",1,0,0,0
"ben hơi bị lung lay, cảm giác ngồi không vững.",1,0,0,0
"chưa gì ben hơi đã gãy , ngồi kêu lét két, bực bội",1,0,0,0
"ghế tạm ổn tốt. ngồi không chắc chắn, bị dốc về trước",1,0,0,0
"mới mua về xài đã bị hư, không lên điện, bán sản phẩm lỗi sản phẩm dỏm",1,0,0,0
"giao sản phẩm sai màu, đặt màu đỏ đen thì giao trắng đen giao sản phẩm lâu",0,0,1,0
"xài 2 tháng là hư rồi , liên tục ngắt nguồn dù chỉ xài có mỗi cái máy giặt",1,0,0,0
quá tệ. ổ cắm không lên điện. thất vọng quá,1,0,0,0
cửa sản phẩm làm ăn bát nháo không ra gì mọi người không nên mua nhé,0,1,0,0
mình đặt màu trắng nhưng cửa sản phẩm giao màu đen,0,0,1,0
mua ổ đỏ đen thì giao màu đỏ trắng,0,0,1,0
"mua loại 5m, giao loại 2m, bó tay",0,0,1,0
đặt màu đen nhưng lại giao màu trắng,0,0,1,0
"sản phẩm quá tệ, vải như vải mục, mới cho sản phẩm vô chỉ vài cái, rất nhẹ, không nặng. nhưng đụng vào là bị rách cái quai. chất lượng không đảm bảo như giới thiệu của sản phẩm. nếu để nhiều sản phẩm như quảng cáo thì không biết sẽ nhưng thế nào.",1,0,0,0
"tay cầm 2 bên, bỏ đồ vô xong cầm lên là đứt hết luôn, tay đi thùng ở lại vs 2 lỗ nhé. không chắc chắn gì cả. vải cũng tạo cảm giác không bền. hồi trước mua loại kia size nhỏ hơn nhưng xài ngon lành.",1,0,0,0
túi bằng vải không dệt bị rach toạt chỗ tay cầm,1,0,0,0
"quai túi mỏng, xài mới lần đầu đã rách cái quai",1,0,0,0
tôi đặt nhầm size. vui lòng nhận lại sản phẩm và hoàn tiền. tôi sẽ đặt lại size nhỏ hơn,0,1,0,0
xài tạm ổn tốt được. không chắc chắn cho lắm.,1,0,0,0
sản phẩm không cứng cáp rất dễ bị xệp,1,0,0,0
"sản phẩm cũng tốt lắm, màu cũng đẹp",1,0,0,0
"bình không kín, đóng nắp lại vẫn nhưng kẻ hở, uống trà ngọt, để một lúc thì thấy có kiến trong ca, tưởng trà thế nào, ai ngờ những lần sau đều thế, hoá ra nắp hở kiến có thể chui vào, giữ nhiệt củng không đến nỗi xuất sắc, nói chung hơi thất vọng!",1,0,0,0
"mug là dạng nắp nhấn giữ bằng lớp ron cao su nên nắp đóng không chặt, bị hỡ mặc dù đã nhấn cho khít. phần nắp đẩy thì lỏng lẽo, không chặt. lỡ đụng ngã ly là bị đỗ nước",1,0,0,0
tất cả đều tốt trừ nắp hở quá dẫn tới rò nước khi đổ sản phẩm xứng đáng 3 sao,1,0,0,0
"nắp đậy không có ren vặn ,không mang đi được. nếu cần đem đi thì phải bỏ nước ra không thì đổ hết nước.",1,0,0,0
sản phẩm giữ nhiệt kém,1,0,0,0
màu sắc hình dáng đẹp tuy nhiên phía bên trong miệng bình với đáy bình nhìn như bị ố vậy,1,0,0,0
"chưa xem sản phẩm. đối tác vận chuyển không gọi trước khi giao, tới nơi mới gọi. đã ra ngoài, hẹn giao lại sau không đồng ý.",0,0,1,0
nếu đựng nước lạnh thì không sao nhưng nước nóng dễ bị đổ ra ngoài rất nguy hiểm,1,0,0,0
chưa dùng nên chưa đánh giá chất lượng. giao sản phẩm quá lâu,0,0,1,0
đựng nước lạnh thì không sao nhưng nước nóng dễ bị đổ ra ngoài rất nguy hiểm,1,0,0,0
nắp đậy không được kín! bị rò rĩ nước,1,0,0,0
"sản phẩm giữ nhiệt tốt, nhưng chất lượng nắp ly rất rất thấp, rất dễ ra mồ hôi ạ.",1,0,0,0
thương hiệu locknlock giả của lock lock . không phải sản phẩm thật giống sản phẩm nhái,1,0,0,0
"nắp dễ đổ nước ra, không thuận tiện mang đi.",1,0,0,0
nắp bình không chặt dễ bị đổ nước khi di chuyển,1,0,0,0
sản phẩm đẹp nếu mua tam thì nên mua sau lớn hơn nữa loại này hơi nhỏ,1,0,0,0
"thấm kém lắm, khăn nhỏ",1,0,0,0
khăn mỏng hơn mình nghĩ. nhưng chất lượng chưa biết,1,0,0,0
mềm mịn giặt nước xả vẫn có mùi gì không hiểu,1,0,0,0
"sản phẩm lần đầu sẽ khó xếp, ọp ẹp.",1,0,0,0
"nắp đậy không cố định được, vì chỉ có 1 lẫy phía bên trái, nhưng phía trên và bên phải không cáo lẫy nên không dính nhau được. video trên tờ hướng dẫn không truy cập được, video trên tiki thì quá mờ.",1,0,0,0
"sản phẩm quá nhỏ, để giày nhưng để 1 chiếc giay nhưng bất tiện",1,0,0,0
"sản phẩm mang tính chất lừa đảo. mỏng như tờ giấy ,hoàng toàn không có tác dụng gì",1,0,0,0
"sản phẩm khá yếu, nhưng giá này không đòi hỏi thêm",1,0,0,0
"không như mong đợi, mỏng và chịu lực kém",1,0,0,0
"sản phẩm như bằng bằng bìa cứng nên cảm giác không chắc chắn lắm, mua bìa về phải tự lắp, mua 12 cái 200k thì có hơi giá cao",1,0,0,0
nói chung là tiền nào của đó. 180 thì vậy cũng tạm ổn tốt tốt. đỡ hơn vứt giày lung tung.,1,0,0,0
"hình ảnh chỉ mang tính chất minh họa. mua size lớn nhưng đôi giày tây nhưng nhét không vừa, huống chi giày thể thao.",1,0,0,0
"tấm nhựa yếu quá, bỏ giày bị sập phải tháo ra làm làm mấy lần",1,0,0,0
size nhỏ chỉ phù hợp với giày dép nữ,1,0,0,0
cửa sản phẩm ơi! sao không ráp được vậy cửa sản phẩm?,1,0,0,0
rất khó lắp nắp hộp để giày. hiện vẫn chưa lắp được,1,0,0,0
"cứ như đồ chơi trẻ em, miệng hộp rất dễ bung các hộp chồng lên nhau không cố định được xê dịch tùm lum, bjo mua nửa",1,0,0,0
"dể bị hư, khó lắp ráp, cái cây dể rải nữa",1,0,0,0
"hộp nhựa mỏng manh, móp méo",1,0,0,0
chất lượng tốt dũng cũng tốt màu đẹp,1,0,0,0
hoàn toàn. không chắc chắn,1,0,0,0
"mình lắp hết 6 cái rồi, cũng tạm ổn tốt thôi, chứ lỏng lẻo khó xài thật sự, hối hận khí mua.",1,0,0,0
sản phẩm tàolao. mua về sao gắn giống hình quảng cáo. không đáng 1 xu,1,0,0,0
"mỏng manh khó ráp mua về chỉ chứa đồ khô như mì tôm, bún khô, nuôi.",1,0,0,0
"tôi không ráp được phần nắp, thật khó khăn",1,0,0,0
"hộp yếu, bỏ giày vô nhiều đôi cao gót hay boost không vừa",1,0,0,0
cửa sản phẩm bán sản phẩm nên tặng kèm keo dán sắt đi ạ. chứ đụng vào là rớt ra,1,0,0,0
không hài lòng về sản phẩm vừa mỏng vừa khó cài nắp,1,0,0,0
quá yếu để có thể để đồ nặng,1,0,0,0
"tệ rất là tệ, không hài lòng",1,0,0,0
"chất lượng kém, không có hướng dẫn lắp",1,0,0,0
"sản phẩm không như quảng cáo, chất liệu đũa inox không phải inox304 .",1,0,0,0
đăng bán tựa đề là thìa muỗng và hộp nhưng thật ra là cái hộp đễ bị nhầm có mục đích không có rõ ràng,1,0,0,0
"nắp hộp lỏng chỏng, đóng vào không chặt với hộp",1,0,0,0
hộp to và nhựa cứng nên dễ vỡ!,1,0,0,0
"hộp này là quà tặng kèm, không có ấn tượng đặc biệt",1,0,0,0
to quá so với nhu cầu cơm văn phòng.,1,0,0,0
kệ nhận được gỗ bị khuyết như hình. vì mình để đồ nhẹ nên dùng tạm ổn tốt.,1,0,0,0
"khó vặn ốc, không cho backup 1 2 ốc dư để phòng trường hợp ốc bị hư, lỗi trong quá trình vặn, nhưng lại perfect",1,0,0,0
"sản phẩm gỗ bị nứt, yếu, nói chung là lởm không thể tả được",1,0,0,0
"vặn mãi nhưng không chặt được, lung lay hoài",1,0,0,0
"đồ gia dụng nên gia công kỹ hơn, ít nhất là ráp cho bo tròn các cạnh sắc",1,0,0,0
không cho đồ để vặn các cây đinh lại,1,0,0,0
không chắc chắn .,1,0,0,0
"tạm ổn tốt hài lòng, dễ lắp ráp.",1,0,0,0
giao sản phẩm quá chậm chạp.,0,0,1,0
4 chân góc không đều nên bị bập bênh phải lót để kê đều,1,0,0,0
không giao sản phẩm nhưng báo thành công,0,0,1,0
phần nắp cực kỳ không an toàn. dễ bị mở ra và đổ nước tùm lum.,1,0,0,0
chê nha. . ly bị như hình.lần mua sản phẩm không gài lòng nhất,1,0,0,0
tiki làm ăn lừa đảo nên dẹp luôn tiki đi,0,1,0,0
cửa sản phẩm giao sản phẩm kỉ oki 10đ,0,0,1,0
mở khá tiện nhưng lại khó đóng,1,0,0,0
giao sản phẩm trễ hơn 10ngày.,0,0,1,0
"giá cao so với chất lượng mang lại vì chả có gì vượt trội hơn các sản phẩm 4-500k. thất vọng, mua tiki nhiều nhưng đây là lần đầu đánh giá 2 sao vì sản phẩm không tương xứng với số tiền bỏ ra.",1,0,0,0
thùng lau nhà đẹp nhẹ nhưng có điều phần xả xà bông phải dùng nhiều lực cái bông mới xoay. mình nghĩ với cái giá như này nhưng cái phần xả xà bông cứng ngắt thì không xứng. hồi trước xài lock lock được hơn nhiều,1,0,0,0
đánh giá không tính điểm sản phẩm quá kém hơi thất vọng,1,0,0,0
"mình coi trên youtube hoặc các ảnh khác của arirang thì nắp phải có 2 nút nhựa, nhưng mình nhận thì chỉ 1 nút ở giữa thôi. mình nấu thử được 1 lần thì thấy lâu nóng, nên chọn thức ăn dễ chín, thịt thì thái mỏng ra, đừng đổ nhiều nước vô khay inox vì nó lâu sôi lắm, nồi nấu chín bằng cách hấp nên là không nhất thiết cho thêm nước vào đồ ăn đâu trừ canh hay cơm.",1,0,0,0
bó tay mấy ông sản xuất chơi dán cái tem ngay giữa tháo ra giờ dính keo tùm lum dùng đủ thứ nhưng không tẩy ra bao nhiêu chỗ không dán phải ngay giữa mới chịu,1,0,0,0
"hình ảnh không giống thực tế, không biết có phải sản phẩm nhái không vậy?",1,0,0,0
"hộp cơm đẹp, phù hợp với dân công sở. tuy nhiên sản phẩm nên có thêm chức năng hẹn giờ sẽ an toàn hơn.",1,0,0,0
"mình mua và sử dụng được 1 thời gian. cảm nhận chung là sản phẩm dùng khá tiện, đồ hâm nóng. mới đầu nắp hộp khá chặt nhưng dùng được thời gian là bị lỏng. đựng đồ không nhưng chặt như trước, thứ ăn dễ đổ ra. khá là thất vọng",1,0,0,0
"dùng 2 tuần đầu tốt, đến tuần 3 mặc dù đã đậy nắp nhưng mang canh là chảy hết cả nước ra nên không dùng được",1,0,0,0
"không nấu cơm được, khi hâm thức ăn, ngăn trên không ấm",1,0,0,0
"đã mua và sử dụng . như hâm mãi nhưng tầng trên chỉ ấm ấm , chỉ nóng tầng dưới . trước đây mình đã sử dụng sản phẩm này nóng đều cả 2 tầng . giờ mua lại thấy chất lượng tệ quá",1,0,0,0
nhận được sản phẩm nhưng không giống mẫu. nắp chỉ có 1 van. trong khi hình ảnh giới thiệu là 2 van. rất dễ đổ canh. hơi khó chịu. nhưng sản phẩm sử dụng khá tốt.,1,0,0,0
nấu thử tạm ổn tốt tốt. tuy nhiên vỏ hơi mỏng. khóa không chắc chắn lắm hy vọng được 02 năm,1,0,0,0
"chốt khoá khớp nối khá lỏng lẻo, không chắc chắn",1,0,0,0
"sản phẩm không giống như trong hình giới thiệu, nắp chỉ có một nút cao su và hút chân không thấy không có tác dụng.",1,0,0,0
"sản phẩm không như mong đợi không hĩu sao mọi người vào khen lấy khen để. tầng 1 nhưng nóng được, tầng 2 thì thua. đã chế lại bằng cách đục thêm lỗ tầng 2 cho nước bốc hơi nhìu hơn nhưng vẫn tệ",1,0,0,0
sản phẩm giống hình trừ cái nắp. chưa sử dụng nên không biết thế nào,1,0,0,0
tại sao hộp cơm của mình khi mua lại không giống trên ảnh. nắp đậy không hề có 2 nút cao su để hút chân không như quảng cáo?,1,0,0,0
ủ hỏng cắm không lên đèn báo.,1,0,0,0
sau một thời gian dài mình dùng thì mình cảm thấy chất lượng tốt,1,0,0,0
mình sử dụng được 1 năm. sản phẩm dùng tốt nhưng nhưng một nhược điểm là mùi nhựa bốc lên khi hâm nóng hôi quá nên mình cũng ngại sử dụng do sợ ảnh hưởng đến thức ăn?,1,0,0,0
"mua giao trong ngày mak đúng 1 tuần mới giao, giao xong cũng xong việc chưa có cơ hội test",0,0,1,0
gửi nhầm đồ mua 2 cuộn hút chân không nhưng gửi mình máy hớt tóc,0,0,1,0
sản phẩm sai với xuất xứ . quảng cáo sản phẩm japan nhưng khi mua là sản phẩm trung quốc,1,0,0,0
sài bình thường nhưng để lâu nó bị vô hơi lại,1,0,0,0
chưa sử dụng chưa rõ chất lượng,1,0,0,0
"sản phẩm dùng tốt, không vấn đề gì",1,0,0,0
giao sản phẩm không đúng thông tin.,0,0,1,0
dùng tốt cac ban mua loại máy khong kén túi mới dùng được,1,0,0,0
"cuộn hút chân kém ,bao dai",1,0,0,0
chất lượng túi bình thường,1,0,0,0
bộ phận toilet head không khớp với bồn cầu toto nhà tôi đang dùng nên dụng cụ trở thành vô dụng,1,0,0,0
"mua về nhưng không thông được, sản phẩm sử dụng không như quảng cáo",1,0,0,0
như vứt. chả làm được gì. phí tiền. không vừa với bồn cầu phổ thông,1,0,0,0
sản phẩm mỏng manh sản phẩm tàu đểu bơm vài cái đã ốp ep,1,0,0,0
đã dùng và không thông được bồn cầu,1,0,0,0
"không có tác dụng, vẫn phải gọi thợ sửa tới.",1,0,0,0
cửa sản phẩm làm ăn như này mất uy tín quá,0,1,0,0
không đúng sản phẩm như hình,1,0,0,0
"kém chút nào sản phẩm lỗi không xài được,đừng mua",1,0,0,0
van bom không giống hình ảnh van bom kim loại nhưng giao van bom bằng nhựa,1,0,0,0
"chất lượng quá kém, bơm mới 5 psi đã văng đầu, sản phẩm này làm lãng phí quá",1,0,0,0
không hiệu quả như quảng cáo,1,0,0,0
không giống hình. về không xài được,1,0,0,0
sản phẩm tạm ổn tốt tốt .,1,0,0,0
gắn vô không vừa 2cai có 1 cái gắn không được,1,0,0,0
không như mình mong đợi- bồn vẫn tắc - có lẽ không thể đủ hơi,1,0,0,0
"như cc vậy đó, nổ tung bồn cầu :v",1,0,0,0
"không nên mua, vì không phải bất cứ bồn cầu nào cũng có thể xài được, chỉ bắn được 1 lân/1 lần bơm, và kết quả là . bắn tung tóe và vẫn tắc như thường.",1,0,0,0
không dùng được như quảng cáo,1,0,0,0
"vô dụng, không làm được gì",1,0,0,0
không có tác dụng như quảng cáo,1,0,0,0
"đây là sắt bình thường, phun sơn đen, cọ nhẹ là trầy, các vết hàn quá thô và hàn vô trách nhiệm. phụ kiện kèm theo méo mó. khoét lỗ bắt vít thì không chuẩn",1,0,0,0
"năm ngoái mình có mua 1 bộ chất lượng rất tốt. nhưng bây giờ mình đặt lại thì chất lượng nó lại khác. phần vít nhăm ngoái bằng inox và vặn bằng lục giác, bây giờ thì bằng vít sắt như hình. đồ hoàn thiện của các bộ phận cũng kém hơn so với năm ngoái. cảm giác không xứng đáng so với giá tiền.",1,0,0,0
"đang ở chung cư, bếp tủ làm theo tiêu chuẩn chiều cao so với bồn rửa, nhưng kệ chiều cao quá, nên không để vừa. giờ không biết làm sao. sản phẩm nên cho chọn chiều cao, hoặc phải có thêm nhiều lổ gắn bên thanh dọc nữa để điều chỉnh thì mới dùng được.",1,0,0,0
"mình trông chờ kệ rất nhiều nhưng hơi bị thất vọng . trước mình mua kệ 1 tầng của hiệu khác rất chắc , mình rữa và úp được 3 nồi thủy tinh 3 lít và 4 lít vẩn rất tốt . nhưng sản phẩm này yếu quá , mình nghĩ chắc nó dài quá , nếu sản phẩm dài 125cm thì nên có thêm thanh sắt để đỡ phụ chứ vậy không dám để gì ngoài mấy cái chén và mấy cái rỗ nhựa . nghĩ mua cái lớn và cho cái nhỏ rồi giờ thì bề bộn hơn lúc đầu .",1,0,0,0
sản phẩm sau 10 tháng sử dụng.,1,0,0,0
"- chỗ đựng thớt khá thấp, đựng không được thớt loại to 1 điểm trừ - chỗ đựng dao làm cũng chưa phù hợp mọi loại dao, bỏ dao vô là rớt rất nguy hiểm - 2 điểm - có chút trầy xước nhẹ -0.5 điểm 6.5/10 = 3 sao",1,0,0,0
"điểm cộng: kích thước lớn, kệ cao, hiệu quả trong việc giải phóng không gian bếp. điểm trừ: thiết kế gác chén, bát nhỏ; thiết kế gác đĩa, nắp. thì lại quá lớn.",1,0,0,0
"thép quá mềm, vặn con ốc sơ sơ nhưng như muốn gãy cái thanh chống.",1,0,0,0
tôi có thể đổi thành 2 tầng không?,0,1,0,0
nhìn thì đẹp nhưng yếu ớt lắm.,1,0,0,0
"phía trên nhưng khoảng ít quá không để được huhu , quá buồn , quá thất vọng",1,0,0,0
"hang dep,son tinh dien nhin rat tot,chi co deu moi noi hoi nhiu nhin không được tham my,cho cai 3 sao",1,0,0,0
"dùng tạm ổn tốt, độ chính sác chưa cao",1,0,0,0
không lấy đưộc kem như qc,1,0,0,0
chỗ để lọ kem đánh răng ấn gãy tay cũng không ra kem …,1,0,0,0
nhả kem mỗi lần rất ít và rất chậm,1,0,0,0
chất lượng tốt . chúc bán ắt sản phẩm,1,0,0,0
không đẹp mình không tháy d,1,0,0,0
"không xịt kem được, nút ấn bị liệt",1,0,0,0
không hài lòng. không vặn vừa hộp kem colgate,1,0,0,0
mẫu mã đẹp nhưng khi ấn vô lấy kem đánh răng hơi khó,1,0,0,0
"mua về dùng được khoảng 1 tháng là bị như vậy, mặc dù mình luôn để trong túi vải bọc. mình cảm thấy thất vọng về sản phẩm này. hic hic",1,0,0,0
sản phẩm này tui không đáng giá cao cho mấy,1,0,0,0
"tin tưởng đánh giá top 1 nên mua, nhưng trải nghiệm cực kì tệ. ngồi không êm, được 1 tháng đã bị rách như vậy đây thất vọng!",1,0,0,0
khác với cách tưởng tượng trước khi mua nếu tính điểm cho sản phẩm này mình cho 4 điểm,1,0,0,0
"sản phẩm chất lượng kém, mình mới dùng 1 tuần nhưng rách te tua. cố gắng dùng thêm thôi",1,0,0,0
"sản phẩm kg đúng kích cở đăng trên kiti 45x43x3, thực tế là 42x35x3",1,0,0,0
"đệm giống ảnh, tuy nhiên ngồi không êm như mình mong đợi, ngồi vẫn nóng và mỏi mông",1,0,0,0
"trước mắt thấy tốt, nhưng chưa sử dụng chưa biết được",1,0,0,0
mua về chưa kịp ngồi đã đau một bên mông nên chưa đánh giá được :c,1,0,0,0
"cảm thấy bình thường, bí thêm",1,0,0,0
sản phẩm như hình. cảm giác ngồi cũng không có gì quá đặc biệt.,1,0,0,0
chưa được 3 tuần đã rách rồi,1,0,0,0
"giao sản phẩm quá lâu. hẹn ngày 20/10 giao sản phẩm, nhưng đến 30/10 mới nhận được.",0,0,1,0
dùng tầm vài tuần thì cả 2 đệm đều bị rách,1,0,0,0
"khong như quảng cáo, khác màu , công dụng không khả quan lắm",1,0,0,0
dùng 1 thời gian nệm bị rách tả tơi,1,0,0,0
ngồi được một vào hôm thì rách 3 lỗ,1,0,0,0
"chất lượng ngày một xuống, mua 3 lần lần thứ 3 chất lượng tệ nhất, không biết nói gì. sẽ không có lần thứ 4 mua sản phẩm ở đây.",1,0,0,0
"dùng được gọi là chữa cháy, vít mấy con ốc nhỏ đã toè đầu vít rồi, nam châm yếu",1,0,0,0
"tầm giá và chất lượng tốt nha, mở mấy cái nhẹ nhẹ là được",1,0,0,0
chưa tốt nhưng chống cháy cung tạm ổn tốt được,1,0,0,0
"nhìn tổng thể đẹp. nhưng gắn đầu vít vào thì nam chấm hít rất kém, bị rớt đầu vít.",1,0,0,0
"chất liệu thì tốt, nhưng từ tính lại quá nhẹ, chất liệu thì tốt, nhưng từ tính lại quá nhẹ,",1,0,0,0
hộp vít khá dỏm. vít thì dùng chất liệu kém,1,0,0,0
sản phẩm rất dỏm. mở muốn lờn con ốc nhưng đầu vít hư luôn.,1,0,0,0
"sản phẩm bị trầy xước, không phải sản phẩm mới",1,0,0,0
mới mở ra thì thấy phần đáy hộp thế này . chất lượng thì chưa biết thế nào,1,0,0,0
kém. hỏng khi sử dụng.,1,0,0,0
không hài lòng. vừa dùng cái mẻ luôn đầu vít. không dùng được thêm lần nào nữa.,1,0,0,0
"chưa dùng nhưng hư luôn rồi cái vỏ bị rơi ra, cái tua vít thì bị trầy.",1,0,0,0
sản phẩm nhìn chất lượng nhưng kiểm tra thiếu mất 1 item.,1,0,0,0
sản phẩm quá xấu .,1,0,0,0
dùng rất nhanh hỏng đầu vít,1,0,0,0
chất lượng không được tốt như quảng cáo,1,0,0,0
những ai mua dùng lâu dài thì không nên,1,0,0,0
cũng không như mong muốn .,1,0,0,0
chất lượng kém như mong đợi,1,0,0,0
"mình mua cho bé nên chọn nắp bật nhưng sao lại là ra nắp gài, mở ra thấy nắp gài khá thất vọng",1,0,0,0
mua 2 lần đều giao sản phẩm nhầm màu,0,0,1,0
"khăn không bám vào da nhưng trơn tuồn tuột, sản phẩm không thấm nước",1,0,0,0
sợi tơ trên khăn lau cái là sờn hết ra dính vào da,1,0,0,0
giấy đợt này kém bằng mấy đợt mình mua trước,1,0,0,0
"không đúng hình, chất lượng thấp",1,0,0,0
"không thich, giống chất khăn giấy ướt",1,0,0,0
không thích sản phẩm cho lắm,1,0,0,0
có bụi bẩn bên trong khăn,1,0,0,0
"mua về kg xài được, mở kg được",1,0,0,0
"clip quay nhìn pro lắm, nhưng sản phẩm nhận về chỉ được 50 so với quảng cáo. đèn trong clip có thể bẻ cong phần dưới của cần đèn, nhưng thực tết chỉ có thể gập xuống kéo lên ở bần phía trên. nhà bán vui lòng đừng đưa sản phẩm lên trời để khách sản phẩm thất vọng càng lớn khi nhận sản phẩm",1,0,0,0
mẫu mã đẹp nhưng không sáng như các đèn học khác.,1,0,0,0
"đầu xạc rất lởm, 1-2 lần đầu nhưng tốt, sau đó dần dần điện khó vô, khoảng 1 tháng là điện hoàn toàn không vô và không dùng được nữa",1,0,0,0
"mới nhận, bóc ra cây đã bị rách thế này. đèn nhỏ, ánh sáng hơi yếu, chỉ đủ để sáng 1 trang sách nhưng cường độ cũng không sáng nhiều. cân nhắc mua cho trẻ em để học vì không đủ khoảng sáng cần thiết.",1,0,0,0
"khi mới mua về thì đèn sáng tốt, nhưng chỉ sau 1 tháng sử dụng thì rất yếu. làm việc dưới ánh đèn như thế này thì có nhưng hại mắt hơn.",1,0,0,0
mau hết pin lắm!tầm được 2tiếng,1,0,0,0
"đèn ánh sáng khá yếu, ai có ý định mua sản phẩm này cho trẻ em học thì không nên",1,0,0,0
"độ sáng của đèn yếu, không như mong đợi.",1,0,0,0
độ sáng thấp hơn so với kì vọng,1,0,0,0
"đèn tối, không đủ độ sáng cho bé học.",1,0,0,0
"đèn đẹp nhưng nhanh hết pin, sạc cả buổi nhưng bật tầm 30p là thấy hết pin",1,0,0,0
đèn thực tế không giống như giới thiệu,1,0,0,0
"nhanh hết pin, không sài được lâu",1,0,0,0
