content,Quality,Service,Shipping,Packing
"tính năng gấp gọn di chuyển thì tốt. chân đế nhẹ quá, để bàn gió thổi đèn lắc lư. độ sáng thì chỉ để làm việc trên máy vi tính thì tốt, nhưng đọc sách thì kém.",1,0,0,0
"đèn học chống cận thị, đèn đọc sách, đèn làm việc để bàn chống chói mắt lóa",1,0,0,0
chất lượng kém chất lượng. tự hạ tắt độ sáng.,1,0,0,0
"đèn bị cháy khi đang dùng, đèn không lên nữa khi mới mua về đang cắm sạc thì nổ .",1,0,0,0
màu không sáng như mình nghĩ với lại hơi thiếu chắc chắn. nhưng tiền nào của nấy nhưng,1,0,0,0
đèn mau hết pin! cần phải sạc liên tục. tiện lợi là có thể đem di động nếu đã sạc đầy.,1,0,0,0
"nhiều chế độ ánh sáng , nhưng rất mau hết hết pin",1,0,0,0
"chân đèn cập kênh, thời lượng phát sáng không quá 1 tiếng. quá tê",1,0,0,0
"sản phẩm không đúng mô tả, phải cắm dây mới hoạt động không thể tích điện",1,0,0,0
đèn học giao đến bị hư mờ không lên.,1,0,0,0
"đèn không sáng được, chất lượng kém",1,0,0,0
"không như hình . không có pin , dùng dây trực tiếp",1,0,0,0
đèn rất tối không sử dụng được,1,0,0,0
đèn sáng kém . quá kém chất lượng,1,0,0,0
khoảng 3h là hết pin. cửa sản phẩm cho hỏi vừa cắm sạc vừa bật đèn được ko?,1,0,0,0
tại sao đèn không có pin ?,1,0,0,0
như đồ chơi trẻ em! mua phí tiền thật! chắc chắn là sản phẩm nhái!,1,0,0,0
"sản phẩm gia công, chất liệu kém. không nên mua",1,0,0,0
"đừng mua bản này tệ lắm, độ cao của nó không phù hợp",1,0,0,0
"chất liệu nhựa, dễ gãy và khó vệ sinh",1,0,0,0
"không vừa tầm với của mình, ngồi thấy mỏi vai hơn",1,0,0,0
giá cả và chất lượng không tương xứng. chất liệu trung bình.,1,0,0,0
"sản phẩm không được nguyên vẹn, bị sướt không phải do vận chuyển",0,0,1,0
"sản phẩm tệ quá, mới dùng ít ngày đã đọng nước bên ngoài thế này",1,0,0,0
chất lượng kém so với giá phải bỏ ra,1,0,0,0
"túi hỏng, cũ mất tiền đem lại sự khó chịu",1,0,0,0
"chất lượng tốt, giao sản phẩm nhanh.",0,0,1,0
mua lan 1 thay san pham rat tot. nhung mua lai lan 2 thi san pham khac han. chat luong giam/kem,1,0,0,0
"túi bở, dễ rách, chắc túi phân hủy sinh học nên vậy",1,0,0,0
"chất lượng túi thì tốt. nhưng phần đáy túi dính không bung ra bình thường được, đáy túi bị dính vào nhau",1,0,0,0
"sản phẩm tạm ổn tốt tốt, do thấy hơi cũ thôi.0.",1,0,0,0
"nhỏ xíu xiu, gắn cây lau nhà phần thân nhỏ i nox vào cũng đã khó khăn lắm mới vào nói chi gắn đoạn nhựa phía trên to mập hơn , nhưng chỉ được 30 giây là tự bật ra rơi xuống, không ôm hết. mọi người không nên mua nếu mua để gắn cây lau nhà. gắn gì nhỏ xíu như ô dù may ra được.",1,0,0,0
chất lượng kém chất lượng. nếu có không sao sẽ đánh giá 0 sao. rất tệ,1,0,0,0
miếng dán khô không dán được,1,0,0,0
bé nhỏ hơn so với hình ảnh.,1,0,0,0
"sản phẩm rất tệ, không treo được cây lau nhà vì treo lên rớt ra, keo không bám dinh",1,0,0,0
giá cao so với chất lượng.,1,0,0,0
không hài lòng nha cửa sản phẩm.dán rơt ko,1,0,0,0
"keo dán không dính, rất tệ.",1,0,0,0
rung như chân bà già tiền nào của đó nha ae. muốn vững chắc mua bàn chữ z giá cỡ 600k,1,0,0,0
bàn rung lắc. không đứng cứng vững. phải để sát tường sài tạm ổn tốt,1,0,0,0
bàn lắp lỏng lẻo không chắc chắn quá thất vọng,1,0,0,0
"chất liệu gỗ quá tệ, thất vọng với sản phẩm kệ và bàn học của cửa sản phẩm",1,0,0,0
chất lượng kém không được như mô tả,1,0,0,0
"các nếp gấp chiếu nằm mấy ngày rồi vẫn không phẳng, cảm giác chiếu chất liệu hơi bí, nóng, không mát, nhưng trơn dã man, nằm gối nhưng gối toàn trôi tuột đi ấy",1,0,0,0
"tạm ổn tốt chấp nhận. 1/ kích thước không đủ chỉ 2,15 x 2,0 2/ không dày như qc 3/ giao sản phẩm không báo trước nên rất bị động.",0,0,1,0
"nhà mình hơi nóng nên không có máy lạnh thì nằm chiếu này bị nóng, có máy lạnh nằm tạm ổn tốt được thôi chứ kg bằng chiếu trúc. đặt trên nệm kymdan sẽ bị lún khi đứng lên, đặt trên nệm gòn cứng hơn sẽ kg bị lún",1,0,0,0
nằm rất nóng. hình ảnh không như quảng cáo,1,0,0,0
"mình đã nhận được sản phẩm rất nhanh, nhưng mình để rành chưa dùng đến chưa có đánh gía",1,0,0,0
đặt chiếu1m8x2m nhưng về chỉ được khoảng 1m6x1m8. giao sản phẩm tikinow siêu nhanh.,0,0,1,0
"mình không hiểu do pin bị lỗi do nhá sản xuát hay sao nhưng khi nhan vien nhà mình mở ra đe cho khách sạn thay cửa kháo từ nhưng nó báo pin không nhưng pin. nhưng pin mới mở từ vỉ mới, vỉ nào cũng bị. giờ nhà mình chuyển sang hãng pin khác rồi",1,0,0,0
pin rất mau hết năng lượng,1,0,0,0
pin lởm chất lượng thấp đừng mua nhé,1,0,0,0
"sản phẩm đẹp tuy nhiên 1 nhược điểm làm mình khá khó chịu là mặt bàn không được mài phẳng nên khi để màn hình lên làm màn hình bị xoay, phải kê lót mới cố định được màn.",1,0,0,0
"giao sản phẩm quá chậm hẹn thứ 3 giao sản phẩm nhưng hết ngày thứ 5 vẫn chưa nhận được, cần xem xét lại khâu vận chuyển",0,0,1,0
"quá tệ, lau 1 tuần thì hư hỏng, gia công kém.chán.",1,0,0,0
"giao sản phẩm thiếu quà tặng,",0,0,1,0
sau 1 tháng thì cây bị hư ngay phần khoá chốt,1,0,0,0
"mua cây xong, mua thùng lẻ lại không bán",1,0,0,0
"pin hết điện , không dùng được",1,0,0,0
pin yếu không được như pin trước mua,1,0,0,0
"sản phẩm này kém chất lượng, mới dùng đã có những tiếng kêu tách tách bất thường, sau hơn 2 tháng thì cháy. xin khẳng định 100 không có lỗi của người sử dụng và chỉ có cắm điện và xài , không có gì khó hiểu cả",1,0,0,0
"đèn không có công tắc, dây cũng hơi ngắn, với mình thì thấy không bắt được muỗi nhiều, chỉ bắt được những con côn trùng ưa sáng thôi. nguyên 1 tuần mình bắt được nhiêu đó đó, không đổ gì hết nhé! mọi người mua nên cân nhắc ý kiến của mình nhé.",1,0,0,0
"dùng được gần 1 năm mới viết review. chủ yếu diệt mấy con thiêu thân, diệt muỗi thì ít, nó nhưng bay dạo chơi lòng vòng quanh đèn. đến nay thì không hư, đèn vẫn sáng, tuy nhiên nghe mùi khét giống mùi nhựa cháy. không biết có nên dùng tiếp hay không? sợ bị cháy.",1,0,0,0
đã hư bóng sau 8 tháng sử dụng,1,0,0,0
"mọi ng cân nhắc khi mua nhé, chứ riêng mình thì thấy mình thu hút muỗi hơn cái đèn bắt muỗi này rồi, tưởng đâu có đèn yên tâm chút ai ngờ muỗi chít, đập phát máu không, không hiệu quả rồi, thất vọng",1,0,0,0
chỉ bắt được ruồi với mấy con vo ve vớ vẩn. hầu như không bắt được muỗi đốt,1,0,0,0
"chỉ có tác dụng với những loại côn trùng bị thu hút bởi ánh sáng, chứ đối với muỗi không có tác dụng lắm nha mọi người - nói chung mua trang trí, làm đèn ngủ củng tốt",0,1,0,0
đèn bắt muỗi được rất ít. để cả buổi chỉ có côn trùng khác. con muỗi đậu trên tường sát bên thì không thèm vào. vợt tay thì nhiều muỗi nhưng đèn thì chẳng thấy gì,1,0,0,0
xài qua đêm bị nóng chảy nhựa ra tại điểm tiếp xúc giữa lồng sắt bên trong và lồng nhựa bên ngoài.,1,0,0,0
không hiệu quả .mình để ở phòng 15m2 bắt được 2 con muỗi cả đêm,1,0,0,0
"treo đèn theo hướng dẫn nhưng 3 ngày rồi chỉ bắt được 1 vài con nhà mình nhiều muỗi nhé , thất vọng.",1,0,0,0
"không hiệu quả, hơi thất vọng vì bỏ ra gần 400k nhưng ngủ muỗi vẫn đốt như thường",1,0,0,0
mua về phí tiền không có bắt đuợc con muỗi nào nhưng toàn bắt mấy con nhặng,1,0,0,0
máy mới mua nhưng cắm điện không sáng đèn thì làm sao nhưng bắt muỗi.,1,0,0,0
mới dùng có 1 tháng đã bị cháy bóng,1,0,0,0
mua cả tháng nhưng nó bắt có vài con. trong khi muỗi cắn thân chủ ngồi cạnh đấy. tôi phải đi mua 4 cái mùng về ngủ. : how sad.,1,0,0,0
mới sử dụng hơn 1 tuần đã cháy bóng đèn? giờ phải làm sao?,1,0,0,0
sản phẩm về thì sài bth. nhưng khoảng mấy ngày sau máy lại không lên đèn nhưng vẫn có tít điện,1,0,0,0
sản phẩm tệ. dùng được hai hôm thì có dấu hiệu khét. miếng nhựa giữ vòng sắt chảy. nhãn mác in cũng không cẩn thận. thấy đánh đánh giá tốt nhưng,1,0,0,0
"cũng nghe tách tách nhưng vẫn thấy muỗi bay vo ve, có vẻ sóng điện không đủ mạnh để giết muỗi ngay lần đầu nó chạm đến đèn?",1,0,0,0
"mới dùng được 2 buổi tối nhưng đèn bị gì không sáng, chán cho sản phẩm",1,0,0,0
tạm ổn tốt thấy mẫu mã tốt về lâu dài thì chưa biết công dụng thật cũng chưa biết nhưng hài lòng,1,0,0,0
bắt được cái quái gì nhưng quảng cáo cho cố,1,0,0,0
quá tệ . sai lầm khi mua .không bắt được muỗi,1,0,0,0
"mình mua sản phẩm cho công ty sản phẩm này, nhưng chờ mãi không thấy gửi hóa đơn về",0,1,0,0
xài được 1 tuần thì bung mất luôn miếng đệm silicon. nên giữ nhiệt kém,1,0,0,0
"bị thấm nước vào trong, kém lắm",1,0,0,0
giá cao so với chất lượng,1,0,0,0
"chất lượng tốt, giá cả phù hợp",1,0,0,0
thời gian vân chuyển quá lâu,0,0,1,0
"sản phẩm bình thường, hơi rộngg",1,0,0,0
"tốt, bánh xe lắp vào lỏng, không có chốt, lắp xong thì không cố định được toàn bị nghiêng, không dùng được bánh xe",1,0,0,0
mua 2 kệ nhưng cửa sản phẩm giao thiếu 1 kệ đã thanh toán visa,0,0,1,0
lúc mới mở ra thì rất hài lòng nhưng mới vặn con ốc đầu tiên tới con thứ 2 thì đầu tua vít bị gãy nguyên bộ chỉ có cây đó vặn được ốc điện thoại bỏ ra 50k vặn được 1 con ốc thật sự rất không hài lòng,1,0,0,0
"sản phẩm không dùng được, rất dễ tòe đầu vít",1,0,0,0
"thật sự thì đây là lần đầu tiên mình mua sản phẩm tiki nhưng thất vọng như vậy . đọc ở phần mô tả thì ghi chất liệu thép không gỉ, nên cũng đinh ninh an tâm nhưng mua. khi về đến nhà mình sử dụng thử, tháo con ốc siêu nhỏ và bùm . đầu +1.2 mm của mình ra đi. mình có thử các con khác, cảm giác là nếu những con ốc bị siết hơi chặt, thì đầu tua vít của mình bị bong tróc, và bị cong veo. buồn .",1,0,0,0
chất lượng vỏ đựng dụng cụ kém chất lượng. mới mở là bung luôn khuy.,1,0,0,0
"khớp nối hơi lỏng lẻo, vs tầm giá thì tạm ổn tốt tốt",1,0,0,0
"sản phẩm chất lượng kem, dùng kém l",1,0,0,0
tạm ổn tốt được. nam châm thì hút yếu vãi ra,1,0,0,0
"mới dùng đã hư, chất lượng rất kém nhé ạ",1,0,0,0
chưa nhận được sản phẩm nhưng để là đã giao thành công. không biết đã giao cho ai rồi,0,0,1,0
có một số đầu tua vít cho vào thân vít nhưng không thể vặn được do nấc khóa trên đầu tua vít bị lỗi.,1,0,0,0
"sản phẩm đúng như hình nhưng khi sử dụng chất lượng đầu tua vít kém, vặn xíu tòe luôn",1,0,0,0
keo này giống như cao su dán không dính nhưng bong tróc. không sử dụng được sau khi dùng cũng không có chức năng chống nước như quảng cáo. sản phẩm quá tệ.,1,0,0,0
sản phẩm hư cũ không sử dung được,1,0,0,0
không dán được bồn nhựa chứa nước bị nứt. chất lượng sản phẩm không như quảng cáo,1,0,0,0
dán gì cũng không dính thật tốn tiền. hi vong tiki gỡ sản phẩm này,1,0,0,0
"sản phẩm chất lượng rất kém, mua không dùng được - thất vọng",1,0,0,0
"mình đã sử dụng ngay , không hiệu quả",1,0,0,0
"không giống hình, sản phẩm như đã qua sử dụng",1,0,0,0
"keo chả dính gì luôn, sản phẩm đểu",1,0,0,0
không sử dụng được.không như quảng cáo,1,0,0,0
không dính được ống nước vẫn gỉ,1,0,0,0
"dán không chắc chắn, không như quảng cáo",1,0,0,0
sản phẩm dởm .không dính .tốn tiền,1,0,0,0
"không dính như quảng cáo, quá hanh sử dụng rồi hay sao nhưng tệ quá",1,0,0,0
"chất lượng rất tệ. dán xongg, treo vật nặng tầm 3kg vào thì 60 phút là bong",1,0,0,0
"dụng tạm ổn tốt tốt, nói chung là không bền, chỉ được mấy ngày lại chảy nước ra.",1,0,0,0
giao sản phẩm chậm khg đúng hẹn chưa sd chưa biết chất lưoengj,0,0,1,0
kèo vàng không giống trên hình là keo xám,1,0,0,0
"độ bám dính tệ, không như quảng cáo.",1,0,0,0
dán không dính. chia sẻ gì phải đủ ký tự. chán tiki ghê.,1,0,0,0
độ dính quá tệ . không nên mua,1,0,0,0
không nên mua. sản phẩm đụng nước là bong,1,0,0,0
"dính không chắc, keo không dính sát",1,0,0,0
sản phẩm dùng kém! sản phẩm không bám dính nên không thể dính chặt được,1,0,0,0
"sản phẩm quá tệ, keo khô không bám dính",1,0,0,0
bình thường không được như quảng cáo,1,0,0,0
kém chất lượng độ bám dính kém,1,0,0,0
tốt hang thật dùng được 2 ngày chưa thấy hỏng,1,0,0,0
không được như kỳ vọng ban đàu,1,0,0,0
không dính như quảng cáo.,1,0,0,0
"chất luọng tốt, giao sản phẩm nhanh",0,0,1,0
tôi dán đường ống nhựa đang rỉ nước. keo không bám dính. phải làm thế nào,1,0,0,0
"giao sản phẩm chậm, chất lượng tốt",0,0,1,0
"đặt sản phẩm 2 cái, giao có 1 cái, lại nhưng giao trễ",0,0,1,0
"giá cao, chất lượng quá bình thường",1,0,0,0
quá nhỏ với hinh mo ta . that vong,1,0,0,0
"lởm của lởm, không xứng đáng với giá tiền.",1,0,0,0
"tạm ổn tốt tốt, giao sản phẩm nhanh",0,0,1,0
đóng gói kỹ. nhưng náp nhựa bị cong vênh. cái thì mất cục nam châm.,0,0,0,1
"chất lượng xài 1 khoảng thời gian kém, bị gãy và bung miếng nhựa khi mở ra đóng vào vài lần",1,0,0,0
"khui sản phẩm mới thấy hụt hẫn, một trăm mấy chục không nhưng chỉ có 1 hộp",0,1,0,0
giá quá cao so với sản phẩm cùng phân khúc,1,0,0,0
cũng cứng cáp nhưng nam châm hít đậy nắp thì không ăn lắm,1,0,0,0
không hài long cho lắm,1,0,0,0
chốt bình nhanh hư lắm. huhujujujuju,1,0,0,0
dùng được 2 ngày thì phát hiện ra bình bị chảy nước.,1,0,0,0
"dáng vẻ đẹp, nhưng nút khoá và bấm mở thiết kế không công thái học gì cả",1,0,0,0
"mới nhận được bình thấy đẹp cute dốc ngay nước ào thử, nhưng dốc ngược bình xuống thì nước sẽ bị chảy ra? nắp không được khít thì phải",1,0,0,0
sản phẩm quá tệ. chắc không bao giờ dám mua sản phẩm sale. kaka,1,0,0,0
"gối mền rất đáng yêu, mền vừa đủ độ dài người cho người có chiều cao khiêm tốn nhé, mình 1m53 thì vừa đủ. lông vải mềm mịn. mau khô dễ giặt. gối thì xẹp quá mình cứ phải cuộn tròn lại mới nằm được. màu sắc và kiểu dáng giống hình, mình mua hình con vịt màu vàng.nói chung tầm giá này thì tốt, mình mua có sale nữa nên tạm ổn tốt được.",1,0,0,0
"không hai lòng ,ca không giữ được nhiệt, nhưng bám hơi, đọng nước xung quanh bình, đọng luôn cả nắp ca",1,0,0,0
"giữ nhiệt kém, nắp bình không chắc chắn",1,0,0,0
"ca đẹp nhưng thiết kế nắp dở quá, không có ron cao su chổ nút bịt, ngã ca một phát nước chảy ra lên láng. hơi dở.",1,0,0,0
"thiết kế buồn cười. nắp có roong nhưng lỗ uống trên nắp lại không có, thế là nước ra ngoài dễ dàng khi vận chuyển",0,0,1,0
"thấy mua tặng kèm ly nhưng nhận thì không có, đặt trong ngày 3/10",1,0,0,0
không nhận được sản phẩm khuyến mãi như đã quảng cáo,0,0,1,0
"van khoá không kín, bị hở nha mọi người. làm ngã sẽ chảy nước ra ngoài.",1,0,0,0
ly đẹp nhưng không đựng được sữa với đồ uống có gas,1,0,0,0
sản phẩm nắp đậy làm không kín nên khó mang theo,1,0,0,0
"bàn chất liều thì khá tốt rồi, cho dụng cụ và ốc lắp đầy đủ nhưng cớ sao lại không khoan lỗ để vặn ốc vậy. nhưng chỗ khoan lỗ rồi thì khoan lệch không thể lắp vào được. mọi người cần nhắc trước khi mua.",1,0,0,0
"ọp ẹp, không thích lắm, mặt bàn nhanh hỏng dù không để gì nhiều",1,0,0,0
"sản phẩm lỗi, lỗ khoan sai không lắp được",1,0,0,0
kém áp lắm bàn mặc dù vặn rất kỹ nhưng không chắc vẫn bị lung đưa 1 tý nhưng với giá tiền ý thì cũng oki,1,0,0,0
"bán mỗi bàn, ốc vít lắp bàn thì không có, chả hiểu mua về lắp kiểu gì",1,0,0,0
"bàn vừa không cố định, lỗ khoan lại không đều, thôi có 500k tôi không tiếc, khuyên mn không nên mua, có mua đồ nội thất thì tốt nhất nên ra tận nơi",1,0,0,0
"chất lượng quá kém, lổ khoan không đúng vị trí. sẽ không bao giờ mua sản phẩm của cty này hoặc là giới thiệu cho người khác",1,0,0,0
"thất vọng, mặt bàn bị lỗi 2 góc ở phía trên",1,0,0,0
"sao mình lắp vào nó không chắc chắn vậy, cứ lắc qua lắc lại, vít bắt vào gỗ không chắc chắn lắm",1,0,0,0
của mình giao thiếu bộ óc lắp rồi ạ,0,0,1,0
"hang giao tot, oc vit day du. vi tri bat oc mat ban kha te, can dieu chinh lai vi tri khoan lo.",1,0,0,0
"ốc gắn quá ngắn nên không thể gắn được ,",1,0,0,0
nhỏ hơn trong hình và ốc với lỗ không đúng vị trí,1,0,0,0
"sản phẩm không giống hình ảnh,sản phẩm lắp ráp nhưng không nói voi kh",1,0,0,0
góc bàn vỡ 1 miếng nên cho 3 sao,1,0,0,0
bàn không giống hình tại sao lại thiếu thanh đứng,1,0,0,0
bị chóc lớp góc gói không cẩn thận thất vọng,1,0,0,0
"cũng tạm ổn tốt, không có hướng dẫn lắm. bàn khá yếu",1,0,0,0
bán quá bé. khong dunhf được cho pc,1,0,0,0
"giao sản phẩm không có vít bắt,",0,0,1,0
"túi chỉ để được đồ ngoài, với sóng nhựa thì không vừa, đáng ra cao 45cm, ngang 60cm thì vừa sóng. đây cao quá nhưng bề ngang thiếu, chỉ vừa sóng loại nhỏ hơn.",1,0,0,0
"sản phẩm rất nhanh rách, mới dùng 2 3 lần rách te tua",1,0,0,0
"chất lượng sản phẩm rất tốt nhưng giao sản phẩm sản phẩm quá chậm, đặt sản phẩm từ 10/6 tận 15/6 mới giao sản phẩm. cửa sản phẩm cần chú ý hơn",0,0,1,0
"sản phẩm chất lượng không như hình, ván ép dán bong tróc, không thẩm mỹ.",1,0,0,0
sản phẩm đa phần là tốt nhưng có vẫn có chi tiết bị lỗi ở phần thanh chữ h có cạnh bên bị dài hơn so với thiết kế và vị trí ốc vít bị lệch làm viêc lắp ráp là không thể!,1,0,0,0
sao không có đinh vít.giờ sao lắp,1,0,0,0
"haizzz, các thanh gỗ không được khoan đủ lỗ, bất tiện cho người dùng.",1,0,0,0
"đặt loại lớn 80cm, cửa sản phẩm giao loại nhỏ 60cm",0,0,1,0
hai miếng nhỏ ở trên không bắt được do lệch lỗ. các lỗ bắt vít không làm trìm xuống lên nhìn hơi thô,1,0,0,0
giao sản phẩm đúng hẹn. chất lượng bình thường. dễ lắp.,0,0,1,0
không có ốc để gắn. gỗ bị dính bẩn cực gớm.,1,0,0,0
"giá thanh dài thanh ngắn, thiếu ốc vít, độ hoàn thiện chưa cao.",1,0,0,0
không có hướng dẫn lắp đặt cho khách sản phẩm.,1,0,0,0
đặt màu trắng nhưng lại giao vân gỗ,0,1,0,0
pin ngắn quá. không sử dụng được,1,0,0,0
"không có phụ kiện kính đeo mắt như quảng cáo, nhưng vẫn thu đủ tiền. thất vọng!",1,0,0,0
không xuất được hóa đơn gtgt,0,1,0,0
4 cái xanh không sao. mua đến cái đỏ thì không dùng được,1,0,0,0
"chất lượng kém chất lượng,nắp nhựa.sản phẩm điêu",1,0,0,0
giao sản phẩm nhanh nhận đúng. có điều làm theo hướng dẫn không được,0,0,1,0
đèn hơi mờ chiếu không xa lắm,1,0,0,0
ánh sáng hơi yếu so với các đèn khác cùng loại. diện tích phủ ánh sáng không lớn.,1,0,0,0
"được, dụng cụ sạc pin mau hư",1,0,0,0
pin kém chiếu 5p là phải sạc,1,0,0,0
không thấy tia đỏ nè chất lượng kém,1,0,0,0
"vì không bật được chức năng ,tia sáng lase không có",1,0,0,0
chất lượng không được tốt cho 3 sao,1,0,0,0
mới mua về dùng mấy ngày hư,1,0,0,0
quá tệ nẹp dây điện được 1 ngày là rơi ra dù đã lâu chùi sạch sẽ trước khi dán lên,1,0,0,0
sau khi mua về sử dụng thì mình lại nghĩ dán mẹ băng keo trong cho nhanh chứ keo 2 mặt để dán cái nẹp dây này yếu quá dán trên giấy nhưng tuột huống chi trên tường trên kính,1,0,0,0
dán không dính được lâu. dán dây điện đi dưới bàn gỗ được vài ngày là sứt ra. cả 2 loại nhỏ và lớn,1,0,0,0
kéo dán không chắc. dán dây điện đi dưới bàn gỗ được vài ngày rớt,1,0,0,0
miếng dán và miếng nhựa không dính chặt lắm sau khi dán. sau một đêm dán thì thấy miếng nhựa bị bong ra khỏi miếng dán,1,0,0,0
"keo dính kém, dễ rơi rớt",1,0,0,0
"phần dính không chắc. phần nẹp dây điện thì tạm ổn tốt tốt, chất liệu cứng cáp, loại bé vừa 1 dây.",1,0,0,0
không dính chắc. sau một thời gian ngắn tự động rớt ra,1,0,0,0
"không dính chắc, sau ít lâu tự động rớt ra",1,0,0,0
"đã nhận được sản phẩm sớm hơn dự định, sản phẩm đóng gói tốt. nhưng dán vào tường có cái bị bong phải cạo keo ra dán lại thì tốt. tỉ lệ là 20 . tuy nhiên sd vẫn tốt. tks",0,0,0,1
sản phẩm keo không dính lắm.,1,0,0,0
"không có băng dính 3m nhưng là dính bằng xốp, không dính được vài ngày đã bong",1,0,0,0
"băng dính rất kém, không đỡ nổi dây điện",1,0,0,0
khả năng kết dính của chất lượng kém……… tiki bắt phải viết đủ 25 ký tự,1,0,0,0
miếng dán không được chắc chắn như quảng cáo. dễ bị bong dù đã vệ sinh chỗ dán rất kĩ.,1,0,0,0
"miếng dán không được chắc, dán 1 khoảng thời gian là bung ra, mình phải mua keo về dán thêm vào",1,0,0,0
"dán không ăn,được 1 phút bong ngay",1,0,0,0
keo 3b chưa chắc bị rơi khi dán,1,0,0,0
"khoảng vài ngày là bung keo, đã để keo dính 24h nhưng vẫn bung",1,0,0,0
"keo dán không được tốt lắm, mới dán vài ngày đã bong ra rồi.",1,0,0,0
"yếu. gắn được 1 buổi thì bong, gãy",1,0,0,0
thất vọng keo vừa dán đã bong,1,0,0,0
"nhựa cứng nhưng nhưng nhiều ba vớ có cạnh bén, có thể cứa tróc dây, thậm chí nhưng biết cả lỗ luồn dây. keo cắt sẵn không vừa.",1,0,0,0
"băng keo dán với khâu nhựa giữ giây điện thường xuyên bị sứt ra,độ dính không chắc chắn.",1,0,0,0
"chỉ hợp với dây điện nhỏ , độ dính bình thường",0,0,0,1
"miếng dán nhưng không có keo, bây giờ đi mua keo 3m. phiền",1,0,0,0
kéo dán độ dính kém không thể dính vào tường,1,0,0,0
keo dính kém không giữ được kẹp nhựa vào tường,1,0,0,0
quảng cáo thì chất liệu nhựa trong suốt nhưng sản phẩm thực tế thì nhựa kém chất lượng rất xấu.,1,0,0,0
"giá giá cao hơn chỗ khác, cứ nghĩ là sẽ tốt hơn. tuy nhiên miếng dán không chắc, dễ bị rách. không cho chọn màu.",1,0,0,0
"móc hơi nhỏ so với dây thông thường, giòn dễ gẫy và dính kém.",1,0,0,0
"keo dán kém, nhanh bị bung",1,0,0,0
"quá tệ, dán không dính, rơi rớt vỡ",1,0,0,0
không dán được vì không có keo,1,0,0,0
sản phẩm không dán chắc chắn như mô tả,1,0,0,0
không dính tốt lên tường cho lắm,1,0,0,0
"keo dán 1 ngày rớt rùi, kém chất lượng",1,0,0,0
"dễ bong, tuột keo, không bền",1,0,0,0
"keo dán dễ bung, xài không được lâu. tầm 2 tháng là cùng",1,0,0,0
