content,Quality,Service,Shipping,Packing
1 set quần có 2 loại size. 1 cái vừa 4 cái nhưng lại chật. vải và đường chỉ đẹp.,1,0,0,0
"xuất hoá đơn vat quá lâu, hỏi tiki thì nhận phản hồi là 1 tháng sau khi nhận sản phẩm. không biết cái luật gì? ví dụ mua 20/11 thì qua tháng 12 mới xuất à?",0,0,1,0
"chọn sai xxl nhưng lần này quần nhỏ như sai l lần mua trước,tính trả đổi nhưng ngại nên thôi",1,0,0,0
"hơi mỏng so với mong đợi, nhưng phù hợp với giá tiền",1,0,0,0
"5 quần thì 1 quần chất liệu vải mưa nên mình bỏ luôn chiếc đấy, nhưng 4 chiếc thì 1 chiếc chất cũng sột soạt.",1,0,0,0
kiểu dáng đường may thì không có gì phải chê . nhưng chất vải thì toàn là vải may áo sơ mi thừa rồi may quần nên không phù hợp . nhưng thôi tiền nào của ấy .,1,0,0,0
"chất vải hơi cứng, chất vải mềm chút sẽ tốt hơn",1,0,0,0
"giao sản phẩm nhanh, đóng gói cẩn thận, sản phẩm đẹp. nhưng mình đặt là quần nữ mở ra lại là quần nam.",0,0,0,1
"vải mềm, combo giao có đủ số lượng. tuy nhiên màu già quá, huhu. thấy bạn trước nhận toàn quần màu trơn nhưng ham.",1,0,0,0
"quần đẹp, vừa vặn, vải hơi mỏng, không biết có mau rách không.",1,0,0,0
mình đã nhắn tin lại 2 3 lần là mình lấy size l cuối cùng vẫn giao xl làm sao con mình mặc vừa,1,0,0,0
sản phẩm bình thường so với giá tiền,1,0,0,0
"khi đặt 125k 10 cái, nhận chỉ có 5 cái. không hiểu sao tìm lại tài khoản cá nhân đặt lúc đầu để xem lại, không hiển thị.",0,0,1,0
"quần may chắc chắn, tuy nhiên các màu sản phẩm tôi nhận được không đẹp, không như hình quảng cáo bán sản phẩm.",1,0,0,0
"đặt mua 4 combo quần nữ, nhầm 01 combo quần nam! chất lượng tốt, một số quần may bị sổ chỉ.",1,0,0,0
"không nên mua , size không chuẩn, vải nóng",1,0,0,0
không thấy tem thể hiện loại vải. mỏng nhẹ nhưng thiếu sự mềm mại.,1,0,0,0
"hình đẹp nhưng chất lượng xấu, không giống, nhìn đúng sản phẩm chợ",1,0,0,0
giao sản phẩm không đúng mẫu,0,0,1,0
sản phẩm gửi không giống hình. đảo,1,0,0,0
"váy quá mỏng,vừa size nhưng phần trên quá mỏng",1,0,0,0
tôi đã trả sản phẩm và bên giao đã lấy sản phẩm. nhg vẫn chưa được hoàn tiền?,0,1,0,0
chất lượng tương xứng giá tiền,1,0,0,0
"mua 2 bộ cho vợ, 1 hồng thì con gái 4 tuổi mặc vừa, 1 bộ thì khác hẳn màu và mẫu mã trên ảnh sản phẩm, đảo à?",1,0,0,0
"bán sản phẩm không đúng như hình mẫu đã chụp, hình là lụa gầm hồng nhưng giao bộ lụa bóng đỏ lè",0,0,1,0
"mua cho mẹ nhưng con mặc, wtf, lần đầu mua trên tiki nhưng khác trong hình thế này, tin tưởng -5 điểm, chịu",1,0,0,0
treo đầu dê bán thịt tôi mua hoa văn giao kg giống hoa văn của .tôi mua áo dài tay giao áo ngắn tay,1,0,0,0
"oki sản phẩm khá tốt! nhưng vẫn có lỗ: "" chỉ thừa nhưng khá nhiều , may chx oki nhưng."" đấy chỉ là lưu ý nhỏ cho cửa sản phẩm thoi mk vẫn ủng hộ cửa sản phẩm",0,1,0,0
mua và giao không giống. cửa sản phẩm làm vậy ai dám mua thêm lân nữa,0,1,0,0
"vải quá nóng, thô ráp. đường may xấu.",1,0,0,0
"chất liệu vải không đẹp như hình, lớp trong mỏng vải rất nóng",1,0,0,0
"tạm ổn tốt được. đường chỉ bên trong thưa, mặc được 1 tuần nhưng đã rách đường chỉ bên trong rồi",1,0,0,0
áo vải chất liệu bình thường,1,0,0,0
"áo nhận có mùi khó chịu, không size to nên mặc rộng, không ưng lắm",1,0,0,0
"chất lượng may rất kém, màu không đẹp",1,0,0,0
áo xấu hơn trong hình nhiều vải thô cứng,1,0,0,0
"áo cũng tốt, nhưng form bị rộng quá!",1,0,0,0
"sản phẩm quá rộng, chất xấu, không mê nổi",1,0,0,0
"chất liệu vải cứng, nóng.",1,0,0,0
áo bị rách xíu ở trong bao,1,0,0,0
phù hợp giá tiền nên chất cũng bình thường,1,0,0,0
sản phẩm không lung linh như trong hình. xấu.,1,0,0,0
làm sao để trả lại sản phẩm vì vải và mẫu đầm không giống hinh,1,0,0,0
đăng 1 đường bán 1 nẽo. không giống hình mẫu. tiki là ăn kì quá,1,0,0,0
sản phẩm mặc vô bị bung chỉ,1,0,0,0
"sản phẩm không đúng như ảnh, may rất không hài lòng",1,0,0,0
chất liệu vải không giống hình,1,0,0,0
đầm không đẹp rất xấu,1,0,0,0
sản phẩm giả mạo không giống hình trên máy.,1,0,0,0
sản phẩm không đúng mẫu . khách sản phẩm,0,0,1,0
cửa sản phẩm nghỉ sao đơn sản phẩm vàng tim nhưng đưa màu tím. thất vọng quá không có lần sau đâu,0,1,0,0
"nóng lắm các bác ạ, mình mua về mới mặc cái quần thôi,mặc cả bộ chắc ngồi điều hòa khỏi ra ngoài may ra thì được.",1,0,0,0
vải tốt. chất lượng cũng được,1,0,0,0
"đặt 1 cái đỏ 1 cái xám, rốt cuộc giao 2 cái đỏ. mua của cửa sản phẩm mấy lần rồi. lần này thất vọng quá",0,1,0,0
chất vải tốt.áo ngăn quá mới lại áo chống nắng nhưng không có xỏ ngón.mặc như là áo khoác vậy,1,0,0,0
"sản phẩm mô tả màu da, nhưng giao màu hồng.",0,0,1,0
sản phẩm nhận được là mẫu trơn không có ren như hình.,0,0,1,0
"điểm cộng là áo mát, vải đẹp điểm trừ là mỏng và bị ra màu khi giặt.",1,0,0,0
"chất liệu thường, mỏng không chống nắng được",1,0,0,0
mình chọn size hơi bé. chất lượng tạm ổn tốt tốt so với giá.,1,0,0,0
"lúc mới nhận sản phẩm không để ý kĩ,sau 1 tháing mặc thấy có 1 lỗ nhỏ ở vai bên phải,giá khuyến mãi nên sản phẩm bị lỗi chăng?",0,0,1,0
"mình muốn đổi size, đã liên hệ và của goking nhưng chẳng được ai hồi âm gì cả.",0,1,0,0
"bám dính kém, không như quảng cáo",1,0,0,0
"sản phẩm bình thường, kiểu dáng không giống như quảng cáo",1,0,0,0
"giá cao so với chất lượng, dính khó chịu lắm, chỉ bằng mấy miếng hình hoa 10-15k thôi",1,0,0,0
"size không đúng kích thước,nhỏ. 5 cái chỉ có 1 cái đúng size.",1,0,0,0
sao tôi lấy màu trắng lại giao màu đỏ đổi lại màu trắng cho tôi vì giao cho tôi 2 cái màu đỏ,0,0,1,0
"không hài lòng. form áo thì to form quần thì bé, đệm ngực không chắc chắn, dễ xộc xệch, không đảm bảo khi bơi.",1,0,0,0
"áo đẹp như hình nhưng nhỏ hơn bình thường 1 size. mình nghĩ là nên có bảng chi tiết số đo ngay trên phần chọn size, chứ giấu trong phần mô tả sản phẩm thì đánh đố khách sản phẩm quá, trong khi mặt sản phẩm này không hỗ trợ đổi trả. nếu muốn hiển thị thông tin như các cửa sản phẩm khác thì, mình nghĩ, cũng nên đi theo quy chuẩn số đo của họ. đằng này đã làm khác đi, lại không rõ ràng nhưng dịch vụ cũng không hỗ trợ. giờ mua về lại không mặc được. đây là lần đầu tiên cũng là lần cuối cùng mình mua sản phẩm ở đây nha mây fashion nha. chút trải nghiệm chính sách hậu mãi cực kỳ khó chịu.",0,1,0,0
"mút áo bị chạy trong lớp áo đồ mình chọn vừa cơ thể nhưng mình thích rộng hơn tí quần thì bị cuốn lai quần lên, không đẹp",1,0,0,0
"hanhg quá bé so vói size giói thiệu, chất lượng vải bình thường.",1,0,0,0
"form xấu cầm xong bỏ 1 bên luôn, cái mút ngực lỏng lẻo, nói chung thất vọng",1,0,0,0
"size thực tế nhỏ hơn ghi trên hướng dẫn. vải nhàu, không đẹp. không nên mua",1,0,0,0
chất lượng kém. áo ngắn tí nhưng chọn l rồi đó,1,0,0,0
chất liệu mỏng. mút ngực xộc xệch. giá thành cao so với chất lượng.,1,0,0,0
"chất liệu kém, có thể trả lại ko.",1,0,0,0
vai dep ma đường may xấu qua,1,0,0,0
"áo ngắn, mình cao chưa đến 1m50 nhưng nhưng bị ngắn. đành cho lại con gái 9 tuổi mặc",1,0,0,0
mình không hài lòng với chất liệu vải.,1,0,0,0
sản phẩm gửi chỉ có áo không có quần cửa sản phẩm ơi mất nguy tính,0,1,0,0
"vai dep nhung size nho, dat theo tư vấn nhưng vẫn không vừa",0,1,0,0
"mua 2 áo cùng size xxl nhưng 1 cái vàng thì vừa, cái xám lại chật",1,0,0,0
"không biết sao cửa sản phẩm cứ gửi sai màu hoài, đặt sản phẩm 2 lần đều gửi sai màu ,mình đặt sản phẩm màu trắng và màu đen nhưng gửi màu đen và màu xám. rất mong cửa sản phẩm kiểm sản phẩm kỹ trước khi gửi !",0,1,0,0
đặt màu vàng giao màu xám. hết sản phẩm thì để hết sản phẩm chứ. làm ăn tào lao. muốn hoàn tiền. không nói nhiều. mệt.,0,0,1,0
chất liệu bình thường hơi ôm so với thông số đưa ra,1,0,0,0
người giao thái độ kém,0,0,1,0
áo mặc không vừa áo lại dài,1,0,0,0
áo vải mỏng.chất thun cứng.màu thì giống hình. không ưng lắm.,1,0,0,0
"tạm ổn tốt được, dùng hơi nhàu, phải ủi",1,0,0,0
"giao sản phẩm nhanh, nhưng sai màu. đặt trắng + da nhưng giao đen + da. thanh toán trước nhưng thất vọng quá. sẽ không quay lại nữa.",0,0,1,0
áo như hình đăng bán. mua cho các cháu mới lớn mặc được. cũng không quá dày nhưng mình mua 2 chiếc 1 màu trắng 1 màu da thì màu trắng thấy chất thích hơn đấy. nó thun tốt hơn,1,0,0,0
gửi sai màu. đặt trắng giao đen.,0,0,1,0
yêu cầu tiki đổi sản phẩm dùm đồ không giống trong hình làm ăn vậy mất hết khách đồ quá to dày thô miếng mút bên trong không gỡ ra được,1,0,0,0
"sản phẩm giao nhanh, nhưng bị bẩn",0,0,1,0
"chất liệu hoàn toàn không giống hình và mô tả. vải thun giống vải áo thun, dày và form không ôm dáng.",1,0,0,0
"giá thì rất giá giá rẻ, nhưng khoảng cách của dây áo phía sau lưng rất dễ bị lật dây mình thấy vậy,",1,0,0,0
"giặt máy là bay hết tấm đệm ra ngoài,",1,0,0,0
"áo dở, mua áo và quần.phí giao sản phẩm 35k. nhưng chi giao áo giá 28k nhưng giao sản phẩm 35k mới shock",0,0,1,0
"cái gì cũng chắc trừ cái dây giãn quá, nên nó xệ xuống, phom dáng được, chỉ dành cho b teen hoằc gầy và ngực nhỏ thôi, 35+10k cước =45k sẽ không mua lại",1,0,0,0
giao sản phẩm nhanh chóng tốt,0,0,1,0
không mặc được quá nhỏ mặc dù đã xem size,1,0,0,0
"sản phẩm may ẩu, bung chỉ, tuy nhiên áo mặc lót nên tạm ổn tốt chấp nhận được.",1,0,0,0
"chật, thích hợp với tuổi teen",1,0,0,0
không có miếng lót. vậy tính ra mặc bra cũng như ko,1,0,0,0
"sản phẩm chất vải dày, rộng quá cỡ, không đẹp. chất lượng tệ",1,0,0,0
"áo dây mềm quá, dễ giãn và không giống hình",1,0,0,0
chất liệu vải không đẹp so với các sản phẩm khác,1,0,0,0
"sản phẩm có chất lượng kém, chịu thôi, do giá giá giá rẻ",1,0,0,0
vừa với giá tiền.không đẹp nhưng cũng không tới nỗi.,1,0,0,0
"mặc cũng được, không đẹp như kỳ vongh",1,0,0,0
sản phẩm không giống hình. may rất xấu và to,1,0,0,0
size mặc không vừa,1,0,0,0
áo chất dáng đẹp như quảng cáo.,1,0,0,0
không hài lòng. giặt xong đã xù hết lông lên,1,0,0,0
chất lượng áo quá tệ.,1,0,0,0
cũng đẹp và tốt sương sương,1,0,0,0
không mặc dừa buồn quá đi,1,0,0,0
"dở,không như hình,chỉ dễ bung",1,0,0,0
"sản phẩm không giống hình ,không mua sản phẩm ở ung dụng này nửa,",1,0,0,0
không cung size sản phẩm mặc không vừa,1,0,0,0
mặc chật chất vải dầy không phù hơp chống nắng,1,0,0,0
vải rất mỏng .giá cao nhưng sản phẩm không đạt yêu cầu !,1,0,0,0
"vải hơi mỏng, không hài lòng lắm",1,0,0,0
áo khoác chất cotton vải mềm mát nhưng khá mỏng. cảm tưởng chỉ cần giặt 1 2 lần là áo bị chảy xệ mất thôi. bạn nào không thích mỏng thì nên cân nhắc.,1,0,0,0
màu áo không giống như hình,1,0,0,0
vài mịn mặc rất mát áo này mình rất thích sẽ mua thêm một cái nữa.,1,0,0,0
"đảo, mua áo khoát giao áo thun, h không chịu thu hồi đổi trả",0,1,0,0
