content,Quality,Service,Shipping,Packing
2 sao vì ghn giao hộp và sách đến tệ. nhưng kg phải đánh giá về sách.,0,0,1,0
dùng từ ngữ địa phương quá nhiều.,1,0,0,0
"tiki giao sản phẩm nhanh và đóng gói cẩn thận nhưng về nội dung sách thì không phải bàn ,tuy nhiên mắc lỗi chính tả nhiều ,cỡ chữ nhỏ nên dễ bị hoa mắt làm mình có chút thất vọng",1,0,0,0
sách đẹp nhưng dịch sai khá nhiều. rất khó chịu khi đọc.,1,0,0,0
"đánh giá không tính điểm người giao sản phẩm là trình quốc nam - thái độ, giao tiếp khi giao sản phẩm không được vui vẻ, khá cộc tính. khách ha dg không thích điều đó",0,1,0,0
phí síp nhiều . mua nhiều phí sip nhiều. 3 quyển. 14×3=42n tiền sip. tính ra vẫn giá cao,0,1,0,0
chắc chưa hợp cho bé 10 tuổi con mình. bé đọc xong nói cảm thấy tụt mood so với phim và bài hát,1,0,0,0
"chất lượng làm sách của nxb không được như mong đợi, nếu đọc lâu dở các trang sẽ bị bong gáy. tiki thì giao sản phẩm nhanh, sách bọc cẩn thận nhưng vẫn có vết sứt nhẹ, mong tiki làm tốt hơn.",1,0,0,0
"chất lượng sách thì tốt nhưng noiij dung thì thấy cũng bình thường, không thu hút lắm. đọc xong thì tóm lại cũng 2-3 ý chính thôi nhưng lặp lại hơi nhiều. những ai có gia đình thì cg nên đọc vì lý thuyết thì nên đi đôi vs thực hành",1,0,0,0
sách của mình bị cắt thừa :> rồi giấu nhẹm bằng cách gấp vào trong.,1,0,0,0
sách mình mới nhận được và bị lỗi như vầy. mấy lần trước mình đặt không sao và hộp đóng gói luôn nhưng rất mới. nhưng lần này nhận được hộp móp méo và kiểm tra sách thì thấy bị lỗi.,1,0,0,0
"chưa biết nội dung ra sao nhưng nhưng bên ngoài rất bụi nhá. sách như là bị rớt hay va đập hay sao nhưng có vài chỗ hơi méo móp, riêng bản thân mình không thích điều này.",1,0,0,0
"mình khá hài lòng về đợt sản phẩm lần này! sách con mới, có điều giao tới không bọc gi hết, mưa ướt hết hộp giấy, cũng may chưa ướt hết sách. mong tiki đóng gói cẩn thận hơn, ít ra phải có bọc mỏng bọc sách lại chứ.để trơ trọi vậy bỏ cuốn sách vào à.rất dễ hư sách, mưa cái là đi toi luôn",0,0,0,1
hôm qua mình có đặt một đơn sản phẩm của tiki gồm 8 cuốn sách và trong đó có bộ tứ thư lãnh đạo rất dày. mình để giao sản phẩm tiêu chuẩn thứ 2 nhận nhưng hôm nay đã nhận được nhưng không thể chấp nhận được với kiểu đóng gói sách khi giao cho mình. nét hết cả 8 cuốn vào một hộp. nhìn như sản phẩm ký gửi đi máy bay bị ném quăng quật vậy. may nhưng sách mình không có vấn đề gì.,0,0,0,1
"đã mua bookcare nhưng sách không được bọc. kiểm tra thì số lượng bookcare số 0 tròn trĩnh. khiếu nại thì nhận được câu trả lời là sẽ kiểm tra bookcare, nếu sách muốn được bọc bookcare thì phải trả sản phẩm và đặt lại cuốn khác. thời điểm mua được hưởng giá khuyến mãi tốt, đặt lại thì chênh lệch hơn 20k, giải quyết như thế nào?",0,1,0,0
"sách đẹp, giao chất lượng tốt nội dung của sách, theo quan điểm cá nhân mình thì mình thấy bình thường, thật ra có một chủ đề được tác giả phân tích nhiều lần lại, đọc cũng ít lôi cuốn. review nhỏ, chúc các bạn đọc sách vui vẻ!",1,0,0,0
giao sản phẩm nhanh tuy nhiên sách giống như đã qua sử dụng. không có giấy bọc sản phẩm.,1,0,0,0
sách thì chưa đọc nhưng tình trạng đóng gói bên tiki dạo này tệ thật sự,0,0,0,1
"mình mua một lúc rất nhiều sách nên chỉ giở ra xem qua từng quyển, tới quyển này thì cảm giác đầu tiên là sách đã dùng rồi/sách cũ. nhìn bằng mắt bt thì không bị rách hay vấn đề gì quá nghiêm trọng nhưng cảm giác mở quyển sách vừa được chuyển tới nhưng lại như sách dùng rồi đúng là không dễ chịu gì. nên quyển này mình mới phải đánh giá đầu tiên cho đỡ bức xúc. nhưng giao sản phẩm thì khá nhanh.",1,0,0,0
sách không được bọc kĩ. bị xước bìa sách. giấy hơi nhăn.,1,0,0,0
"sách khá cũ, tất cả các góc của sách đều bị cong",1,0,0,0
"sách đã qua sử dụng, many trang bị nhăn và bẩn, bìa sách thì xước, không có lớp giấy bọc như khi mua sách mới.",1,0,0,0
"khi đặt sản phẩm mình có đặt bookcare nhưng bookcare bị hỏng. mình liên hệ lại với tiki và tiki đồng ý hoàn lại, nhưng khi nhận lại sách thì hoàn toàn không có bookcare. liên hệ lại với tiki 1 lần nữa thì tiki có xin lỗi và nói sẽ cộng lại bookcare cho mình và tặng voucher giảm giá. nhưng sau many ngày thì vẫn không thấy cộng lại bookcare. rất thất vọng về dịch vụ của tiki thời gian gần đây!",0,1,0,0
"mình ít khi nào để ý những vấn đề nhỏ khi vận chuyển có thể hơi trầy tý, hơi cong tý . nhưng cuốn này được giao như là một cuốn đã qua sử dụng. hên là bên trong không bị lỗi gì",1,0,0,0
"sách bị thiếu trang, từ trang 64 nhảy lên trang 82",1,0,0,0
"tiki đóng gói cẩn thận, giao sản phẩm nhanh nhưng bản dịch tiếng việt của sách khá tệ. có vẻ như dịch giả dịch sách bằng google translate nên đọc rất khó chịu.",1,0,0,0
nếu ai yêu sách thì nhìn hình này có xót không cơ chứ,1,0,0,0
giao sản phẩm nhanh. sách bị nỗi,1,0,0,0
thật sự thất vọng về sách. đây là lần thứ 2 mua sách của tiki gặp lỗi?,1,0,0,0
"theo cảm nhận của cô bé tuổi 20 với tôi những câu chuyện trong cuốn sách không được cuốn hút lắm, có thể nội dung sách hay nhưng những mẫu chuyện quá dài làm tôi không hứng thú khi đọc",1,0,0,0
từ giờ chỉ đánh 1 sao vì do vận chuyển của tiki như c c,0,0,1,0
chưa đọc nên chưa review được nội dung. nhưng sách mới nhưng mở trang thứ 4 đã rách. nét chữ in thì chồng chéo nhau rồi mất chữ nữa.,1,0,0,0
"mình đặt sách thì đơn sản phẩm có gift coupon như này, nhưng giao sản phẩm thành công vẫn không có thông báo. tiki tự huỷ đơn sách những kẻ xuất chúng của mình, chờ sau 3-5 ngày rồi nhưng không thấy hoàn tiền dạo này trải nghiệm mua sản phẩm tiki hơi thất vọng",0,1,0,0
sắch tiki giao nhưng bị méo sách của mình. nội dung sách thì hay nhưng giao sách để bị méo sách vs trầy bìa là không ưng,1,0,0,0
"mình mua 2 cuốn từ tiki trading, cuốn từ tốt đến vĩ đại được bọc nilon chắc chắn, cuốn này bìa cũ, dính keo, sách không có bọc.",1,0,0,0
tiki giao sản phẩm sớm mình thấy rất tốt. nhưng sách mình nhận được bị vàng ố như sách cũ ntn thì không ưng lắm. so với các bác bị thiếu trang vs trùng nội dung thì vẫn chấp nhận được. sẽ đọc kỹ và rì viu sớm.,1,0,0,0
"giao sản phẩm nhanh, lịch sự nhưng sách hơi cong và nhăn nhúm",1,0,0,0
"trước giờ mua sách tiki đều rất hài lòng nhưng hôm nay mình nhận cuốn này thì thấy bị xướt hơi nhiều, mặt trước thì ít hơn nhưng nhìn cũng không được mới lắm :",1,0,0,0
nhiều trang sách bị rách và một số trang khác cũng dễ bị rách,1,0,0,0
"nội dung cũng tốt nhưng cách vào vấn đề hơi dài dòng, vòng vo muốn pr nhiều hơn là tập trung vào vấn đề chính, có những nội dung như bị trùng lặp. không được như mong đợi như những đánh giá và lời tựa của sách mang lại.",1,0,0,0
sách rất hay nhưng chất lượng giao sản phẩm của tiki thật sự rất tệ. 5 sao cho nội dung của sách nhưng về mảng giao sản phẩm của tiki thì 1 sao.,0,0,1,0
rất thất vọng ạ. như một quyển sách cũ. keo dính lên sách và bị gập như thế .,1,0,0,0
sản phẩm bị in thừa chương đầu tiên nên mk đã xé đi,1,0,0,0
"mình mua 2 cuốn, đều bị bẩn ở gáy sách. và chữ viết các trang không giống nhau.",1,0,0,0
có đặt thêm thiệp nhưng không thấy giao thiệp,0,1,0,0
"sách không hề bị bẹp góc nhé nhưng siêu bụi, mình nghĩ mọi người nên mua bookcare đi chứ mấy vết này lau mãi không đi",1,0,0,0
"tác phẩm viết về xã hội afghanistan, cuộc sống con người dưới chế độ độc tài taliban. chất lượng giấy của nhã nam kém.",1,0,0,0
sách thì rất hay thiết kế đẹp nhưng giao sản phẩm bị nhăn và sách thì hơi bẩn,1,0,0,0
lần này mình thật sự rất thất vọng với tiki ? nhưng cũng giao sản phẩm nhanh,0,1,0,0
"móp góc sách, nhưng lại tốt r ah",1,0,0,0
5 sao nha. rất thơm rất hay rất tuyệt. nhưng bị ngta stolen rồi nên nhưng 3 sao,0,1,0,0
"đang trong đợi sách về tay, unbox ra gặp như v…chán không thể tả",1,0,0,0
"chất giấy đẹp nhưng hình ảnh với nội dung sách thì không liên quan gì đến nhau. mình đã đọc bản tiếng anh, đọc sang bản này thấy cách dịch thuật như kiểu copy lên google translate rồi in thành sách. khuyến khích mọi người kiếm mua bản tiếng anh :",1,0,0,0
"hm chắc mình không quá phù hợp với thể loại sách này lắm, chủ yếu nó nói suông hơi nhiều",1,0,0,0
"sách được bọc nên giữ được sạch sẽ, nhưng các trang bên trong bị dính quá nhiều, chị mình mất 1 buổi chỉ để ngồi rọc giấy tách các trang ra. khá khó chịu về vấn đề này, mong nxb xử lý cho những đợt sau",1,0,0,0
"giao sản phẩm nhanh, đóng gói của tiki thì khá tốt nhưng cuốn sách thì đã bị nếp nhăn ở bìa. nếp mở sách nên trông quyển sách bị cũ",1,0,0,0
bookcare như lỗi như vầy sao bọc được giờ 🥲,0,1,0,0
"mình đã mua đồ ở tiki rất nhiều lần rồi, chưa gặp phải sản phẩm bị lỗi hay chất lượng kém bao giờ. lần này quả thật thất vọng mua sách cho mình đã đành nhưng đây là sách mình muốn mua tặng bạn mình cơ. cầm cuốn sách bị mốc đoạn gáy như kia thấy xót xa quá",1,0,0,0
sách bị gập mép nhưng giao sản phẩm nhanh đóng gói cũng được,1,0,0,0
tiki ơi book care dạo này chất lượng đi xuống quá,0,1,0,0
"giấy thừa, sách bị gập, hơi thất vọng",1,0,0,0
nhăn góc. giao 3 cuốn bị 2 cuốn,1,0,0,0
không hề có chữ kí tác giả ạ,0,1,0,0
"sách bị gấp, rách, nhăn nheo. mình khi mua và đọc sách thì giữ rất kĩ nên gặp tình trạng này khá khó chịu",1,0,0,0
"ủa alo, 208 nhảy đến 225 là sao",1,0,0,0
vẫn chưa nhận được hoá đơn vat,0,1,0,0
đóng gói không đủ an toàn bảo vệ sách.,0,0,0,1
sách lỗi nặng sách lỗi cắt không đồng đều mí,1,0,0,0
"gáy sách bị hư, hộp đựng nguyên vẹn nên gáy hư từ trước khi đóng gói",1,0,0,0
"sách không giống trong quảng cáo, trông rất cũ, chất liệu giấy tệ",1,0,0,0
sản phẩm bị rách nhẹ.,1,0,0,0
mua 5 cuốn 2 cuốn bị lỗi rồi,1,0,0,0
"lúc mình đặt sách thì đặt nhiều cuốn cùng 1 lúc nên không để ý giá thanh toán,lúc mình về thì người nhà nhận sản phẩm thanh toán cao hơn giá niêm yết",0,1,0,0
giao sản phẩm quá lâu từ 18/9 đến 27/10 mới được nhận,0,0,1,0
"giáo sản phẩm quá muộn ạ, chậm tới hơn tuần",0,0,1,0
"sách bị dính keo, cỡ này sách bên tiki cứ bị hư gì đó quài",1,0,0,0
"nội dung không hay , thất vọng",1,0,0,0
sao lại giao sách bị gãy nhăn như vậy cho không được vậy tiki?,1,0,0,0
sách in mờ chữ thì bé chất lượng sách kém nhất nhưng mình từng gặp : đọc loá mắt hoa mắt vì chữ in mờ,1,0,0,0
"bookcare bị lỗi, bọc sách lỏng lẻo quá",0,1,0,0
dịch vụ giao sản phẩm tệ. nv gọi không đi ra đầu hẻm lấy.,0,1,0,0
"tạm ổn tốt tốt in hơi mờ, giao sản phẩm nhanh đóng hói được",1,0,0,0
"đóng sản phẩm cực kì sơ xài, không bọc chống xốc.thùng rách lòi cả sách ra ngoài",0,0,0,1
mình mua để tặng nhưng kiểm tra thấy rách liên tiếp 4 trang liền ? buồn quá,1,0,0,0
"đọc thử 1 đoạn thấy hay nên mua về nhưng đọc xong không cảm nhận được hay như mong đợi, có thể do dịch hoặc khác văn hoá á âu nên ngôn từ cảm giác khô khan ít cảm xúc",1,0,0,0
"bảo quản sách chưa tốt, mong tiki cải thiện ạ",1,0,0,0
"mới đầu mua xem nhận xét thì thấy ai cũng nói hay. nhưng thực sự rất thất vọng, sách có chỗ trình bày luẫn quẫn. không như mong đợi. thật sự rất thất vọng khi mua cuốn sách này,",1,0,0,0
"mình nghĩ quyển này hợp với trẻ con hơn vì mình thấy không có gì đặc sắc cả, được cái hình vẽ rất cute",1,0,0,0
lần đầu mua ở tiki nhưng sách có vết sứt và bẩn ở mấy trang đầu. hơi thất vọng dù giao sản phẩm nhanh.,1,0,0,0
mình rất ghét quyển này. mình thấy many bạn review thấy bảo hay lắm nên mình cũng mua về đọc thử. quyển này phải 3/4 nói về chiến tranh thế giới thứ 2. bạn nào đọc quyển này phải biết 1 chút về tgt2; hoặc ít ra thích đọc lịch sử. mình đọc nhưng ngáp rách cả mồm. chán thiệt sự.,1,0,0,0
"như chuẩn bị rơi từng trang ra rồi, vừa mới nhận xong.",1,0,0,0
"giao nhanh, sách không bị hư hỏng gì. nội đúng có nhịp nhanh, như kiểu chuyến phiêu lưu, tuy nhiên tình tiết thì lại không hấp dẫn với mình lắm nên mình chỉ đọc 1 phần quyển sách thì dừng lại luôn.",1,0,0,0
"thấy cũng bình thường, không có gì đặc sắc",1,0,0,0
xin lỗi ! thật đáng tiếc tôi không đọc nổi cuốn sách này. tôi nghĩ mình cần hiểu biết thêm nhiều về lịch sử thế giới.,1,0,0,0
"bài dịch có vẻ lủng củng, khó đọc",1,0,0,0
font chữ in hơi chán. mới đọc được 4 chương. có ai biết dãy hi mã nạp sơn là gì ko?,1,0,0,0
"truyện hài hước, nhưng cách dịch không tạo ra cuốn hút, dài dòng, tên nhân vật thì dài nhưng cách ghi tên nhân vật không nhất quán nên khó nắm bắt mạch truyện.",1,0,0,0
nội dung sách hay chất lượng giấy tốt nhưng chất lượng keo dán tệ,1,0,0,0
nv giao sản phẩm bố đời.,0,1,0,0
bìa chất lượng kém,1,0,0,0
sách đẹp tiki chất lươngj nhưng nộ dung đối với mình thì dở ẹt,1,0,0,0
"sách bị lỗi, nhưng bị thủng đằng sau nữa nhìn như sách cũ. quá thất vọng về sản phẩm, sẽ không mua sản phẩm lần nào nữa 🥲",1,0,0,0
"nội dung thì không cần phải bàn cãi, rất đáng đồng tiền bát gạo. nhưng rất không hài lòng về loại giấy in này ._. đọc dưới ánh đèn bị phản chiếu lại ánh sáng. khiến cho việc đọc rất là khó khăn.",1,0,0,0
"phần 1 nhưng được, những phần sau không có gì mới.",1,0,0,0
"sách không hay như tưởng tượng, chắc là do không hợp lối văn",1,0,0,0
sách nhàu không đúng với giá tiền,1,0,0,0
giao sản phẩm nhanh. nhưng có trang bị rách cuốn sách mình mong đợi nhưng bị dậy cảm thấy bực vô cùng,1,0,0,0
"đóng gói kỹ, giao nhanh, nội dung dở",1,0,0,0
"đánh giá không tính điểm đóng sản phẩm ẩu,cho có vậy,rất thất vọng",0,0,0,1
ghi 500 nhưg thực tế có 167 trang?,1,0,0,0
"sách dịch không hay, khó theo dõi",1,0,0,0
nội dung thì chưa đọc nhưng sách thì chán quá lúc bọc thì tốt đến lúc mở bọc thì có chút nhăn + dính mực đen hơi thất vọng vì nxb trẻ có tận 4.9 sao,1,0,0,0
mở ra thấy 1 trang bị cộm cứ hi vọng là không lỗi. cho đến khi mở ra. nxb trẻ làm thất vọng quá!,1,0,0,0
thất vọng vì khâu book care. không làm được thì đừng làm. chúng tôi mua gói book care bằng tiền nhưng?,0,1,0,0
"chất lượng dịch của sách rất tệ, các ý trong câu khá rời rạc và không diễn tả được tiêu đề của mỗi chương.",1,0,0,0
"sản phẩm có vài lỗi, nhưng nội dung vẫn oke",1,0,0,0
nội dung sách có gì đó hơi dài dòng. phần dịch cũng không được thoát ý. có lẽ vì vậy nhưng sách có gần nghìn trang. chất lượng giấy không được tốt cho lắm.,1,0,0,0
"sách có nhiều vết bẩn, nhiều nếp gấp.",1,0,0,0
"bìa sách dính keo, dù đọc rồi sẽ bẩn sẽ ố nhưng lúc sách mới về thấy vậy không ưng",1,0,0,0
"sách của robert green tuyệt đối phải cấm xuất bản, nó làm hại người ta hơn là giúp",1,0,0,0
"mình chưa nhận được sản phẩm, tiki đã chuyển sang trạng thái đã giao",0,1,0,0
sách viết lan man. bạn cần nhiều kiên nhẫn để đọc nó . tiki giao sản phẩm nhanh.,1,0,0,0
chất lượng giấy quá tệ . không khác gì sách lậu,1,0,0,0
"chất lượng giấy kém, giao sản phẩm đúng giờ",1,0,0,0
"dịch chán thì đừng hỏi, không muốn hiểu",1,0,0,0
sản phẩm nhưng sai chính tả,1,0,0,0
"quá dài, sách này dành cho người rỗi.",1,0,0,0
"giao sản phẩm chậm,đặt sản phẩm từ ngày 2/6 nhưng đến tận 15/6 mới nhận được",0,0,1,0
"sách mép chán, sờn, rách.",1,0,0,0
"đúng sách nhưng mình đã note lại có hóa đơn nhưng không thấy, trong khi cùng đơn sản phẩm nhưng cuốn sách khác lại có hóa đơn.",0,1,0,0
giao thiếu sách .,0,1,0,0
"nói dài dòng, không đi vào chủ đề",1,0,0,0
đánh giá không tính điểm lúc nào cũng bị nhăn hằn thế này,1,0,0,0
"bìa ngoài rời, chất liệu giấy kém",1,0,0,0
sách hình thức đẹp nhưng bản dịch nhiều chỗ hành văn word by word rất khó hiểu.,1,0,0,0
nội dung khá khó đọc. đã đọc được khoảng 100 trang nhưng vẫn chưa thấy ý gì mới!,1,0,0,0
không lẽ tội trả sản phẩm nữa chứ. buôn bán lạ đời,0,1,0,0
"phần bìa hơi bẩn, giao sản phẩm nhanh",1,0,0,0
chất lượng sách tốt. về nội dung hơi hoang mang tí.,1,0,0,0
sách bảo quản kém . bìa nhiều vết bẩn,1,0,0,0
"nội dung khá rối, ngôn từ không tường minh",1,0,0,0
"sách cũ, có vệt ố vàng, gáy bị bong",1,0,0,0
giao thiếu! và không phản hồi,0,1,0,0
"nội dung bình thường, không có gì đặc sắc, lặp lại so với các quyển sách khác",1,0,0,0
giao sản phẩm cực kì lâu. cả tháng trời.,0,0,1,0
đánh giá không tính điểm tại sau lại giao sản phẩm sách như vậy ?,1,0,0,0
"sách không tem chống sản phẩm giả, sản phẩm nhái",1,0,0,0
nội dung sách không hay như mình nghĩ,1,0,0,0
"giấy in kém, mực hơi nhoè",1,0,0,0
tốt nhưng có nhiều chỗ hư cấu thái quá,1,0,0,0
đánh giá không tính điểm nhận cuốn sách bị cấn góc là thấy không vui rồi.,1,0,0,0
"sách đẹp, dù tới chương 5 vẫn thấy như đang nói đông nói tây nói nam nói bắc",1,0,0,0
mình không cảm nhận được nội dung quyển sách.,1,0,0,0
nội dung lan man. nhìn mục lục đã không muốn đọc,1,0,0,0
"đánh giá không tính điểm kho sách của tiki thì không có gì để chê luôn, nhma khâu đóng gói sản phẩm của tiki cực kì tệ, mình mua mấy lần r nhma lần nào cũng vậy hết, không cải thiện, quấn một lớp mút bên ngoài là đủ chống móp góc sách r 🥲 mong tiki cải thiện để mang đến trải nghiệm tốt hơn đối với những khách sản phẩm tỉnh lẻ như mình huhu",0,0,0,1
"đánh giá không tính điểm sách bị rách mép, tiki cần rút kinh nghiệm",1,0,0,0
góc bìa sách trên dưới bị tưa ra như sách cũ,1,0,0,0
chưu đọc hết cuốn sách thì sách đã thế này rôi,1,0,0,0
"mình thấy sách chữ nhoè, không nét? cho mìn hỏi liệu đây có phải sách in của nxb không?",1,0,0,0
"chất lượng tệ, vừa mở ra đọc 5p là bị rớt trang.",1,0,0,0
không trả lời khách sản phẩm khi thắc mắc,0,1,0,0
"giá quá cao, không phù hợp với cuốn sách",1,0,0,0
mong tiki bọc sách kỹ hơn không bị hỏng bìa nhưng lại oke,0,0,0,1
mình không đặt 3 cuốn sách này / đơn đặt 3 cuốn moi moi. vui lòng giao sản phẩm lại sách cho mình,0,1,0,0
"sách chất liệu kém, mực in bị dây ra tay bé",1,0,0,0
"bé sơ sinh dưới 6tháng phù hợp hơn chứ lớn tháng hơn bé không thik xem, cũng không có nội dung gì không như nd hướng dẫn cuốn sách ghi ?",1,0,0,0
không đáng tien… này sao tre e 2 tuoi biet gi nhưng choi,1,0,0,0
"sách bình thường, không cần thiết.",1,0,0,0
"tiki ơi, có cần phải đánh dấu vậy không ?",0,1,0,0
sách in bị lỗi vài trang.,1,0,0,0
"sách giao bị sờn, nhăn. cảm giác như sách cũ vậy",1,0,0,0
sách bị lỗi những trang cuối.,1,0,0,0
"mình mua sách, đọc xong tính tặng cho e gái. nhưng lại bị lỗi ở trang 51_52 bị ránh , trang 57 bị rách như hình. thực sự đọc đến đấy thấy bị hụt hẫng và khó chịu vô cùng",1,0,0,0
"giao sai đơn sản phẩm 764556056. trưa nay người nhà nhận đơn sản phẩm này giúp mình, tối mình nhận được sách mới thấy fahasa giao sai. vui lòng liên hệ đổi sản phẩm hoặc lấy lại sản phẩm hoàn tiền sớm cho mình. cảm ơn fahasa",0,1,0,0
"chào tiki, mình thường xuyên mua sách trên tiki, lần này mình khôn hài lòng. vì sách mới nhưng bong gáy luôn như thế này.",1,0,0,0
"về sản phẩm không có comment gì, tuy nhiên mình đặc biệt không hài lòng với cách thức giao sản phẩm của tiki. mình có đặt 5 sản phẩm cùng lúc từ tiki trading và chọn giao sản phẩm tiki now vì lúc đặt thấy ghi không mất phí giao sản phẩm và mình nghĩ đơn giản do đơn sản phẩm giá trị lớn nên được miễn phí , tổng giá trị thanh toán bằng giá trị đơn sản phẩm và không mất phí chuyển. tuy nhiên đến lúc giao sản phẩm, tiki tách làm 2 đơn giao trong 2 lần, mỗi lần + 100k phí giao sản phẩm tổng là mình mất thêm 200k tiền phí, mình liên hệ với chăm sóc khách sản phẩm để giải đáp thắc mắc nhưng không bao giờ liên lạc được. các lần trước đặt sản phẩm của tiki thấy khá hài lòng nhưng sau đợt này chắc phải chào tạm ổn tốt biệt.",0,1,0,0
"hơi khó hiểu cho mấy bạn mới đọc, lưu ý khi mua nha như mình thì cảm thấy khó ngấm nên hơi chán đọc ý:",1,0,0,0
hơi buồn một tí vì sách của mình bị gấp góc t.t,1,0,0,0
"không hiểu lắm từ ""song le"" ngay trước mấy câu nghĩa là gì? nếu là ""song lẽ"" đối với tôi cũng không hợp nghĩa câu cho lắm. nếu ai đó ham văn chương giúp tôi với. trích đoạn trang 51: ""song le, cậu vẫn nhưng một số câu hỏi nữa: làm thế nào người ta có thể sở hữu các vì sao?"" cảm ơn!",1,0,0,0
giao đầy đủ sản phẩm nhưng sách bị một đường trầy và bìa khá dơ nên mình hơi thất vọng,1,0,0,0
"sách hay nhưng cách sắp xếp tranh có chỗ không phù hợp với phần chữ. cách đánh các dấu ngoặc kép cũng không đúng, làm vừa độc nhưng phải vừa nghĩ đoạn nào là thoại của nhân vật, đoạn nào không. lần sau tái bản mong ban biên tập chú ý dùm.",1,0,0,0
giao chất lượng kém sách bị quăn 1 góc,1,0,0,0
nội dung hay nhưng dịch không được hay,1,0,0,0
mua vì là tác phẩm được dịch ra nhiều thứ tiếng nhất nhưng nội dung không hay lắm hoặc do mình không thấy hết cái hay,1,0,0,0
bìa bị bóp méo cả góc thất vọng,1,0,0,0
"sách đẹp, nhưng trong bản in này có rất nhiều lỗi chính tả nên vì thế khi đọc sẽ mất rất nhiều cảm xúc. bản thân mình thấy khó chịu khi đọc sách giấy nhưng phải gặp những lỗi như thế này.",1,0,0,0
mình mua cả bookcare nhưng tiki không bọc bookcare cho mình,0,1,0,0
"mua sản phẩm của tiki cũng đã nhiều lần nhưng không hiểu sao chất lượng sách lần này làm mình khá thất vọng. bìa sách cong, và nhưng có những vết bụi bẩn ở phần bìa trước.",1,0,0,0
