content,Quality,Service,Shipping,Packing
lỗi quá nhiều màu sắc không được như trong hình,1,0,0,0
dây kéo dễ hư. nói chung mặc đi làm được,1,0,0,0
"giao sản phẩm đúng thời gian, hình thức được.",1,0,0,0
"mua 2 cái 1 lúc, giặt mấy hôm rách cả 2.",1,0,0,0
giây kéo hỏng không kéo được mua về dùng lau chân lau nhà . quá thất vọng,1,0,0,0
sản phẩm tệ không dược như mong muốn,1,0,0,0
không đúng yêu cầu như tư vấn,0,1,0,0
không được như mong muốn hơi tệ,1,0,0,0
"áo quá mỏng, chất liệu quá xấu",1,0,0,0
chất lượng kém cho lắm,1,0,0,0
áo khoác nhưng gói áo quần rác. cửa sản phẩm,1,0,0,0
size xxl nhưng sản phẩm quá nhỏ so với công bố,1,0,0,0
không hài lòng. chất lượng không như quảng cáo.,1,0,0,0
sản phẩm áo khoác kém,1,0,0,0
"size áo không đính trên áo, đính ngoài vỏ bao. áo nho",1,0,0,0
chất vải hơi xấu.kiểu dáng gần như hình,1,0,0,0
cố gắng chọn side nhưng vẫn bị chật bởi side mình bé hơn side chuẩn nên phải cho cháu,1,0,0,0
"áo hơi cứng, hơi khô, nhưng vẫn tốt vì giá tốt",1,0,0,0
"size l quá nhỏ, size không đúng với quy định",1,0,0,0
"giao sản phẩm quá lâu, hơi chán nảng",0,0,1,0
cũng tạm ổn tốt được thôi.hơi dày,1,0,0,0
không giống như hình.,1,0,0,0
"không như hình, vải dày, tạm ổn tốt được",1,0,0,0
không được ưng í cho lắm.,1,0,0,0
chất lượng vs màu sắc + kiểu dáng kém,1,0,0,0
không đúng mặt sản phẩm đã đặt,1,0,0,0
túi áo quá lông không đưnngj gì được,1,0,0,0
vải bận nóng thấy mồ.nói chung là mua về bỏ đó chưa bận vì thấy loại vải này là vứt,1,0,0,0
ngắn không giống như quảng cáo,1,0,0,0
"bực cái tay áo ghê, chật. ngắn không ra ngắn, dài không ra dài, lại chật nữa !",1,0,0,0
"tiki làm lại với cửa sản phẩm này, vì size theo bảng là dành cho áo, chứ không phải áo khoát. áo khoát thì size phải rộng hơn bảng thông tin thì mới hợp lý. mọi người mua sản phẩm này thì nên trừ bớt tầm 6cm số với vòng ép và ngực thì sẽ hợp lý",1,0,0,0
"áo rộng so với size niêm yết. vải khá dày, áo cầm nặng tay khá tốt tuy nhiên khi ngâm nước bị ra màu rất nhiều. nhìn chung so với giá tiền thì cũng vừa ý",1,0,0,0
sản phẩm hơi kém chất lượng vải,1,0,0,0
"áo dầy dặn , nhưng size rộng quá , màu không như hình . hơi thất vọng .",1,0,0,0
bình thường không được tốt,1,0,0,0
áo vải mềm nhưng xxi vừa vs bụng nhưng vai hơi chật.,1,0,0,0
áo mặc không đóng được gấu áo,1,0,0,0
size của cty làm tôi chọn sản phẩm bị rộng quá,1,0,0,0
"không chuẩn size. nên mặc bị bó , khó chịu",1,0,0,0
chất liệu vải và màu sắc không giống như trong hình trên tiki,1,0,0,0
"quạt êm nhưng áo kém quá, lỗ to nên quạt hay bing ra",1,0,0,0
nói chung là không hài lòng,1,0,0,0
"không nhu mong doi, nhỏ so với size",1,0,0,0
"mình toàn dùng áo vt, đây là lần đầu mua online, khá thất vọng khi nhận sản phẩm: vải thì mỏng, mình toàn mặc side 37 nhưng side 37 này quá rộng, nghĩ sản phẩm fake nhưng check mã thì là sản phẩm vt.",1,0,0,0
"đường may đẹp, vải dày quá. nhìn chung tốt. nhưng cửa sản phẩm đưa bảng hướng dẫn chọn size không đúng. vì ox mình 68kg mình chọn size xl từ 68kg-75kg mặc ôm quá. haiz!",1,0,0,0
"vải dù cứng, bên trong lót lưới nhìn rất dễ rách, nhìn chung áo không được đẹp như trong hình",1,0,0,0
toàn cứ đặt 1 kiểu giao một kiểu,1,0,0,0
chán cửa sản phẩm. sản phẩm nhưng giao nhầm,0,0,1,0
"áo đầu t mua đúng size xxl, thấy vậy mua cho gia đình thêm 1 cái nữa thì bên ngoài để size xxl, mác áo cũng size xxl luôn vậy nhưng mặc vô tay ngắn, nách thì trật, chắc cái áo này chỉ size xl hoặc l",1,0,0,0
rách đâu không rách lại rách ngay chỗ gần cổ áo như thế kia thì không thể nói nổi. tưởng có số ít người bị nên mua thử ai ngờ mình bị đúng chỗ dễ thấy nhất.,1,0,0,0
"giao sản phẩm nhanh, đóng gói kĩ. nhưng khóa về bị hư rồi.",1,0,0,0
chất vải xấu. sản phẩm không giống mô tả.,1,0,0,0
"rất mỏng, áo không giống hình cho lắm, mọi người cân nhắc trước khi mua nhé.",1,0,0,0
áo xấu quá . phần bụng may không ôm . mặc vào nhìn như thời trang dân tộc .,1,0,0,0
"đợt 1 mua cái áo màu xanh thấy tốt , đợt 2 mua cái áo màu đen mỏng tanh",1,0,0,0
"sai xl hơi nhỏ,túi áo trong ngoài may hơi ngắn,phải may sâu để đựng đồ không bị bất tiện nhét điện thoại chua tốt,may sâu túi xuống.3 sao bình thường.",1,0,0,0
tốt đẹp nhưng hơi nhỏ so với mô tả mặc dù đã cố tình đặt size lớn. cho 2 sao,1,0,0,0
"sản phẩm giao bị ướt hết,thùng móp méo,nhìn chán.",1,0,0,0
màu không đẹp nhận rồi nhưng không vừa ý cho mấy,1,0,0,0
sản phẩm không được khoá vừa mua về đã không kéo được,1,0,0,0
"màu áo không giống ảnh, giá hợp lý",1,0,0,0
thô cứng không như hình,1,0,0,0
chất liệu vải không như mong đợi,1,0,0,0
hơi rộng và không ấm cho lắm,1,0,0,0
"quần qá mỏng, rất nhanh lỏng, khong nên mua vì không bền",1,0,0,0
đặt một kiểu giao một kiểu,1,0,0,0
hơi bất ngờ bên trong sọc ca rô nha cửa sản phẩm không giống hình mô tả.,1,0,0,0
áo có 2 túi sườn thì 1 cái thì may tịt vào thì nhưng nói đánh giá gì nữa vậy cửa sản phẩm,1,0,0,0
áo siêu 4xl nhưng quá nhỏ không hài lòng,1,0,0,0
sản phẩm đẹp giá giá giá rẻ. nhưng mua 2 cái size mình cửa sản phẩm giao 1 cái mình 1 cái l.,0,0,1,0
sản phẩm đẹp giá giá giá rẻ. nhưng mua 2 cái size mình cửa sản phẩm giao 1 cái mình 1 cái l,0,0,1,0
chất lượng tệ chỉ thừa nhiều,1,0,0,0
tôi nhận được 1 cái áo khác so với cái tôi đã đặt,0,0,1,0
"hình thức cũng được , đường chỉ tốt . size 3xl gì nhưng nhỏ quá mặc không vừa .",1,0,0,0
chất lượng kém kitti nên xem lại các nơi bán sản phẩm đừng để người tiêu dùng xem thường,1,0,0,0
vải mỏng quá 11,1,0,0,0
mỏng lắm kg như hình chup,1,0,0,0
sản phẩm cũng được nhưng không đúng như mẫu trong hình ảnh quảng cáo,1,0,0,0
áo cũng đẹp nhưng nhìn không sang lắm,1,0,0,0
sản phẩm tạm ổn tốt chấp nhận được trong giá đó.,1,0,0,0
chất lượng trung bình phù hợp với giá tiền.nên cho luôn,1,0,0,0
tuy không giống trong ảnh mấy nhưng dùng được.,1,0,0,0
"không giống hình, vải thô sơ, thua đồ sida",1,0,0,0
"nhìn đẹp, chất. nếu đường chỉ may kỹ hơn thì cho thêm 1 sao; size chuẩn hơn cho thêm 1 sao nữa",1,0,0,0
size mình nhưng vẫn rộng trong khi minh thường chọn size l cho các áo khác. kích cỡ size không chuẩn,1,0,0,0
áo chất bình thường. nên chọn chất tốt hơn nếu giá sản phẩm tăng,1,0,0,0
dáng tổng thể em này đẹp. màu đen dễ kết hợp áo trắng và áo khoác ngoài. cổ tim lãng mạn và sexy. duy nhất 1 chi tiết cần cải tiến là kiểu áo này dài lưng hơn 1 chút để đỡ bị hở nhiều quá so với áo sơ mi bên trong thì tuyệt. hở tí sẽ sexy hơn hở nhiều,1,0,0,0
"sản phẩm size quá nhỏ,chán quá",1,0,0,0
"đã mua 2 chiếc, khác hoàn toàn so với hình, tay áo thì không phải dài cũng không phải ngắn, thân áo thì vừa ngắn vừa rộng thùng thình, thực sự thất vọng, chấm 0 , mọi người không nên mua.",1,0,0,0
áo có như hình đâu. nhìn cái áo là mắc ói rồi. kêu áo đuôi tôm vậy nhưng đuôi tâm cái nỗi gì. nhìn cái phọt mặc vào không khác gì trùm bao bố,1,0,0,0
"áo khá tệ, trông ảnh thì form dài và bó. nhưng đến khi nhận sản phẩm thì áo rất rộng và không đẹp. mặc trông như áo thời thập niên 7x của mấy ông già.",1,0,0,0
không giống trong ảnh quảng cáo. nhưng vãn chấp nhạm được,1,0,0,0
"áo không giống hình, áo rộng và ngắn, mặc lên rất nhìn rất buồn cười",1,0,0,0
"không giống như hình, áo ngắn và cũng chả có cái mac như hình đâu",1,0,0,0
không giống trong hình áo rộng nhưng ngắn,1,0,0,0
"cửa sản phẩm ơi, mình nhận được sản phẩm rồi nhưng áo size xl rồi nhưng người 55kg mặc không cài được cúc áo chỉ khoác được thôi vậy nhưng nói size đó dành cho người dưới 75kg là sao cửa sản phẩm",1,0,0,0
"mình đặt size xxl nhưng khi nhận lại là size l , mình có thể đổi lại được không ạ",0,1,0,0
"đường chỉ xấu may cẩu thả , không được ưng ý lắm chắc để chơi chứ mặc không được",1,0,0,0
giao sản phẩm quá chậm hẳn 2tuần mới tới,0,0,1,0
"áo tạm ổn tốt thôi, tăng giá áo lên 30k nữa để thay dây kéo xịn hơn thì sẽ tốt hơn",1,0,0,0
"nhỏ hơn kích thước nhưng size đưa ra, màu sắc không giống như mô tả",1,0,0,0
may quá tệ ẩu nhà sản xuất trình độ quá kém,1,0,0,0
"áo mất khuy, không hài lòng :",1,0,0,0
áo hk mặc vừa cửa sản phẩm làm ăn kì quá,0,1,0,0
vải gì nhưng cứng đơ như áo giáp thời lama,1,0,0,0
chất lượng tốt đẹp vừa vặn đẹp nha,1,0,0,0
"không giống mô tả, lỡ mua rồi thôi vậy",1,0,0,0
"áo mỏng nhưng mắc, chất lượng kém",1,0,0,0
ao mỏng.chưa hai long lắm,1,0,0,0
"chất lượng bình thường, mua kèm bộ áo điều hoà về nhưng máy không chạy.",1,0,0,0
treo đầu dê bán thịt . mẹ,1,0,0,0
chất lượng không như mong đợi,1,0,0,0
không hài lòng chút nào. hay mua sản phẩm của freeman nhưng sản phẩm này chật và bé so với bảng quy đổi cỡ quá. bình thường mua size l là mặc thoải mái nhưng quần này mua size l nhưng mặc như size mình vậy. nên ai mua thì nên mua tăng thêm 1 cỡ.,1,0,0,0
"cửa sản phẩm và tiki giao nhanh, đúng size đã đặt. nhưng sản phẩm không chuẩn: chất liệu mô tả là cotton, thực tế như nilon, mỏng và nóng, kích cỡ nhỏ hơn so với size. mình không sử dụng được.",1,0,0,0
"size không đồng điều, kém chất lượng",1,0,0,0
"5 cái thì 1 cái mặc đẹp người, 4 cái nhưng lại cùng 1 size với nhau nhưng chật nhích, chắc là đùi mình to nên nó bó vô chứ bụng vẫn ôm",1,0,0,0
chất lượng không đồng đều lẫn những cái kém chất hoặc khác loại,1,0,0,0
"không giống như sản phẩm đã mua lần trước , thun không đẹp , vậy thì làm nhưng lòng tin để đặt sản phẩm.",1,0,0,0
"xấu, không có độ co giãn. không hài lòng.",1,0,0,0
"chất liệu tc rất nóng và khó chịu, không được mềm và mát như các hãng khác",1,0,0,0
"đây là size 30 hay 32 vậy cửa sản phẩm ? mua size 32, giao 2 lần vẫn vậy ?",0,0,1,0
"áo chất lượng tốt tuy nhiên không cắt cài cúc áo, lại phải ngồi vật mặt cắt từng cái",1,0,0,0
sản phẩm rất chuẩn và tốt chất lượng,1,0,0,0
bán như mua áo rin giao áo thun,0,0,1,0
sản phẩm quá bé so với size chuẩn,1,0,0,0
củng chấp nhận được oke .,1,0,0,0
giao không đúnh sản phẩm như hình,0,0,1,0
"quá tệ.hình sản phẩm một kiểu,giao một kiểu.thất vọng.lần đầu cũng là cuối",1,0,0,0
quá chật ! mình 60kg cao m67. đặt size l nhưng mặc kéo lên đến đùi không nổi : chưa bao giờ vote cửa sản phẩm nào 1 sao trên tiki nhưng lần này quá thất vọng. liên hệ đổi thì bảo đổi bằng giá mua.,1,0,0,0
quan sip nhỏ qua không dung mua ve không mat được thi tui hoi ai day,1,0,0,0
"giao sản phẩm nhanh, chất lượng tốt, tuy nhiên size hơi bự cho người cỡ 45kg",1,0,0,0
sản phẩm hơi mỏng cạp quần bé nhưng nói chung là trong tầm giá như vậy là tốt rồi không có gì phàn nàn lắm,1,0,0,0
mình mặc được 2 lần thì bị rách . có thể chất lượng vải không được tót,1,0,0,0
không giống như hình.chât liệu kém,1,0,0,0
không giống ảnh lắm sản phẩm may thì kém.,1,0,0,0
không giống với quảng cáo,1,0,0,0
không đúng sản phẩm như đã đặt,1,0,0,0
size 2xl chỉ dành cho tạng người 60 - 65kg. không dành cho người 70 - 75kg,1,0,0,0
"sản phẩm chất lượng cực tồi , giá giá cao , thất vọng !",1,0,0,0
"rất xấu , cứ nghĩ là vải quần kaki ,không như mong muốn",1,0,0,0
"chất liệu hơi mỏng, không như hình ảnh dưa",1,0,0,0
không hài lòng sai sản phẩm sai,1,0,0,0
"bán sản phẩm không giống hình , thất vọng với tiki mua thật bán giả",1,0,0,0
màu sắc không đúng với ảnh,1,0,0,0
áo gì nhưng mỏng quá đi nhưng giá cao quá,1,0,0,0
"chất liệu vải tệ như sản phẩm ngoài chợ khoảng mấy chục ngàn, màu xấu không như hình.",1,0,0,0
để hình là 1áo 1 túi riêng nhưng không hề có không khác gì khách sản phẩm đường chỉ may rất tệ nhưng giá thành cao không hề xứng đáng trải nghiệm mua sản phẩm rất tệ,1,0,0,0
"sản phẩm không như mô tả, hình ảnh chỉ mang tính tham khảo nhé! dùng từ chống nóng là sai, bận vào là rất nóng, vải không thoáng khí như miêu tả.",1,0,0,0
"tạm ổn tốt được, vải hơi dày, mặc chắc nóng",1,0,0,0
giao sản phẩm không đủ sản phẩm,0,0,1,0
"nhanh hỏng, bỏ đi sau 3 ngày, rách đũng",1,0,0,0
"sản phẩm trong tầm giá, dùng cũng tốt lắm",1,0,0,0
"chưa hài lòng,hai quần cùng size cái ngắn cái dài",1,0,0,0
tôi không hài lòng về cách làm việc của các bạn tôi đặt quần size xl nhưng lại gửi size mình không thể nào mặc vừa mong được đổi sản phẩm,1,0,0,0
"80kg nhưng xxl mặc chật,chỉ dùng mặc bên trong được thôi",1,0,0,0
nhìn trên hình thì đẹp khi gửi về nhìn không thấy thích một tí nào,0,0,1,0
"sản phẩm cũng không đẹp lắm,",1,0,0,0
quần không đúng kích cỡ. size mình 1.68 52kg mặc chật không thở nổi,1,0,0,0
quân dành cho nam nhưng hơi nhỏ,1,0,0,0
"bèo nhèo, thun thường,giá 40k là đắc so với thị trường, không giống hình ảnh mượt nhưng! quần này ra quẹo lựa khoảng 15k",1,0,0,0
sản phẩm nhận được không như mô tả. thật sự rất thất vọng trong lần mua sản phẩm này.,1,0,0,0
sản phẩm thực tế kém xa quảng cáo. sản phẩm chỉ tầm giá vài chục không.,1,0,0,0
không như kỳ vọng. các túi khóa kéo thiết kế quá chặt. không thể dùng thoải mái được.,1,0,0,0
không như mong đợi.,1,0,0,0
bán hả sản phẩm sao sản phẩm đề ghị đổi lại hàn,0,1,0,0
không đúng sản phẩm đặt màu tráng ra xamh đã đổi một lần rồi,1,0,0,0
"áo rất mỏng, chất lượng tệ. phía sau khoét lỗ rất to, mặc áo như không mặc. mua xong không dám mặc đi tập luôn",1,0,0,0
chất liệu vải quá mỏng so với màu đen và màu vàng đã mua. chất lượng vải không đều giữa các màu.,1,0,0,0
"áo rất mỏng, không giống như hình.",1,0,0,0
"áo đẹp nhưng nhìn áo không giống trong ảnh, áo quá mỏng nhìn như bịch nilon, đem giặt máy chắc hư cái áo luôn quá, họa tiếc trên áo không đậm nét như hình muốn bay mất luôn",1,0,0,0
"áo đẹp nhưng nhìn áo không giống trong ảnh, áo quá mỏng nhìn như bịch nilon, đem giặt máy chắc hư cái áo luôn quá, họa tiết sắp mất",1,0,0,0
áo giống hình nhưng rất mỏng,1,0,0,0
áo rộng quá. tôi cao 160cm. nặng 57 kg nhưng lại gửi cỡ xxl. tôi muốn đổi lấy cỡ l được ko? chất vải và kỹ thuật may tốt.,1,0,0,0
chất vải không quá tốt so với sản phẩm cùng giá ngoài cửa sản phẩm đồ thể thao.,1,0,0,0
"áo đợt này xấu quá. màu không đẹp hình thì không phải hình in như mấy đợt trước. thất vọng, bye bye cửa sản phẩm luôn nhé",1,0,0,0
hình dán không phải hình in như mays đợt đầu. xấu,1,0,0,0
không có ba lô màu đen giao màu không phải màu đen,1,0,0,0
sản phẩm không chất lượng. không gióng mẫu. giặt thun lại nhăn. không phải vải đủi,1,0,0,0
vải mỏng quá và lưng bị lỗi,1,0,0,0
"mới mua trông rất thích vì nhìn cũng đẹp mắt và sang. tuy nhiên khi sử dụng dây kéo vài lần là có hiện tượng bung ra, kéo lạo sản phẩm chục lần may ra mới dính. không hiểu sao nhà sản xuất lại sử dụng dây kéo dỏm, làm thất vọng cả tập. dây kéo nhưng dỏm hơn của mấy cái áo khoác giá giá giá rẻ.",1,0,0,0
áo chất liệu mẫu mã như hình,1,0,0,0
thất vọng kinh khủng.,1,0,0,0
"không đúng sản phẩm đã đặt , chất lượng kém chất lượng",1,0,0,0
"vải mỏng , chỉ thồi thoài nói chung chất lượng kém so với tầm giá.",1,0,0,0
áo nhỏ quá không vừa cửa sản phẩm cho đổi áo lớn hơn không ạ,1,0,0,0
"sản phẩm bị lỗi, quần bị mất 1 nút ở túi sau",1,0,0,0
"mẫu không giống mô tả, fom quần cũng không chính xác lắm",1,0,0,0
bảng tra không đúng. quần bị rộng. phải sửa lại mới mặc được dù sản phẩm đẹp,1,0,0,0
quần số to không vừa tôi muốn đổi,1,0,0,0
cổ áo bị rách ? đường chỉ may không đẹp,1,0,0,0
vửa mặc lên đi chưa ra tới cửa là cái quần rách bung toác ra . bán sản phẩm kiểu đó hả,1,0,0,0
bị tách keo không dùng được nữa,1,0,0,0
rách ngay không bền lắm,1,0,0,0
đóng gói đẹp nhưng quần vải mỏng quá không biết có bền không,1,0,0,0
"áo rất tệ , không nói nhiều.",1,0,0,0
"sản phẩm không được ưng ý chất liệu xấu không được đẹp nếu có lần sau sẽ không bao giờ mua nữa và khuyên mọi người không nên mua quần áo trên mạng , mình đến cửa sản phẩm mình xem ưng ý thì mua",1,0,0,0
"áo bị nhỏ, đường may không đều cty nên xem kỹ trước khi giao! nếu không sẽ mang tiếng xấu và ảnh hưởng đến việc kinh doanh",1,0,0,0
vải mỏng nhưng thô mua song không muốn mặc chả nhẽ vứt đi,1,0,0,0
không hài lòng áo hơi nhỏ,1,0,0,0
"đã lấy size lớn nhất rồi nhưng vẫn quá nhỏ, không mặc vừa",1,0,0,0
chất liệu kém cần cải thiện chất liệu vải,1,0,0,0
áo này sen đỏ bán chỉ có 99 nghìn nhưng tiki bán tới 205 nghìn giá cao quá không thích,1,0,0,0
"lần thứ hai mua áo nhưng hơi thất vọng vì không giống áo đợt trước mua. lớp lót bên trong vải rất nóng, không như áo trước mình mua vải lót mát mẻ. tiếc là mình đã đem giặt mới phát hiện ra không thì cũng muốn trả sản phẩm lại.",1,0,0,0
"mua phí tiền, mới mặc 1 lần đã toạc khắp nơi. mọi người nên cân nhắc khi mua áo này và không mua. bán sản phẩm vớ vẩn",1,0,0,0
"hài lòng, chất lượng tốt, giá hợp lý",1,0,0,0
"chất lượng bình thường ,mũ không có dây rút ,không tiện dụng",1,0,0,0
"chất liệu tốt,giá tốt nhưng mua được vài ngày thì hỏng khoá",1,0,0,0
áo xấu không giống như quảng cáo,1,0,0,0
áo lém chất lượng không giống trong hình,1,0,0,0
chất liệu hơi tệ sezi mình chắc người 80 không mặc mới vừa,1,0,0,0
tấm duoc thôi .không sung với gia tiền,1,0,0,0
bán sản phẩm không đúng sản phẩm,1,0,0,0
"áo chất kém, mỏng, bụng lại phồng rộng ra. chả hiểu sao có cái áo thế nữa. chúc cửa sản phẩm buôn may bán giá cao",1,0,0,0
mới mở sản phẩm lại thấy bung chỉ,1,0,0,0
cửa sản phẩm oder nhầm saiz cho mình roi.:.,1,0,0,0
"từ phom dáng cho đến chất liệu vải, đường kim mũi chỉ đều kém, không xứng với giá tiền. giá thành của quần này nếu may ở việt nam là dưới 80 nghìn đồng khi may với số lượng trên 5000 chiếc, sản phẩm này may ở trung quốc thì giá thành nhưng thấp hơn nữa. vậy nhưng cửa sản phẩm bán hơn 300k.",1,0,0,0
"giá này quá chát, lần đầu có vẻ không thấm nước nhưng mặc vài lần chỉ cần giọt nước là thấm luôn, chất thì cũng không có gì đặc biệt. nhà bán trên mạng thường đẩy giá rất ảo rồi khuyến mại 40, 50 nhưng thực chất chất lượng sản phẩm thường không xứng giá trị",1,0,0,0
chất liệu vải không tương xứng với giá tiền,1,0,0,0
"sản phẩm chất lượng tốt , kiểu dáng như hình nhưng giá giá cao hơn bên và cũng không có quà tặng là 1 chiếc thắt lưng khá đẹp như nhà bán sản phẩm bên đó ! hình gửi kèm là thắt lưng quà tặng ! sản phẩm thì 2 cửa sản phẩm giống hệt nhau !",1,0,0,0
đơn đầu tiên mua 2xl thì mặc vừa. đơn sau mua cái 2xl nữa thì bị chật không nhấc chân lên được. tức là sản phẩm hoá không đồng nhất lúc nọ lúc kia,1,0,0,0
kg đáp ứng được mẫu nhưng cà chất liệu vải không ưng ý,1,0,0,0
bảng size quần không đúng rồi. mình 1m74 74kg lấy size xxl nhưng rộng như cái bao :,1,0,0,0
"màu không được đẹp như hình, nhìn không sang. chưa sử dụng nên chưa biết thế nào.",1,0,0,0
"hình ảnh thì đẹp , nhưng mấy cái túi quần nhỏ xíu, không để được gì. chán",1,0,0,0
"sản phẩm tq giá giá giá rẻ nhưng cửa sản phẩm bán giá cao, quần vải gió mỏng, không đáng tiền.",1,0,0,0
quần chất lượng tốt. tuy nhiên giá hơi cao so với sản phẩm.,1,0,0,0
chưa gì hết đã rách roi bị bung chỉ nhiều,1,0,0,0
"áo hơi mỏng, hơi ngắn, nhung với gia đó cũng tạm ổn tốt được.",1,0,0,0
"chưa mang chưa biết, giao sản phẩm nhanh",1,0,0,0
hơi nhỏ mặt không vừa cần cải thiên,1,0,0,0
"size xl nhưng quá chặt, cửa sản phẩm có thể đổi loại lớn hơn không ạ , mình 72kg.",1,0,0,0
giao sản phẩm không đủ số lượng,0,0,1,0
có cái áo ba lỗ mặc dưới sơ mi nhưng cảm giác lạ quá,1,0,0,0
"lạ quá chịu không nổi, mặc để thêm lớp áo thì tốt",1,0,0,0
"chất liệu nóng, không mát như đã quảng bá",1,0,0,0
"chất liệu nóng, có chất liệu mát hơn thì tốt",1,0,0,0
mình đặt mẫu d06 chờ thật lâu mới nhận được sản phẩm. khi nhận được ngoài tem ghi compo 5 quần d06 nhưng sản phẩm bên trong thì mẫu của d01 nhưng chỉ có 2 màu đen và xanh chứ không được nhiều màu như thông tin. thất vọng quá tiki ơi,1,0,0,0
"combo 5 cái đủ màu loại sịp đùi, nhưng giao sản phẩm như lone, xóa mẹ cái áp tiki l này khỏi máy, ứng dụng nát rách, thì đừng có mời ai macasting!",1,0,0,0
sản phẩm mặc tiện gọn gàng chất liệu tốt,1,0,0,0
co dãn tốt. nhược điểm là phần ống và lưng mặc vào bị cuộn lại.,1,0,0,0
"úp rất chất lượng, cảm ơn cửa sản phẩm",1,0,0,0
nhỏ ngắn và không đúng như mình nghĩ,1,0,0,0
nói là kaki hàn quốc nhưng không phải giặt phai màu kinh khủng,1,0,0,0
chất lượng kém chất lượng thất vọng,1,0,0,0
mình không thày lòng với tiki gì mình đặc hai puần nhưng tiki 1puân thôi nhưng nhưng lấy ráp đôi đá tiền,1,0,0,0
"quần này vải nylon giá giá rẻ tiền, mới mặc ngồi xuống chút đứt chỉ rách đáy mất rồi",1,0,0,0
"đặt sản phẩm kaki thì ra vải đũi, nếu sớm biết vậy thì mình đã không mua, tiếc là không cho 1 sao được, quá thất vọng",1,0,0,0
tiki luc nao cung giao sản phẩm nhanh nhưng san phẩm đường chỉ may không khéo size vưa chẩn tốm lai cung được,1,0,0,0
"sản phẩm không giống trong hình ảnh, size số cũng khác hoàn toàn. thất vọng!",1,0,0,0
"size không chuẩn, cùng size 31 nhưng màu đen thì chật nhưng màu xám nhạt thì hơi rộng",1,0,0,0
"size không chuẩn, nói chung tiền nào sản phẩm ấy",1,0,0,0
lịch giao 12/7 nhưng 19 mới giao.chậm hẳn 1 tuần,0,0,1,0
mua về giặt 2 nước là rách luôn. vải quá mỏng. xem lại nhé.,1,0,0,0
vải kém size không chuẩn,1,0,0,0
chất lượng quá kém đánh giá 1 sao,1,0,0,0
cũng tốt . hợp với tuổi teen,1,0,0,0
