content,Quality,Service,Shipping,Packing
"thật tiếc khi 1 cuốn sách hay lại không được dịch bởi dịch giả chuyên nghiệp. câu văn tối nghĩa, diễn đạt lủng củng, sử dụng từ ngữ địa phương, và người chữa bệnh bằng phân tích tâm lí không được gọi là "" người thầy thuốc"" như dịch giả đã dịch nhưng sẽ gọi là bác sĩ.",1,0,0,0
"biên dịch dở. dịch sử dụng từ địa phương, đọc vài dòng đầu là không thể tiếp tục đọc nữa. “ bệnh” viết “ bịnh”?",1,0,0,0
sách sai chính tả dùng tiếng địa phương nhiều,1,0,0,0
"bản dịch này kém, nhưng sử dụng tiếng địa phương",1,0,0,0
"sách được dịch sơ sài, đọc gần giống như google dịch, không thể hiện được ý nghĩa tác giả muốn nói",1,0,0,0
"sách in thiếu trang, từ trang 239 nhảy qua trang 257. sản phẩm làm mình rất thất vọng.",1,0,0,0
"sách mình mới nhận được 2 ngày, chưa kịp đọc, mới cầm nhẹ đã bung gáy, có vẻ keo dán chưa được chắc chắn. mong cửa sản phẩm sẽ cải thiện hoặc tăng giá sản phẩm lên để nâng cao chất lượng. mình không hề muốn làm mất miếng cơm của ai, đây chỉ là góp ý, bỏ tiền trăm ra để mua nhưng sản phẩm như vậy tiếc tiền lắm!",1,0,0,0
"lần đầu tiên mình nhận sách với tình trạng tệ như vậy luôn, sách bẩn như dùng rồi ý thật sự thất vọng",1,0,0,0
"nhận 3 quyển 3 hộp đóng khác nhau, 2 quyển tạm ổn tốt tốt chứ trông cũng bị mòn gáy với rách nhẹ. nhưng riêng cuốn này thì chuẩn sách cũ trong khi mua là sách mới, bẩn, mốc, loang nổ, gấp góc và bìa nát luôn. thật sự lần đầu đặt sách qua tiki nhưng chán thật sự ấy.",1,0,0,0
"nội dung tốt, tuy nhiên thì giấy sách hơi mỏng nên chữ ở mặt sau bị lem mờ sang, hơi khó chịu cho người bị loạn thị như mình. ngoài ra, giấy cũng được cắt không được chỉnh chu lắm, kiểu giấy nó cứ không đều nhau.",1,0,0,0
"sách bị gập trang, không biết cắt có mất chữ không đây 🥲",1,0,0,0
mất tiền mua bookcare nhưng mua sách mấy lần đều không được bọc. bực mình quá,0,1,0,0
"đến với tiki để trải nghiệm cảm giác sách vừa cũ, vừa , vừa trầy xấu với giá mới, cực ""uy tín"" luôn",1,0,0,0
"lâu lắm rùi tui mới quay lại đọc sách, tui nhớ tới tiki đầu tiên nhưng coi tiki đối xử với tui nè tr",0,1,0,0
"không bàn về nội dung sách, vì thật sự quá hay và đáng đọc. hay đến mức muốn nâng niu từng chữ vậy! tuy nhiên, về chất lượng bìa, mực in rất có vđê. mực in nhiều trang mờ, đứt nét. bìa thì mã qr bị in đè lên ntn. liệu đây có phải sách thật không ạ?",1,0,0,0
"mình rất thích quyển này vì bìa đẹp và đọc nhiều review thấy nội dung có vẻ hợp với mình. nhưng rất tiếc khi nhận sách lại bị thất vọng vì rách bìa áo, có nhiều vết bẩn, gáy cũng móp, dù sách khá vừa với hộp. không lẽ sale 50 vì sách xấu hay sao ạ?",1,0,0,0
"sách không vấn đề: giấy in đẹp, giao sản phẩm nhanh. 1 ở đây là đánh giá phần dịch vụ sau bán của tiki nên cải thiện mình mua sách tiki trading nên đánh giá tại đây nha : mình mua nhầm 2 cuốn nên có nhắn tin tiki để mong đổi trả 1 cuốn. chưa nói đến việc mình có được đổi trả hay không. tuy nhiên giao diện “chat với tiki” không thân thiện, robot trả lời format/keyword càu sẵn nhưng bấm đến “đổi/trả sản phẩm” thì chỉ hiện ra bảng thông tin “quy định đổi trả” - buyer không biết next step phải làm thế nào để giải quyết vấn đề, mình đã gửi phản hồi sau 24 tiếng chưa thấy phản hồi? như kiểu tương tác 1 chiều. là 1 trang ecom lớn hy vọng tiki cải thiện dịch vụ sau bán!",0,1,0,0
"đóng gói và giao sản phẩm rất tốt như mọi lần. thấy many bạn nhận xét tốt về nội dung sách, nhưng cá nhân mình đọc cảm thấy khá nặng nề. đọc hết chương 2 mình chả muốn đọc thêm nữa. chắc mình không hợp với thể loại bi ai như này.",1,0,0,0
sách mới nhưng thật sự không hài lòng với cách đóng gói sản phẩm của tiki. chỉ cho sách vào hộp nhưng không bọc chống sốc,0,0,0,1
"nội dung sách hay. có điều làm mình không hài lòng đó là khi đọc đến trang gần cuối thì trang sách bị bẩn, có dấu hiệu mốc.",1,0,0,0
khâu đóng gói rất ẩu và tệ luôn ạ. sách không quấn màng bọc hay bao bì chống thấm. chỉ có đóng thùng giấy bên ngoài thôi. quá tệ. may nhưng sách không bị ướt mưa nhiều. chấm 2 sao cho khâu đóng gói,0,0,0,1
"mình đặt 3 cuốn sách, tất cả đều bị hư góc từ lúc mới mở sản phẩm. nếu để tặng thì các bạn nên ra nhà sách lựa cho yên tâm.",1,0,0,0
"thật vọng tiki, cả 1 hệ thống thương mại điện tử lớn như vậy nhưng làm ăn không có 1 tí trách nhiệm nào. đơn mình đặt 2 sản phẩm, đã thanh toán trước nhưng bên tiki giao thiếu 1 sản phẩm là cuốn này. mình đã gửi đơn khiếu nại lên email tiki, có cả ảnh và video quay lúc bóc sản phẩm tiki giao thiếu, vậy nhưng đợt 1 tuần trời mới có email phản hồi lại là “ tiki từ chối giao bù sản phẩm thiếu” và báo là check camera bên đóng gói là đã giao đủ. sẽ không có giao bù bay hoàn tiền lại cả. mình có thắc mắc lên tiki thì nhân viên chăm sóc khách sản phẩm cực tệ, trả lời chỉ dùng tin nhắn tự động, lúc nói vấn đề thì lảng tránh, không muốn trả lời rồi tự ngắt kết nối khi khách sản phẩm vẫn đang nói chuyện. cứ bảo đợi rồi sẽ hỗ trợ nhưng thực ra là không có hỗ trợ gì hết. thái độ làm việc không có 1 tí nào gọi là chuyên nghiệp hết cả. chỉ giỏi ăn chặn tiền khách sản phẩm.",0,1,0,0
"bị móp sách rùi, không có bookmark .",1,0,0,0
sách quăn tít. với 1 đứa yêu sách như mình thì th này rất mất thiện cảm. hazzz,1,0,0,0
"mình có đăng ký bookcare 2 cuốn nhưng chỉ bọc cuốn bìa mềm, bìa cứng không bọc, mình bị 4 lần rồi, tiki hoàn lại bookcare giúp mình",0,1,0,0
"gói quà cẩu thả keo thừa dính khắp hộp. packer nhưng chấm keo dán tem vận chuyển lên hộp, không thể tháo ra nhưng giữ hộp nguyên vẹn.",0,0,0,1
sách mới nhưng mở ra đã thấy rách 2 trang từ trước rồi. buồn quá,1,0,0,0
"không có chữ ký của tác giả như mô tả sản phẩm, cực kỳ thất vọng và không muốn ủng hộ tiki nữa",0,1,0,0
gáy sách bị gãy nè nội dung chưa xem nên không biết,1,0,0,0
mình đã chọn bookcare nhưng không có bọc sách,0,1,0,0
đặt bản có chữ kí nhưng nhận được là bản không có chữ kí,0,1,0,0
"các tác phẩm của tác giả này nội dung đều mang máng nhau. không có gì đặc sắc, theo tôi không nên mua, không cần phải có trên giá sách. nếu bạn thích thì tôi có thể để thanh lý giá giá rẻ lại.",1,0,0,0
"giao sách cũ, cần cải thiện",1,0,0,0
"bìa ngoài cuốn sách bị dơ, lau không ra với lại dán nhãn lung tung sau bìa sách. trang bìa trước bị gảy.",1,0,0,0
"không biết có phải sách giả không nhưng sách viết sai chính tả rất nhiều chỗ, khiến người đọc rất khó chịu",1,0,0,0
hơi thất vọng vì ngay bìa bị vết lõm xước hẳn như này :,1,0,0,0
"sách không hề hay. cứ giảng tới giảng lui vài câu khuyên dạy, không thấm thía gì hết. rất hối hận vì nghe mấy má kol trên mạng",1,0,0,0
người dịch có văn phong rất buồn cười.,1,0,0,0
nội dung hơi hướng tôn giáo và nặng về niềm tin nên không hợp mình lắm.,1,0,0,0
"chất lượng in nhòe nhoẹt, không đúng chất lượng sách lần đầu tiên mình mua sách gặp sản phẩm như thế này",1,0,0,0
sách dịch đọc rất kì. cách viết qua kiểu kể chuyện mấy nhân vật không có thật làm cho mình không thấm nổi. quyển sách này đã giúp mình nhận ra mình không thể đọc được sách self-help nữa.,1,0,0,0
"sách mình mua về đã bị cào mất phần tem, bị nếp gấp nữa. siêu thất vọng",1,0,0,0
sách cũ. bìa sách bám bụi và bị hằn nhiều vết mờ. sách giống như đã qua sử dụng,1,0,0,0
"phiền, mua có cuốn sách nhưng gửi email hoài",0,1,0,0
sách mới mua nhưng đã sắp rơi ra rồi. thất vọng vì chất lượng sách!,1,0,0,0
"lập luận quá dài dòng và hay lặp lại , chưa rõ ý",1,0,0,0
"về tiki: tiki giao nhanh, sách không bị hư hại. về sách: tác giả viết tốt, nội dung khai thác theo nhiều hướng, có tính thuyết phục tương đối. nhưng vấn đề là dịch giả kém, dịch sai nhiều, ngay cả những câu đơn giản. nhiều câu đọc lên đã thấy sai, không rõ là biên tập viên có chịu làm việc nghiêm túc không? không sai đến mức không đọc nổi nhưng khuyến khích ai có khả năng hãy tự đọc thêm bản tiếng anh để hiểu chính xác hơn nội dung sách.",1,0,0,0
không biết có phải lỗi sai chứ không,1,0,0,0
đọc cuốn những quy luật của bản chất con người xong đọc cuốn này hơi bị hụt hẫng. nội dung không như kỳ vọng.,1,0,0,0
nội dung sách hay nhưng dịch giả dịch đúng chán luôn. dịch lũng cũng. câu cú đá nhau.,1,0,0,0
"mua sách mới nhưng nhận sản phẩm về như sách cũ, bìa cong rách, mua mấy lần tiki bữa giờ giao toàn như vậy không",1,0,0,0
"nội dung sách hay nhé mọi người, đọc để cải thiện chất lượng cuộc sống, loại bỏ những lời biện bạch đang kìm hãm mình ở hiện tại nhé! mình đánh giá 3 sao là bởi vì sách mặt sau giao cho mình đã bị sước nên không hài lòng cho lắm.",1,0,0,0
"đây là lần thứ 2 mình phản ánh vấn đề này với tiki lần đầu mình đặt mua sách đi kèm với bookcare đơn sản phẩm 759928678 nhưng khi nhận sản phẩm chỉ có sách, sau đó tiki gọi điện xin lỗi và thu hồi sản phẩm để bổ sung bookcare. nhưng tới hôm nay nhận sản phẩm thì sách vẫn y nguyên như lúc chưa thu hồi - vẫn không có bookcare. đơn sản phẩm 735340185 đề nghị tiki hoàn tiền bookcare hoặc thu hồi sản phẩm bổ sung bookcare cho mình. thất vọng với tiki lần này quá !",0,1,0,0
"tiki giao nhanh nè, lại mua lúc sale nên khá hời, mình khá bất ngờ khi sách được giao đến với tình trạng nhưng bao bọc đàng hoàng. đó là khi mình chưa mở bọc ra :v gáy sách bị tróc, có nơi lồi lõm 1 chút. nói chung là khá tốt",1,0,0,0
sách bọc kĩ nhưng vẫn bị bẩn ở mặt sau bìa sách. không lau được,1,0,0,0
mình có đặt mua 1 quyển chung với các so khác nhưng khi giao thiếu mất quyển sách trong khi mình đã thanh toán tiền sách. mã đơn sản phẩm làn 686677364. nhờ tiki kiểm tra lại giúp mình. cảm ơn.,0,1,0,0
lần đầu mua sản phẩm hơi thất vọng,0,1,0,0
sách giao bị rách tả tơi trang bìa,1,0,0,0
"mua 2 quyển, chờ cả tháng và cái kết!",0,1,0,0
"sách khá mới, thấy hiệu in là của nhã nam nhưng giữa sách bị bỏ trắng mấy trang lận, lần đầu mu sách của tiki nhưng cảm gics bất an quá, có phải sách giả không nhỉ",1,0,0,0
sách mới nhưng thật sự không hài lòng với cách đóng gói sản phẩm của tiki,0,0,0,1
"lần đầu tiên mình đặt sách qua tiki. nội dung sách hay, câu chuyện hấp dẫn, lôi cuốn, hình thức đẹp. tuy nhiên, không biết do lỗi kĩ thuật hay sao nhưng quyển sách mình nhận được lại bị thiếu tận 17 trang. đang đọc đến đoạn hấp dẫn nhưng hụt hẫng quá luôn. buồn dễ sợ, nghĩ rằng không biết sao mình xui xẻo đến vậy. dự tính của mình là đặt thêm đặt thêm 2 quyển như sách này để tặng sinh nhật bạn của mình. vậy nhưng, thất vọng quá! sợ quà tặng nhưng bị lỗi thì không hay cho lắm ạ ?",1,0,0,0
vì review nên tìm đến tác phẩm. nội dung sách sẽ khó phù hợp với thị hiếu chung của độc giả. một cuốn sách hình thức đẹp được giao bởi tiki.,1,0,0,0
"mình thấy mấy bạn đánh giá 5 sao quá trời, mới thử đọc thì đọc được một nửa mình muốn bỏ. sách nói về bối cảnh chiến tranh xoay quanh giữa hiện tại của cụ già 100 tuổi và tuổi thơ của ông. đọc nửa quyển chẳng thấy ấn tượng, đọc xong không đọng lại gì, câu văn nhàm không buồn cười, chẳng dí dỏm nếu muốn thì liên hệ mình bán sách giá giá rẻ lại cho.",1,0,0,0
"đối với mình thì quyển sách này nó chả đem đến 1 bài học gì.1 ông già đầu óc không bình thường từ khi sinh ra đên giờ,kết bạn cùng 1 đám ng,cả đám ng đều mê tiền,làm những chuyện giết người trái đạo đức pháp luật,công tố viên tìm mọi cách để không mất danh tiếng chứ cũng chả vì muốn đem sự thật ra ánh sáng.chánh thanh tra thì cx bị bọn ng đó xỏ mũi mặc dù biết là nhưng ẩn khuất nhưng cx mặc kệ r kết bạn cùng đám ng đó.đến chịu?",1,0,0,0
sách rách. rất bực mình. háo hức chờ quyển sách xong đến lúc nhận thì tả tơi,1,0,0,0
sách in ngược ? đây là sách giả hay gì vậy tiki,1,0,0,0
"dịch bị trùng ý,đang đọc 1 cách cảm hứng và flow thì bị trùng 2 ý này. xem xét tái bản lại. thanks",1,0,0,0
"sách cũ đổi tựa, cuốn này là tâm lý học giải mã hành vi, quá trắng trợn bọn nxb 1980 này",1,0,0,0
sách có vẻ cũ như đã bị dùng qua.,1,0,0,0
sách mình mua bị lỗi thiếu trang từ 349-364 .,1,0,0,0
"cạnh bìa sách bị nhăn. tôi không hài lòng lắm! tôi đã mua sách tại tiki rất nhiều, những lần trước tiki đóng gói sách trong hộp carton rất cẩn thận và đẹp. tôi cảm thấy được tôn trọng và rất hài lòng.",1,0,0,0
"lần đầu tiên thất vọng khi mua sách từ tiki. sách sai chính tả rất nhiều gây khó chịu khi đọc. đặc biệt sách bị thiếu từ trang 2 . vẫn chưa đọc xong, không biết nhưng gặp phải lỗi gì nữa! giá sách thì cao, nhưng chất lượng thì quá tệ",1,0,0,0
"sách in như bản photo, mới đọc được vài chương đầu nhưng lỗi như vậy sao đọc được",1,0,0,0
"tiki giao sách bị rách, rất không hài lòng về sản phẩm",1,0,0,0
"tôi có chọn option gói quà và tặng thiệp, đã đánh dấu 2 ô và ghi chú lời nhắn tặng nhưng cửa sản phẩm giao chỉ cuốn sách trống trơn",0,1,0,0
"bìa đẹp, đóng gói tốt , shipper vui vẻ nhưng giấy mỏng, vàng, chữ nhỏ quá",1,0,0,0
sách in kém sai chính tả nhiều,1,0,0,0
"- in khá chán, mực cảm giác muốn tràn sang cả mặt bên kia. giấy cũng không đẹp. hơi giật mình tự hỏi liệu có phải sản phẩm thiệt không. - nội dung sách thì vốn được đánh giá rất cao, bản này hi vọng dịch hay thì mới đúng giá trị của tác phẩm.",1,0,0,0
"đọc review thấy nhiều người khen, nghe mô tả sơ qua have a sip thấy cũng hấp dẫn khi cuốn sách viết về chủ đề mình cũng quan tâm: mục đích sống là gì, thế nào là chính mình. tuy nhiên khi đọc thì thấy nội dung không được hay lắm khi tác giả đưa ra vấn đề rất hay nhưng cách dẫn dắt các câu hỏi gợi mở và các ví dụ không được sâu và thuyết phục lắm. khiến cho những người đang mông lung khó tự mình tìm ra được câu trả lời. đặc biệt không thích cách dùng dấu /, “ “ quá nhiều, khiến cho cuốn sách thiếu đi sự chắc chắn, gây khó hiểu cho người đọc về dụng ý của tác giả và nhìn rối mắt.",1,0,0,0
"giao sản phẩm nhanh, nội dung tốt nhưng chất lượng in khá kém, chữ mặt sau hằn khá rõ lên mặt trước",1,0,0,0
"hình thức tốt, bìa cứng, giấy phẳng, nhưng đó là tất cả những gì mình thấy tốt về quyển sách này. nội dung hoàn toàn là những lời giáo điều và không thực tế. nó là những nhẫn định và hướng dẫn của tác giả về cách làm thế nào để sống tốt, làm người tốt, làm việc tốt, v.v nhưng lại cực kì một chiều và không hề có cái nhìn toàn diện hay khách quan. tác giả hoàn toàn chỉ đưa cảm nghĩ cá nhân nhưng không hề có một dẫn chứng nào thuyết phục. gần như tất cả những nhận định đều có ""có lẽ"", ""nhiều"", ""đa phần"", v.v là những từ hết sức chung chung và không có tính đại diện. tác giả đề cập đây là một tác phẩm mang tính gợi mở để khiến chúng ta phải tự tìm tòi và tìm câu trả lời cho riêng mình. cái này mình thấy đúng, với điều kiện đừng xuôi theo lập luận của tác giả. nói chung là không đáng đọc.",1,0,0,0
ngoại hình: bìa sách không sạch sẽ. đây là sách mới hay cũ . nội dung: hay,1,0,0,0
lan man là điều rõ nhất mình thấy ở cuốn sách này. một nội dung nhưng cứ nhắc đi nhắc lại đến phát chán. và những tips trong này cũng chẳng nhưng phù hợp nữa. đáng lý 1sao nhưng sách mới bọc plastic nên thêm sao. cuốn sách bán chạy nhất chưa hẳn là cuốn sách hay nhất!,1,0,0,0
"sách đẹp nhưng nội dung thấy bình thường, kiểu cóp nhặt. mình đã từng đọc cha giàu cha nghèo - sách bìa màu đỏ thấy rất hay nên khi chuyển sang cuốn này đọc cảm thấy không được như mong đợi.",1,0,0,0
"nếu phá sản hảy phá sản lớn, nếu điều này ở việt nam không phải là việc phạm pháp thì coi như tốt đi mình thì bôi đen đoạn này để sau con cái không đọc bậy nhưng làm theo",1,0,0,0
mình ngĩ cửa sản phẩm nên thêm bọc chống sốc để bảo vệ các góc của sách trong quá trình vân chuyển,0,0,0,1
"hôm nhận thấy sách cũ, có người đã đọc trước rồi. cũng không so đo làm chi. này đang đọc rớt luôn xấp mười mấy tờ giấy. có nên chăng đền một cuốn mới 100 không nhỉ?",1,0,0,0
"nội dung rất hay và cuốn. sáng nhận sản phẩm. chiều mình đọc liền luôn mấy chục trang. nhưng mới đọc lần đầu, được nhiêu đó thôi nhưng sách bung tè le. lần đầu mình mua sách nhưng bị vậy á",1,0,0,0
"tiki giao nhanh, đóng gói cẩn thận nhưng đọc được 1/2 thì rách gáy thế này, không tin được 2024 rồi nhưng vẫn nhưng tình trạng sách bung gáy",1,0,0,0
nội dung sách hay không cần bàn cãi nhưng chất lượng đóng sách kém ạ. mình nhưng đang đọc nhưng 1 phần gáy sách đã bị bung rớt trang ra khỏi sách. :,1,0,0,0
"bìa sách bị rách, nhưng lại okay",1,0,0,0
sách bung quá nhiều. lần đầu mua sản phẩm bị lỗi trên tiki trading,1,0,0,0
"ch chỉ đọc 3 lần nhưng sách đã bung keo rồi ,thật là thất vọng.",1,0,0,0
giao sản phẩm chậm hơn thời gian cam kết.,0,0,1,0
"sản phẩm giao nhanh, đúng hẹn, đóng gói cẩn thận. nhưng cách viết dịch của sách thì rông dài, khó biểu.",1,0,0,0
"chất lượng sách khá tệ, bung gáy sau khi mở sách",1,0,0,0
"giao hành nhanh, nhưng tiki bookcare bị rách",0,1,0,0
"sản phẩm móp méo, không hài lòng",1,0,0,0
"đánh giá không tính điểm bọc sách bằng bìa bị đâm thủng, hơi tệ trong khâu đóng gói",0,0,0,1
"giao sản phẩm nhanh, chất lượng in của sách kém, bìa sách vừa mua đã bị tróc",1,0,0,0
"lần đầu tiên mua sách của tiki nhưng lỗi chữ luôn á. đọc khó chịu gê. mới đọc quyển tập 1 đọc mấy trang nhưng lỗi 3 chữ đeo kinh viết là đeo kiếng, cửa kính- cửa kiếng không biết do mình mua sale giá giá rẻ nên lỗi hay gì. nhưng đợt này giao sách không được hài lòng cho lắm",1,0,0,0
"sách in quá nhỉều lỗi như mực in không đều, phần chữ và giấy cũng cực kì khó đọc, không xứng với giá tiền như vậy",1,0,0,0
sách vẫn có lỗi chính tả. mua trên tiki nhưng không lẽ vẫn phải sách lậu,1,0,0,0
sách vẫn có lỗi chính tả. mua trên tiki nhưng không lẽ vẫn phải sách lậu,1,0,0,0
"quyển này quá nhiều thiên kiến của tác giả, nhất là vụ săn bắt hái lượm, không hợp lí và logic tí nào, không có bằng chứng hay nghiên cứu nào nhưng chỉ giới hạn trong cảm nhận chủ quan có hạn",1,0,0,0
sách bị méo cong bìa cong sách rất thất vọng,1,0,0,0
"sách in chất lượng thấp. mực nhoè nhoẹt nhiều trang. nội dung không đặc sắc lắm, tạm ổn tốt được thôi. các nhân vật trong truyện cứ tự yêu quý nhau kiểu tác giả bảo tôi thích thế, thiếu chiều sâu tính cách. cho trẻ con đọc thì tạm ổn tốt được, nếu các vị phụ huynh không ngại giải thích về tuyến tình cảm cuối truyện.",1,0,0,0
cũng như cuốn. dưới cánh cửa thầm thì. bản thân thấy không hay. nhưng tiếc tiền mua nên cố đọc cho hết. không biết có đọc được hêtz ko.,1,0,0,0
sách bị móp và hơi cũ so với 2 cuốn nhưng lại,1,0,0,0
tất cả đều oke cho đến khi mình coi kĩ hơn thì bìa bị móp ở góc nhìn khó chịu cực,1,0,0,0
không hay. chắc không hạp. …,1,0,0,0
"cá nhân mình không thích quyển sách này. về mặt nội dung mình thấy tốt, cung cấp đủ các kiến thức cơ bản cho người không có chuyên ngành. tuy nhiên vấn đề là nằm ở lời văn hoặc do cách dịch, đưa ra thang đo kinh tởm, mình cứ thấy việc này nó sai sai, ai có khiếm khuyết nào đó trên cơ thể khi đọc sẽ dễ cảm thấy bị xúc phạm. mình cho 2 sao là vì cách diễn đạt nội dung khiến mình không thoải mái, nhưng lại mọi thứ đều tốt",1,0,0,0
"giao nhanh nhưng sao ẩu vậy tiki ơi ,",0,1,0,0
"tui tưởng bản in màu thì nội dung và hình ảnh bên trong cuốn sách sẽ được in màu nhưng kg quý vị ạ, bản in màu nghĩa là chỉ in màu cái bìa thôi. lạy chúa, tôi đã sốc khi mở ra và nhìn thấy toàn màu đen bên trong các hình🥲",1,0,0,0
"sách đọc khá thú vị, nhưng mới mở ra đọc hai ba chương nhưng đã rớt trang ntn thấy buồn ghê.",1,0,0,0
nd sách thấy không có gì đắc sắc cho lắm,1,0,0,0
"sách cũng chung chung thôi. cảm thấy chưa đủ chuyên sâu, chưa có nhiều kiến thức đặc biệt với ngành y dược . ưu điểm: dễ hiểu. giá giá giá rẻ nên như vậy là tốt rồi.",1,0,0,0
sách thiết kế đẹp nhưng chữ rất bé khó đọc . nội dung mức trung bình,1,0,0,0
"tiki giao sản phẩm nhanh, sách không vấn đề gì, sách đẹp giấy xịn tốt nhưng phần tệ nhất là giọng văn của dịch giả. dùng từ ngữ khó hiểu, ngắt câu ngắn ngủn, câu cú đọc chả hiểu gì nói chung nếu không muốn rước bực vào người như mình thì đừng mua.",1,0,0,0
"dịch quá chán. tôi muốn cho 0 sao nhưng không được nên tôi sẽ cho 1 sao. chưa gặp ở đâu lại dịch “i cautgh the 2oclock bus” thành tôi lấy xe bus lúc 2 giờ chiều”. dịch lôm ca lôm côm, thô thiển. cố gắng diễn đạt sự bất cần của nhân vật nhưng thất bại thảm hại. chốt lại không nên mua, đọc chỉ tổ ức chế.",1,0,0,0
"sách rất đẹp về hình thức. bìa cứng và giấy đẹp. về nội dung sách khá đơn giản. mô tả tình tiết của một thanh niên từ lúc đưa tang mẹ và đến lúc phạm tội. đằng sau đó có thể là tầng sâu diễn biến tâm lý, nhưng người đọc chưa năm bắt ngay được. truyện cũng phả ánh một phần lối sống phương tây thập niên 1940.",1,0,0,0
"chất lượng tốt, người giao sản phẩm tệ 🥺",0,0,1,0
